Unique value count per column:
ReportingDate                     4298
Erkrankungsbeginn                 4819
ReportingWeek                       53
ReportingWeekYear                   26
ReportingCounty                    420
ReportingDistrict                   39
ReportingState                      17
MunicipalityKey                    150
MeldeLandkreis                     420
MeldeLandkreisRegierungsbezirk      39
MeldeLandkreisBundesland            17
CaseDefCategoryComputed              5
FallDefKategorie                     5
ReferenceDefComputed                 1
Referenzdefinition                   1
KlinikVorhanden                      4
ClinicalInfoAvailable                4
OnsetOfDisease                    4819
AgeComputed                         87
AgeMonth                            26
StatusDeceased                       4
DeceasedReason                       2
VerstorbenStatus                     4
VerstorbenGrund                      2
DeceasedDate                         9
ExpositionsortStatus                 4
InfektionsortWo                    504
HospitalisierungStatus               4
StatusPlaceOfInf                     4
PlaceOfInfRegion                   550
StatusHospitalization                4
OutbreakIdRecord                  3151
StatusVaccination                    4
VaccinationCount                     7
ImpfungStatus                        4
ImpfungAnzahl                        7
ImpfungDatum                      1321
PathogenMSV                          9
Genotyp                              9
WHOSequenzID                        69
MethodeAkIgGDelta                    2
MethodeAkIgM                         2
MsvKlassifikation                    8

Value counts for column 'ReportingDate':
ReportingDate
2002-03-04 00:00:00.000    296
2001-05-14 00:00:00.000    291
2001-03-19 00:00:00.000    289
2001-04-30 00:00:00.000    288
2001-05-28 00:00:00.000    284
2002-02-18 00:00:00.000    284
2001-04-09 00:00:00.000    283
2001-04-23 00:00:00.000    280
2001-04-02 00:00:00.000    278
2001-06-18 00:00:00.000    267
2002-02-25 00:00:00.000    265
2002-02-11 00:00:00.000    256
2001-03-26 00:00:00.000    246
2001-05-07 00:00:00.000    246
2002-03-11 00:00:00.000    243
2001-03-05 00:00:00.000    241
2002-01-28 00:00:00.000    236
2001-05-21 00:00:00.000    236
2001-06-04 00:00:00.000    226
2001-04-16 00:00:00.000    216
2002-03-18 00:00:00.000    206
2001-03-12 00:00:00.000    193
2006-04-03 00:00:00.000    178
2002-05-13 00:00:00.000    173
2001-06-25 00:00:00.000    171
2001-06-11 00:00:00.000    168
2006-04-24 00:00:00.000    167
2006-03-27 00:00:00.000    166
2002-04-15 00:00:00.000    159
2002-03-25 00:00:00.000    157
2006-04-10 00:00:00.000    153
2002-02-04 00:00:00.000    152
2002-01-14 00:00:00.000    152
2002-04-08 00:00:00.000    150
2006-04-17 00:00:00.000    145
2002-01-07 00:00:00.000    144
2001-07-02 00:00:00.000    144
2002-04-01 00:00:00.000    142
2002-01-21 00:00:00.000    132
2006-03-20 00:00:00.000    130
2002-04-29 00:00:00.000    124
2006-05-22 00:00:00.000    119
2002-05-06 00:00:00.000    117
2001-02-19 00:00:00.000    116
2001-02-26 00:00:00.000    114
2006-05-01 00:00:00.000    113
2006-03-13 00:00:00.000    111
2002-04-22 00:00:00.000    107
2006-05-15 00:00:00.000    105
2006-05-08 00:00:00.000    104
2001-02-12 00:00:00.000    104
2001-01-29 00:00:00.000    103
2001-12-31 00:00:00.000    103
2001-12-17 00:00:00.000    100
2002-05-27 00:00:00.000    100
2002-06-03 00:00:00.000     97
2008-04-14 00:00:00.000     97
2008-05-05 00:00:00.000     95
2002-05-20 00:00:00.000     92
2006-05-29 00:00:00.000     91
2001-02-05 00:00:00.000     90
2001-12-10 00:00:00.000     89
2003-01-13 00:00:00.000     87
2008-03-31 00:00:00.000     82
2006-06-05 00:00:00.000     81
2001-07-09 00:00:00.000     78
2002-06-10 00:00:00.000     75
2011-04-25 00:00:00.000     74
2002-06-17 00:00:00.000     73
2008-04-28 00:00:00.000     72
2006-03-06 00:00:00.000     71
2002-06-24 00:00:00.000     70
2008-04-21 00:00:00.000     69
2006-06-12 00:00:00.000     66
2001-12-24 00:00:00.000     65
2002-08-19 00:00:00.000     64
2002-07-15 00:00:00.000     61
2001-11-26 00:00:00.000     59
2001-01-22 00:00:00.000     57
2001-07-16 00:00:00.000     57
2006-06-19 00:00:00.000     56
2005-05-30 00:00:00.000     56
2001-07-23 00:00:00.000     55
2003-02-10 00:00:00.000     54
2001-12-03 00:00:00.000     54
2002-07-22 00:00:00.000     54
2002-07-08 00:00:00.000     52
2006-06-26 00:00:00.000     50
2009-03-02 00:00:00.000     49
2008-05-12 00:00:00.000     49
2008-05-26 00:00:00.000     47
2003-01-27 00:00:00.000     47
2011-05-09 00:00:00.000     46
2011-04-11 00:00:00.000     45
2006-02-27 00:00:00.000     44
2002-07-29 00:00:00.000     42
2005-06-27 00:00:00.000     42
2002-07-01 00:00:00.000     42
2001-08-06 00:00:00.000     40
2011-04-18 00:00:00.000     40
2005-05-09 00:00:00.000     39
2010-06-21 00:00:00.000     39
2011-05-23 00:00:00.000     39
2010-03-29 00:00:00.000     38
2013-06-03 00:00:00.000     38
2008-03-24 00:00:00.000     38
2015-03-17 00:00:00.000     37
2006-02-20 00:00:00.000     37
2001-07-30 00:00:00.000     37
2003-03-03 00:00:00.000     37
2011-05-02 00:00:00.000     36
2001-11-12 00:00:00.000     36
2015-03-30 00:00:00.000     36
2005-06-20 00:00:00.000     36
2008-03-17 00:00:00.000     36
2013-05-20 00:00:00.000     36
2007-06-04 00:00:00.000     35
2005-01-10 00:00:00.000     35
2003-06-02 00:00:00.000     35
2001-11-19 00:00:00.000     35
2009-02-09 00:00:00.000     34
2015-03-23 00:00:00.000     34
2007-05-07 00:00:00.000     34
2008-04-07 00:00:00.000     34
2006-07-03 00:00:00.000     34
2005-06-06 00:00:00.000     33
2009-01-26 00:00:00.000     32
2008-05-19 00:00:00.000     32
2015-03-31 00:00:00.000     32
2005-04-18 00:00:00.000     32
2015-03-24 00:00:00.000     32
2005-03-07 00:00:00.000     32
2011-05-16 00:00:00.000     32
2010-04-12 00:00:00.000     32
2015-04-14 00:00:00.000     31
2015-03-16 00:00:00.000     31
2001-01-15 00:00:00.000     31
2005-03-14 00:00:00.000     31
2015-03-02 00:00:00.000     31
2005-05-23 00:00:00.000     30
2009-02-16 00:00:00.000     30
2006-02-13 00:00:00.000     30
2011-03-14 00:00:00.000     30
2007-04-09 00:00:00.000     29
2003-02-24 00:00:00.000     29
2009-02-23 00:00:00.000     29
2015-01-21 00:00:00.000     29
2001-10-15 00:00:00.000     29
2015-02-23 00:00:00.000     29
2015-04-08 00:00:00.000     28
2013-06-19 00:00:00.000     28
2008-06-02 00:00:00.000     28
2007-03-12 00:00:00.000     28
2009-05-04 00:00:00.000     28
2010-06-07 00:00:00.000     28
2013-07-22 00:00:00.000     28
2009-04-20 00:00:00.000     27
2009-04-13 00:00:00.000     27
2013-06-04 00:00:00.000     27
2005-04-04 00:00:00.000     27
2001-08-13 00:00:00.000     27
2003-02-17 00:00:00.000     27
2015-03-03 00:00:00.000     27
2013-05-21 00:00:00.000     26
2015-01-20 00:00:00.000     26
2011-02-07 00:00:00.000     26
2001-11-05 00:00:00.000     26
2011-04-04 00:00:00.000     26
2015-02-24 00:00:00.000     26
2001-10-22 00:00:00.000     26
2009-03-09 00:00:00.000     26
2015-04-02 00:00:00.000     26
2013-05-22 00:00:00.000     26
2008-06-09 00:00:00.000     26
2006-07-10 00:00:00.000     26
2003-06-09 00:00:00.000     26
2003-01-06 00:00:00.000     26
2015-02-13 00:00:00.000     25
2010-11-15 00:00:00.000     25
2005-05-02 00:00:00.000     25
2003-05-19 00:00:00.000     25
2013-05-27 00:00:00.000     25
2015-04-27 00:00:00.000     24
2015-04-10 00:00:00.000     24
2006-07-17 00:00:00.000     24
2013-06-05 00:00:00.000     24
2007-03-19 00:00:00.000     24
2007-04-30 00:00:00.000     24
2010-04-26 00:00:00.000     24
2003-03-17 00:00:00.000     24
2015-04-20 00:00:00.000     24
2011-02-28 00:00:00.000     24
2013-05-14 00:00:00.000     24
2008-03-10 00:00:00.000     24
2015-04-07 00:00:00.000     24
2015-02-19 00:00:00.000     24
2001-08-20 00:00:00.000     24
2015-04-01 00:00:00.000     23
2013-05-13 00:00:00.000     23
2007-04-23 00:00:00.000     23
2010-05-03 00:00:00.000     23
2005-04-11 00:00:00.000     23
2010-05-10 00:00:00.000     23
2001-01-08 00:00:00.000     23
2015-04-21 00:00:00.000     23
2005-02-14 00:00:00.000     23
2015-01-19 00:00:00.000     23
2015-02-12 00:00:00.000     23
2002-11-04 00:00:00.000     23
2009-05-25 00:00:00.000     23
2024-10-02 00:00:00.000     23
2010-05-17 00:00:00.000     22
2002-12-09 00:00:00.000     22
2015-02-10 00:00:00.000     22
2015-04-09 00:00:00.000     22
2003-01-20 00:00:00.000     22
2001-09-10 00:00:00.000     22
2001-08-27 00:00:00.000     22
2007-05-14 00:00:00.000     22
2015-04-06 00:00:00.000     22
2003-05-12 00:00:00.000     22
2013-06-18 00:00:00.000     22
2001-10-29 00:00:00.000     22
2015-02-27 00:00:00.000     22
2011-02-21 00:00:00.000     21
2005-07-18 00:00:00.000     21
2011-03-07 00:00:00.000     21
2005-06-13 00:00:00.000     21
2011-03-21 00:00:00.000     21
2002-09-23 00:00:00.000     21
2003-07-14 00:00:00.000     21
2007-11-26 00:00:00.000     21
2009-02-02 00:00:00.000     21
2013-05-17 00:00:00.000     21
2011-05-22 00:00:00.000     21
2003-04-28 00:00:00.000     21
2010-06-14 00:00:00.000     21
2001-09-03 00:00:00.000     21
2010-03-15 00:00:00.000     21
2015-03-04 00:00:00.000     21
2009-06-01 00:00:00.000     21
2002-11-18 00:00:00.000     21
2007-11-19 00:00:00.000     21
2015-04-13 00:00:00.000     21
2007-04-16 00:00:00.000     21
2007-03-05 00:00:00.000     21
2015-04-28 00:00:00.000     21
2009-03-23 00:00:00.000     20
2015-03-18 00:00:00.000     20
2009-05-18 00:00:00.000     20
2005-04-25 00:00:00.000     20
2005-03-28 00:00:00.000     20
2015-03-13 00:00:00.000     20
2010-07-12 00:00:00.000     20
2005-05-16 00:00:00.000     20
2015-03-26 00:00:00.000     20
2006-01-30 00:00:00.000     20
2006-02-06 00:00:00.000     20
2015-01-16 00:00:00.000     20
2007-06-11 00:00:00.000     20
2015-02-17 00:00:00.000     20
2009-06-15 00:00:00.000     20
2013-05-16 00:00:00.000     20
2003-06-23 00:00:00.000     20
2013-06-10 00:00:00.000     20
2005-02-28 00:00:00.000     20
2013-07-23 00:00:00.000     20
2003-02-03 00:00:00.000     20
2005-03-21 00:00:00.000     19
2006-07-31 00:00:00.000     19
2010-05-24 00:00:00.000     19
2013-05-24 00:00:00.000     19
2001-09-17 00:00:00.000     19
2015-02-25 00:00:00.000     19
2015-02-26 00:00:00.000     19
2007-11-12 00:00:00.000     19
2015-03-05 00:00:00.000     19
2013-05-31 00:00:00.000     19
2015-03-09 00:00:00.000     19
2015-03-19 00:00:00.000     19
2010-11-01 00:00:00.000     19
2009-04-27 00:00:00.000     19
2009-03-30 00:00:00.000     19
2015-03-25 00:00:00.000     19
2007-03-26 00:00:00.000     19
2003-05-05 00:00:00.000     19
2008-03-03 00:00:00.000     19
2010-05-31 00:00:00.000     19
2011-05-12 00:00:00.000     19
2001-10-08 00:00:00.000     18
2001-10-01 00:00:00.000     18
2010-04-19 00:00:00.000     18
2015-03-10 00:00:00.000     18
2013-05-15 00:00:00.000     18
2011-05-25 00:00:00.000     18
2009-05-11 00:00:00.000     18
2015-04-24 00:00:00.000     18
2015-04-16 00:00:00.000     18
2010-08-16 00:00:00.000     18
2001-09-24 00:00:00.000     18
2013-05-18 00:00:00.000     18
2010-04-05 00:00:00.000     17
2015-02-16 00:00:00.000     17
2015-01-22 00:00:00.000     17
2007-05-21 00:00:00.000     17
2003-06-16 00:00:00.000     17
2015-01-13 00:00:00.000     17
2015-03-11 00:00:00.000     17
2009-03-16 00:00:00.000     17
2002-08-26 00:00:00.000     17
2010-11-29 00:00:00.000     17
2015-02-03 00:00:00.000     17
2011-01-24 00:00:00.000     17
2006-01-23 00:00:00.000     17
2013-06-07 00:00:00.000     17
2010-09-27 00:00:00.000     16
2005-01-24 00:00:00.000     16
2013-05-29 00:00:00.000     16
2013-05-28 00:00:00.000     16
2007-02-19 00:00:00.000     16
2015-02-09 00:00:00.000     16
2011-06-06 00:00:00.000     16
2005-02-21 00:00:00.000     16
2015-01-15 00:00:00.000     16
2013-06-06 00:00:00.000     16
2005-01-31 00:00:00.000     16
2015-01-06 00:00:00.000     16
2013-05-23 00:00:00.000     16
2011-03-28 00:00:00.000     15
2011-05-30 00:00:00.000     15
2007-05-28 00:00:00.000     15
2015-02-02 00:00:00.000     15
2015-01-14 00:00:00.000     15
2006-07-24 00:00:00.000     15
2010-06-28 00:00:00.000     15
2011-05-17 00:00:00.000     15
2013-06-12 00:00:00.000     15
2013-05-26 00:00:00.000     15
2015-05-11 00:00:00.000     15
2015-04-22 00:00:00.000     15
2013-06-14 00:00:00.000     15
2002-12-16 00:00:00.000     15
2015-03-21 00:00:00.000     15
2015-01-09 00:00:00.000     15
2015-05-04 00:00:00.000     15
2002-11-11 00:00:00.000     15
2017-04-24 00:00:00.000     15
2015-03-27 00:00:00.000     15
2009-04-06 00:00:00.000     14
2005-01-17 00:00:00.000     14
2013-06-08 00:00:00.000     14
2015-01-07 00:00:00.000     14
2007-12-03 00:00:00.000     14
2007-06-18 00:00:00.000     14
2011-05-26 00:00:00.000     14
2015-04-15 00:00:00.000     14
2015-05-18 00:00:00.000     14
2017-02-23 00:00:00.000     14
2010-12-13 00:00:00.000     14
2010-12-06 00:00:00.000     14
2008-02-11 00:00:00.000     14
2011-02-14 00:00:00.000     14
2013-05-30 00:00:00.000     14
2011-05-27 00:00:00.000     14
2015-04-23 00:00:00.000     14
2010-03-22 00:00:00.000     14
2003-06-30 00:00:00.000     14
2005-02-07 00:00:00.000     14
2007-04-02 00:00:00.000     14
2005-07-04 00:00:00.000     14
2015-05-07 00:00:00.000     14
2015-03-06 00:00:00.000     14
2003-04-07 00:00:00.000     14
2008-02-18 00:00:00.000     13
2013-07-03 00:00:00.000     13
2008-01-28 00:00:00.000     13
2015-03-14 00:00:00.000     13
2011-05-06 00:00:00.000     13
2002-09-02 00:00:00.000     13
2015-01-25 00:00:00.000     13
2003-03-24 00:00:00.000     13
2011-04-30 00:00:00.000     13
2010-02-22 00:00:00.000     13
2010-10-25 00:00:00.000     13
2011-04-22 00:00:00.000     13
2011-05-18 00:00:00.000     13
2015-01-08 00:00:00.000     13
2015-03-20 00:00:00.000     13
2011-01-31 00:00:00.000     13
2015-03-22 00:00:00.000     13
2010-07-05 00:00:00.000     13
2015-01-26 00:00:00.000     12
2013-06-16 00:00:00.000     12
2015-02-05 00:00:00.000     12
2011-04-26 00:00:00.000     12
2010-10-11 00:00:00.000     12
2011-05-31 00:00:00.000     12
2010-08-23 00:00:00.000     12
2013-06-17 00:00:00.000     12
2015-01-05 00:00:00.000     12
2015-02-11 00:00:00.000     12
2015-01-24 00:00:00.000     12
2015-01-23 00:00:00.000     12
2010-03-01 00:00:00.000     12
2011-05-11 00:00:00.000     12
2013-05-19 00:00:00.000     12
2024-09-09 00:00:00.000     12
2011-05-24 00:00:00.000     12
2009-01-19 00:00:00.000     12
2009-01-12 00:00:00.000     12
2015-01-27 00:00:00.000     12
2011-05-21 00:00:00.000     12
2015-05-26 00:00:00.000     12
2006-08-07 00:00:00.000     12
2015-04-30 00:00:00.000     12
2013-07-09 00:00:00.000     12
2005-07-11 00:00:00.000     12
2011-06-04 00:00:00.000     12
2013-07-01 00:00:00.000     12
2015-04-17 00:00:00.000     12
2017-05-04 00:00:00.000     11
2003-07-21 00:00:00.000     11
2017-02-07 00:00:00.000     11
2015-05-13 00:00:00.000     11
2010-10-18 00:00:00.000     11
2013-06-13 00:00:00.000     11
2010-10-04 00:00:00.000     11
2015-05-12 00:00:00.000     11
2013-06-20 00:00:00.000     11
2002-11-25 00:00:00.000     11
2011-05-04 00:00:00.000     11
2013-04-23 00:00:00.000     11
2013-07-08 00:00:00.000     11
2024-09-10 00:00:00.000     11
2002-12-30 00:00:00.000     11
2015-02-04 00:00:00.000     11
2010-11-22 00:00:00.000     11
2015-05-05 00:00:00.000     11
2013-06-26 00:00:00.000     11
2013-06-21 00:00:00.000     11
2015-01-28 00:00:00.000     11
2008-01-21 00:00:00.000     11
2006-09-11 00:00:00.000     11
2013-08-05 00:00:00.000     10
2015-04-11 00:00:00.000     10
2013-07-04 00:00:00.000     10
2011-05-05 00:00:00.000     10
2011-04-05 00:00:00.000     10
2011-04-06 00:00:00.000     10
2013-05-06 00:00:00.000     10
2011-07-11 00:00:00.000     10
2013-06-02 00:00:00.000     10
2011-05-14 00:00:00.000     10
2013-05-25 00:00:00.000     10
2015-02-18 00:00:00.000     10
2011-05-07 00:00:00.000     10
2015-03-01 00:00:00.000     10
2011-04-09 00:00:00.000     10
2003-03-31 00:00:00.000     10
2013-05-01 00:00:00.000     10
2014-12-26 00:00:00.000     10
2016-07-04 00:00:00.000     10
2014-12-16 00:00:00.000     10
2011-05-29 00:00:00.000     10
18.07.2024 11:58            10
2011-05-19 00:00:00.000     10
2015-03-12 00:00:00.000     10
2011-06-12 00:00:00.000     10
2018-06-06 00:00:00.000     10
2011-04-24 00:00:00.000     10
2015-01-12 00:00:00.000     10
2008-06-16 00:00:00.000     10
2008-06-23 00:00:00.000     10
2009-06-22 00:00:00.000     10
2011-06-27 00:00:00.000     10
2010-02-01 00:00:00.000     10
2013-07-12 00:00:00.000      9
2006-09-18 00:00:00.000      9
2004-04-12 00:00:00.000      9
2015-03-15 00:00:00.000      9
2011-05-15 00:00:00.000      9
2011-06-02 00:00:00.000      9
2013-07-17 00:00:00.000      9
2024-07-18 00:00:00.000      9
2011-04-08 00:00:00.000      9
2011-04-12 00:00:00.000      9
2001-01-01 00:00:00.000      9
2011-04-17 00:00:00.000      9
2011-04-21 00:00:00.000      9
2015-05-19 00:00:00.000      9
2015-01-30 00:00:00.000      9
2011-01-10 00:00:00.000      9
2010-02-15 00:00:00.000      9
2011-04-28 00:00:00.000      9
2015-02-06 00:00:00.000      9
2011-05-03 00:00:00.000      9
2013-04-29 00:00:00.000      9
2015-06-03 00:00:00.000      9
2013-04-22 00:00:00.000      9
2015-02-20 00:00:00.000      9
2010-09-20 00:00:00.000      9
2015-06-11 00:00:00.000      9
2011-04-10 00:00:00.000      9
2002-10-28 00:00:00.000      9
2007-02-26 00:00:00.000      9
2013-06-11 00:00:00.000      9
2003-07-07 00:00:00.000      9
2011-06-20 00:00:00.000      9
2011-06-26 00:00:00.000      9
2008-02-25 00:00:00.000      9
2002-12-02 00:00:00.000      9
2015-06-23 00:00:00.000      9
2009-06-08 00:00:00.000      9
2011-06-01 00:00:00.000      9
2007-12-17 00:00:00.000      9
2015-06-29 00:00:00.000      9
2013-06-09 00:00:00.000      8
2010-09-13 00:00:00.000      8
2010-12-20 00:00:00.000      8
2015-05-15 00:00:00.000      8
2005-11-28 00:00:00.000      8
2011-06-11 00:00:00.000      8
2013-04-24 00:00:00.000      8
2003-05-26 00:00:00.000      8
2011-04-29 00:00:00.000      8
2013-04-27 00:00:00.000      8
2002-09-09 00:00:00.000      8
2003-07-28 00:00:00.000      8
2011-05-01 00:00:00.000      8
2013-06-29 00:00:00.000      8
2013-07-02 00:00:00.000      8
2013-08-16 00:00:00.000      8
2013-08-14 00:00:00.000      8
2013-08-19 00:00:00.000      8
2014-12-31 00:00:00.000      8
2011-03-30 00:00:00.000      8
2011-04-27 00:00:00.000      8
2008-01-14 00:00:00.000      8
2008-02-04 00:00:00.000      8
2011-06-05 00:00:00.000      8
2015-01-10 00:00:00.000      8
2019-03-06 00:00:00.000      8
2014-12-29 00:00:00.000      8
2011-06-03 00:00:00.000      8
2013-05-12 00:00:00.000      8
2013-05-07 00:00:00.000      8
2015-04-12 00:00:00.000      8
2018-06-04 00:00:00.000      8
2015-05-21 00:00:00.000      8
2015-05-20 00:00:00.000      8
2013-06-23 00:00:00.000      8
2018-06-12 00:00:00.000      8
2013-06-22 00:00:00.000      8
2016-05-31 00:00:00.000      8
2013-11-04 00:00:00.000      8
2011-06-09 00:00:00.000      8
2011-01-17 00:00:00.000      8
2002-09-16 00:00:00.000      8
2006-08-14 00:00:00.000      8
2015-04-29 00:00:00.000      8
2010-01-25 00:00:00.000      8
2013-07-16 00:00:00.000      8
2015-02-21 00:00:00.000      8
2003-03-10 00:00:00.000      8
2013-04-16 00:00:00.000      8
2007-02-12 00:00:00.000      8
2002-10-14 00:00:00.000      8
2015-02-22 00:00:00.000      8
2011-07-21 00:00:00.000      8
2015-03-08 00:00:00.000      8
2017-01-24 00:00:00.000      8
2015-03-07 00:00:00.000      8
2013-06-28 00:00:00.000      8
2011-05-28 00:00:00.000      7
2017-02-28 00:00:00.000      7
2013-07-13 00:00:00.000      7
2011-06-10 00:00:00.000      7
2013-06-15 00:00:00.000      7
2013-07-11 00:00:00.000      7
2003-08-04 00:00:00.000      7
2011-01-03 00:00:00.000      7
2024-07-15 00:00:00.000      7
2013-07-15 00:00:00.000      7
2015-02-01 00:00:00.000      7
2015-05-08 00:00:00.000      7
2003-12-01 00:00:00.000      7
2013-05-09 00:00:00.000      7
2015-05-02 00:00:00.000      7
2013-09-02 00:00:00.000      7
2016-06-21 00:00:00.000      7
2002-08-12 00:00:00.000      7
2015-01-17 00:00:00.000      7
2013-06-25 00:00:00.000      7
2013-09-05 00:00:00.000      7
28.08.2024 08:43             7
2013-08-30 00:00:00.000      7
2013-04-10 00:00:00.000      7
2014-12-24 00:00:00.000      7
2017-04-11 00:00:00.000      7
2011-05-13 00:00:00.000      7
2019-03-05 00:00:00.000      7
2010-02-08 00:00:00.000      7
2015-06-17 00:00:00.000      7
2015-01-02 00:00:00.000      7
2011-06-19 00:00:00.000      7
2013-04-19 00:00:00.000      7
2013-07-10 00:00:00.000      7
2011-05-20 00:00:00.000      7
2011-07-13 00:00:00.000      7
2015-03-28 00:00:00.000      7
2015-06-16 00:00:00.000      7
2015-06-04 00:00:00.000      7
2013-07-29 00:00:00.000      7
2013-04-26 00:00:00.000      7
2011-07-10 00:00:00.000      7
2008-08-18 00:00:00.000      7
2011-04-15 00:00:00.000      7
2011-04-16 00:00:00.000      7
2013-07-25 00:00:00.000      7
2013-04-15 00:00:00.000      7
2013-07-24 00:00:00.000      7
2014-12-21 00:00:00.000      7
2010-11-08 00:00:00.000      7
2006-01-16 00:00:00.000      7
2011-05-10 00:00:00.000      7
2003-12-08 00:00:00.000      7
2015-02-08 00:00:00.000      7
2011-06-17 00:00:00.000      7
2011-06-16 00:00:00.000      7
2011-06-29 00:00:00.000      6
2011-07-12 00:00:00.000      6
2011-06-08 00:00:00.000      6
2013-09-09 00:00:00.000      6
2013-06-27 00:00:00.000      6
2013-09-16 00:00:00.000      6
2011-07-18 00:00:00.000      6
2013-06-01 00:00:00.000      6
2012-05-08 00:00:00.000      6
2024-02-06 00:00:00.000      6
2011-07-20 00:00:00.000      6
2011-04-19 00:00:00.000      6
2013-07-31 00:00:00.000      6
2018-07-09 00:00:00.000      6
2013-09-04 00:00:00.000      6
2013-05-11 00:00:00.000      6
2018-04-23 00:00:00.000      6
2013-08-06 00:00:00.000      6
2013-04-17 00:00:00.000      6
2013-08-07 00:00:00.000      6
2013-08-09 00:00:00.000      6
2013-08-12 00:00:00.000      6
2013-04-28 00:00:00.000      6
2011-05-08 00:00:00.000      6
2013-04-30 00:00:00.000      6
2011-08-04 00:00:00.000      6
2013-08-22 00:00:00.000      6
2024-07-26 00:00:00.000      6
2011-06-13 00:00:00.000      6
2013-05-02 00:00:00.000      6
2024-07-23 00:00:00.000      6
2024-04-08 00:00:00.000      6
2013-11-06 00:00:00.000      6
2011-07-30 00:00:00.000      6
2011-07-28 00:00:00.000      6
2013-06-24 00:00:00.000      6
2013-10-06 00:00:00.000      6
2013-05-08 00:00:00.000      6
2013-05-10 00:00:00.000      6
2013-08-20 00:00:00.000      6
2019-03-01 00:00:00.000      6
2011-04-07 00:00:00.000      6
15.01.2019 13:15             6
2010-03-08 00:00:00.000      6
2006-09-04 00:00:00.000      6
2005-10-24 00:00:00.000      6
2006-10-02 00:00:00.000      6
2024-08-29 00:00:00.000      6
2024-08-31 00:00:00.000      6
2024-09-02 00:00:00.000      6
2003-04-21 00:00:00.000      6
2008-09-22 00:00:00.000      6
2015-03-29 00:00:00.000      6
2015-04-03 00:00:00.000      6
2015-07-07 00:00:00.000      6
2019-02-07 00:00:00.000      6
2007-12-10 00:00:00.000      6
2007-11-05 00:00:00.000      6
2007-10-29 00:00:00.000      6
2007-10-15 00:00:00.000      6
2015-06-19 00:00:00.000      6
2004-05-03 00:00:00.000      6
2024-11-04 00:00:00.000      6
2015-06-01 00:00:00.000      6
2002-09-30 00:00:00.000      6
2024-08-30 00:00:00.000      6
2005-11-07 00:00:00.000      6
2015-05-06 00:00:00.000      6
2006-01-09 00:00:00.000      6
2011-03-22 00:00:00.000      6
2015-07-29 00:00:00.000      6
2014-12-30 00:00:00.000      6
2015-01-18 00:00:00.000      6
2011-04-02 00:00:00.000      6
2015-01-31 00:00:00.000      6
2010-12-27 00:00:00.000      6
2015-01-03 00:00:00.000      6
2017-06-06 00:00:00.000      6
2017-05-15 00:00:00.000      6
2019-01-15 00:00:00.000      6
2010-07-19 00:00:00.000      6
2006-08-28 00:00:00.000      6
2017-05-24 00:00:00.000      6
2018-05-28 00:00:00.000      5
2020-01-23 00:00:00.000      5
2018-06-01 00:00:00.000      5
2004-09-27 00:00:00.000      5
2015-05-27 00:00:00.000      5
2017-03-10 00:00:00.000      5
2013-09-19 00:00:00.000      5
2018-05-22 00:00:00.000      5
2012-05-07 00:00:00.000      5
2015-05-22 00:00:00.000      5
2005-01-03 00:00:00.000      5
2011-04-13 00:00:00.000      5
2011-08-15 00:00:00.000      5
2018-06-05 00:00:00.000      5
2017-02-13 00:00:00.000      5
2014-06-05 00:00:00.000      5
2018-06-11 00:00:00.000      5
2013-10-23 00:00:00.000      5
2014-06-04 00:00:00.000      5
2017-03-01 00:00:00.000      5
2018-06-25 00:00:00.000      5
2018-06-26 00:00:00.000      5
2017-02-17 00:00:00.000      5
2017-05-17 00:00:00.000      5
2023-11-15 00:00:00.000      5
2017-02-21 00:00:00.000      5
2013-08-13 00:00:00.000      5
2004-01-19 00:00:00.000      5
2004-07-26 00:00:00.000      5
2017-05-29 00:00:00.000      5
2002-12-23 00:00:00.000      5
2002-10-21 00:00:00.000      5
2018-04-09 00:00:00.000      5
2013-04-05 00:00:00.000      5
2013-04-06 00:00:00.000      5
2002-08-05 00:00:00.000      5
2013-04-18 00:00:00.000      5
2019-03-18 00:00:00.000      5
2013-08-02 00:00:00.000      5
2019-02-20 00:00:00.000      5
2019-03-14 00:00:00.000      5
2013-05-03 00:00:00.000      5
2019-02-25 00:00:00.000      5
2019-03-11 00:00:00.000      5
2016-03-11 00:00:00.000      5
2019-03-07 00:00:00.000      5
2003-08-11 00:00:00.000      5
2015-07-14 00:00:00.000      5
2015-07-13 00:00:00.000      5
2015-07-10 00:00:00.000      5
2018-05-09 00:00:00.000      5
2017-03-14 00:00:00.000      5
2013-08-01 00:00:00.000      5
2019-02-04 00:00:00.000      5
2004-07-05 00:00:00.000      5
2015-06-09 00:00:00.000      5
2017-05-18 00:00:00.000      5
2013-07-19 00:00:00.000      5
2015-06-15 00:00:00.000      5
2004-04-26 00:00:00.000      5
2013-07-14 00:00:00.000      5
2011-08-05 00:00:00.000      5
2015-07-03 00:00:00.000      5
2013-02-25 00:00:00.000      5
2018-04-03 00:00:00.000      5
2017-01-23 00:00:00.000      5
2013-10-09 00:00:00.000      5
2014-12-17 00:00:00.000      5
2008-09-15 00:00:00.000      5
2014-12-28 00:00:00.000      5
2015-04-19 00:00:00.000      5
2014-12-20 00:00:00.000      5
2008-07-14 00:00:00.000      5
2015-01-29 00:00:00.000      5
2014-12-27 00:00:00.000      5
2006-12-11 00:00:00.000      5
2011-04-20 00:00:00.000      5
2016-08-18 00:00:00.000      5
2011-07-23 00:00:00.000      5
2014-12-15 00:00:00.000      5
2014-12-22 00:00:00.000      5
2015-04-25 00:00:00.000      5
2014-12-18 00:00:00.000      5
2015-02-15 00:00:00.000      5
2008-08-25 00:00:00.000      5
2015-04-18 00:00:00.000      5
2011-07-19 00:00:00.000      5
2015-01-01 00:00:00.000      5
2014-12-10 00:00:00.000      5
2015-04-05 00:00:00.000      5
2017-05-09 00:00:00.000      5
2010-01-11 00:00:00.000      5
2010-01-18 00:00:00.000      5
2011-07-04 00:00:00.000      5
2014-12-23 00:00:00.000      4
2013-08-15 00:00:00.000      4
2014-12-25 00:00:00.000      4
2006-12-18 00:00:00.000      4
2013-03-18 00:00:00.000      4
2019-04-09 00:00:00.000      4
2018-05-13 00:00:00.000      4
2011-06-23 00:00:00.000      4
2004-11-01 00:00:00.000      4
2017-03-13 00:00:00.000      4
2013-08-23 00:00:00.000      4
2004-11-15 00:00:00.000      4
2013-08-21 00:00:00.000      4
2024-08-28 00:00:00.000      4
2015-05-28 00:00:00.000      4
2018-05-18 00:00:00.000      4
2011-07-02 00:00:00.000      4
2011-07-01 00:00:00.000      4
2015-05-24 00:00:00.000      4
2013-09-17 00:00:00.000      4
2015-05-25 00:00:00.000      4
2018-04-05 00:00:00.000      4
2024-09-04 00:00:00.000      4
2011-06-30 00:00:00.000      4
2013-09-10 00:00:00.000      4
2017-05-22 00:00:00.000      4
2024-10-01 00:00:00.000      4
2015-05-03 00:00:00.000      4
2024-05-02 00:00:00.000      4
2011-08-01 00:00:00.000      4
2004-12-27 00:00:00.000      4
2015-07-17 00:00:00.000      4
2024-03-04 00:00:00.000      4
2008-09-08 00:00:00.000      4
2004-05-24 00:00:00.000      4
2018-05-03 00:00:00.000      4
2024-09-25 00:00:00.000      4
2015-07-09 00:00:00.000      4
2017-04-05 00:00:00.000      4
2015-07-08 00:00:00.000      4
2004-04-05 00:00:00.000      4
2004-03-15 00:00:00.000      4
2018-04-26 00:00:00.000      4
2018-03-30 00:00:00.000      4
2024-09-18 00:00:00.000      4
2004-02-09 00:00:00.000      4
2013-07-06 00:00:00.000      4
2003-10-20 00:00:00.000      4
2007-12-31 00:00:00.000      4
2007-09-24 00:00:00.000      4
2015-06-25 00:00:00.000      4
2003-11-03 00:00:00.000      4
2018-03-08 00:00:00.000      4
2024-03-21 00:00:00.000      4
2018-04-04 00:00:00.000      4
2013-07-20 00:00:00.000      4
2015-06-05 00:00:00.000      4
2019-04-08 00:00:00.000      4
2007-01-15 00:00:00.000      4
2018-05-11 00:00:00.000      4
2003-08-25 00:00:00.000      4
2016-06-15 00:00:00.000      4
2007-06-25 00:00:00.000      4
2007-07-09 00:00:00.000      4
2015-04-26 00:00:00.000      4
2011-06-15 00:00:00.000      4
2013-07-30 00:00:00.000      4
2013-07-27 00:00:00.000      4
2013-07-26 00:00:00.000      4
2015-06-10 00:00:00.000      4
2003-09-08 00:00:00.000      4
2015-06-12 00:00:00.000      4
2016-06-17 00:00:00.000      4
2013-09-20 00:00:00.000      4
2011-07-03 00:00:00.000      4
2013-09-29 00:00:00.000      4
2016-05-25 00:00:00.000      4
2016-05-19 00:00:00.000      4
2015-02-07 00:00:00.000      4
2019-03-19 00:00:00.000      4
2016-05-24 00:00:00.000      4
2001-07-06 00:00:00.000      4
2014-04-24 00:00:00.000      4
2014-04-22 00:00:00.000      4
2023-03-20 00:00:00.000      4
2014-06-10 00:00:00.000      4
2010-08-30 00:00:00.000      4
28.04.2023 12:48             4
2024-10-08 00:00:00.000      4
2018-07-16 00:00:00.000      4
2014-03-14 00:00:00.000      4
2014-03-03 00:00:00.000      4
2013-04-21 00:00:00.000      4
2015-05-14 00:00:00.000      4
2018-04-13 00:00:00.000      4
2011-07-14 00:00:00.000      4
2019-01-25 00:00:00.000      4
2019-03-04 00:00:00.000      4
2011-07-29 00:00:00.000      4
2014-12-06 00:00:00.000      4
2011-04-14 00:00:00.000      4
2017-06-02 00:00:00.000      4
2014-10-29 00:00:00.000      4
2011-07-27 00:00:00.000      4
2011-03-27 00:00:00.000      4
2011-04-23 00:00:00.000      4
2020-02-04 00:00:00.000      4
2014-10-15 00:00:00.000      4
2019-03-12 00:00:00.000      4
2014-09-02 00:00:00.000      4
2016-05-09 00:00:00.000      4
2011-03-10 00:00:00.000      4
2013-05-04 00:00:00.000      4
2015-05-17 00:00:00.000      4
2011-07-17 00:00:00.000      4
2005-10-17 00:00:00.000      4
2013-04-03 00:00:00.000      4
2019-03-28 00:00:00.000      4
2017-08-15 00:00:00.000      4
2014-12-19 00:00:00.000      4
2017-04-18 00:00:00.000      4
2002-10-07 00:00:00.000      4
2024-08-27 00:00:00.000      4
2011-07-06 00:00:00.000      4
2015-02-14 00:00:00.000      4
2005-08-08 00:00:00.000      4
2011-07-05 00:00:00.000      4
2013-04-02 00:00:00.000      4
2005-08-01 00:00:00.000      4
2013-10-04 00:00:00.000      4
2017-03-06 00:00:00.000      4
2013-10-29 00:00:00.000      4
2003-12-15 00:00:00.000      4
2006-10-09 00:00:00.000      4
2006-10-23 00:00:00.000      4
2017-05-26 00:00:00.000      4
2010-07-26 00:00:00.000      4
2006-09-25 00:00:00.000      4
2018-06-22 00:00:00.000      4
2010-08-02 00:00:00.000      4
2005-10-10 00:00:00.000      4
2016-05-01 00:00:00.000      3
02.04.2019 06:42             3
2019-03-25 00:00:00.000      3
2016-04-27 00:00:00.000      3
2016-04-28 00:00:00.000      3
2016-05-28 00:00:00.000      3
2016-06-13 00:00:00.000      3
2024-04-18 00:00:00.000      3
2015-06-30 00:00:00.000      3
2019-03-29 00:00:00.000      3
2019-03-22 00:00:00.000      3
2016-04-19 00:00:00.000      3
2015-04-04 00:00:00.000      3
2019-02-12 00:00:00.000      3
2015-07-20 00:00:00.000      3
2019-03-13 00:00:00.000      3
2019-06-25 00:00:00.000      3
2015-02-28 00:00:00.000      3
2018-04-17 00:00:00.000      3
2019-02-22 00:00:00.000      3
2019-03-21 00:00:00.000      3
2015-09-23 00:00:00.000      3
2017-03-27 00:00:00.000      3
2016-05-27 00:00:00.000      3
2016-06-02 00:00:00.000      3
2015-08-12 00:00:00.000      3
2015-07-16 00:00:00.000      3
2015-07-15 00:00:00.000      3
2019-01-11 00:00:00.000      3
2015-05-09 00:00:00.000      3
2016-06-22 00:00:00.000      3
2018-07-11 00:00:00.000      3
2014-05-12 00:00:00.000      3
2014-04-30 00:00:00.000      3
2014-04-25 00:00:00.000      3
2017-02-16 00:00:00.000      3
2014-04-07 00:00:00.000      3
2014-04-05 00:00:00.000      3
2014-03-31 00:00:00.000      3
2014-03-13 00:00:00.000      3
2018-07-05 00:00:00.000      3
2017-02-15 00:00:00.000      3
2017-02-22 00:00:00.000      3
2017-02-24 00:00:00.000      3
2018-06-27 00:00:00.000      3
2013-12-10 00:00:00.000      3
2013-11-15 00:00:00.000      3
2013-11-14 00:00:00.000      3
2018-06-21 00:00:00.000      3
2013-11-12 00:00:00.000      3
2014-05-21 00:00:00.000      3
2018-07-30 00:00:00.000      3
2016-07-13 00:00:00.000      3
2017-01-25 00:00:00.000      3
2019-09-24 00:00:00.000      3
2015-05-10 00:00:00.000      3
2014-12-04 00:00:00.000      3
2014-11-13 00:00:00.000      3
2019-04-30 00:00:00.000      3
2014-10-27 00:00:00.000      3
2014-12-13 00:00:00.000      3
2020-02-03 00:00:00.000      3
2017-01-30 00:00:00.000      3
2014-06-26 00:00:00.000      3
2020-02-17 00:00:00.000      3
2014-08-26 00:00:00.000      3
2019-04-29 00:00:00.000      3
2019-04-24 00:00:00.000      3
2014-08-19 00:00:00.000      3
2014-08-11 00:00:00.000      3
2014-07-16 00:00:00.000      3
2016-11-30 00:00:00.000      3
2016-07-19 00:00:00.000      3
2018-06-14 00:00:00.000      3
2015-06-24 00:00:00.000      3
02.05.2018 14:01             3
2024-02-21 00:00:00.000      3
2016-06-27 00:00:00.000      3
2013-08-08 00:00:00.000      3
2019-01-23 00:00:00.000      3
2018-05-07 00:00:00.000      3
2016-08-15 00:00:00.000      3
2013-07-21 00:00:00.000      3
2024-03-25 00:00:00.000      3
2018-05-02 00:00:00.000      3
2013-08-29 00:00:00.000      3
2016-08-22 00:00:00.000      3
2019-02-06 00:00:00.000      3
2018-04-27 00:00:00.000      3
2017-03-21 00:00:00.000      3
2015-06-21 00:00:00.000      3
2015-06-22 00:00:00.000      3
2018-04-20 00:00:00.000      3
2018-04-19 00:00:00.000      3
2013-08-28 00:00:00.000      3
2015-05-31 00:00:00.000      3
12.06.2018 14:58             3
2018-06-02 00:00:00.000      3
2019-01-29 00:00:00.000      3
2013-10-22 00:00:00.000      3
02.03.2017 12:46             3
2013-10-15 00:00:00.000      3
2013-10-14 00:00:00.000      3
2013-10-07 00:00:00.000      3
2013-10-05 00:00:00.000      3
2013-10-02 00:00:00.000      3
2018-05-31 00:00:00.000      3
2013-09-06 00:00:00.000      3
2017-03-07 00:00:00.000      3
2015-05-23 00:00:00.000      3
2013-09-18 00:00:00.000      3
2013-09-15 00:00:00.000      3
2017-03-09 00:00:00.000      3
2018-05-23 00:00:00.000      3
2016-08-03 00:00:00.000      3
2013-09-07 00:00:00.000      3
2013-08-11 00:00:00.000      3
2013-04-20 00:00:00.000      3
2011-03-18 00:00:00.000      3
2011-06-14 00:00:00.000      3
2011-06-22 00:00:00.000      3
2024-08-07 00:00:00.000      3
2011-06-21 00:00:00.000      3
2009-07-20 00:00:00.000      3
2024-07-17 00:00:00.000      3
2011-06-18 00:00:00.000      3
2017-04-20 00:00:00.000      3
2007-01-29 00:00:00.000      3
2007-08-06 00:00:00.000      3
2010-01-04 00:00:00.000      3
2007-07-30 00:00:00.000      3
2011-09-09 00:00:00.000      3
2007-07-16 00:00:00.000      3
2007-07-02 00:00:00.000      3
2011-06-24 00:00:00.000      3
2011-08-30 00:00:00.000      3
2024-11-18 00:00:00.000      3
2004-08-02 00:00:00.000      3
2017-11-20 00:00:00.000      3
2024-08-12 00:00:00.000      3
2024-12-16 00:00:00.000      3
2007-10-08 00:00:00.000      3
2001-07-19 00:00:00.000      3
2007-10-22 00:00:00.000      3
2011-06-28 00:00:00.000      3
2010-01-23 00:00:00.000      3
2017-05-30 00:00:00.000      3
2012-02-23 00:00:00.000      3
2010-02-04 00:00:00.000      3
2024-07-16 00:00:00.000      3
2008-01-07 00:00:00.000      3
2012-07-03 00:00:00.000      3
2007-01-08 00:00:00.000      3
2011-07-15 00:00:00.000      3
2011-04-01 00:00:00.000      3
2024-07-19 00:00:00.000      3
2004-02-16 00:00:00.000      3
2004-02-02 00:00:00.000      3
2003-10-13 00:00:00.000      3
2012-05-10 00:00:00.000      3
2017-07-19 00:00:00.000      3
2012-05-23 00:00:00.000      3
2017-04-07 00:00:00.000      3
2003-11-10 00:00:00.000      3
2003-11-17 00:00:00.000      3
2017-12-11 00:00:00.000      3
2012-05-13 00:00:00.000      3
2011-04-03 00:00:00.000      3
2003-11-24 00:00:00.000      3
2012-05-26 00:00:00.000      3
2003-09-22 00:00:00.000      3
2012-05-27 00:00:00.000      3
2017-04-10 00:00:00.000      3
2011-03-31 00:00:00.000      3
2009-10-12 00:00:00.000      3
2004-03-08 00:00:00.000      3
2003-09-01 00:00:00.000      3
2024-06-05 00:00:00.000      3
2011-03-26 00:00:00.000      3
2006-01-02 00:00:00.000      3
2006-11-20 00:00:00.000      3
2011-03-23 00:00:00.000      3
2003-04-14 00:00:00.000      3
2004-04-19 00:00:00.000      3
2007-01-01 00:00:00.000      3
2004-05-31 00:00:00.000      3
2017-06-16 00:00:00.000      3
2017-04-12 00:00:00.000      3
2013-03-19 00:00:00.000      3
28.10.2024 15:56             3
2010-09-06 00:00:00.000      3
2011-08-09 00:00:00.000      3
2024-07-01 00:00:00.000      3
2013-03-12 00:00:00.000      3
2013-03-13 00:00:00.000      3
2010-08-09 00:00:00.000      3
2011-07-25 00:00:00.000      3
2005-09-05 00:00:00.000      3
2024-09-13 00:00:00.000      3
2013-03-28 00:00:00.000      3
2005-08-22 00:00:00.000      3
2008-06-30 00:00:00.000      3
2011-08-08 00:00:00.000      3
2017-07-10 00:00:00.000      3
2013-04-07 00:00:00.000      3
2013-03-04 00:00:00.000      3
2008-07-07 00:00:00.000      3
2011-12-10 00:00:00.000      3
2024-07-05 00:00:00.000      3
2013-04-11 00:00:00.000      3
2013-04-12 00:00:00.000      3
2009-08-17 00:00:00.000      3
2024-08-26 00:00:00.000      3
2013-04-25 00:00:00.000      3
2008-09-01 00:00:00.000      3
2017-05-05 00:00:00.000      3
2017-03-28 00:00:00.000      3
2008-12-29 00:00:00.000      3
2013-05-05 00:00:00.000      3
2018-04-11 00:00:00.000      3
2011-07-24 00:00:00.000      3
2018-02-14 00:00:00.000      3
2010-02-09 00:00:00.000      3
2017-08-10 00:00:00.000      3
2013-01-23 00:00:00.000      3
2011-11-17 00:00:00.000      3
2005-09-26 00:00:00.000      3
2011-08-19 00:00:00.000      3
2011-08-20 00:00:00.000      3
2018-01-15 00:00:00.000      3
2014-02-01 00:00:00.000      2
2005-12-05 00:00:00.000      2
21.04.2023 13:16             2
02.01.2019 15:20             2
2019-01-28 00:00:00.000      2
2011-11-29 00:00:00.000      2
2014-04-01 00:00:00.000      2
2011-10-09 00:00:00.000      2
2019-04-23 00:00:00.000      2
2011-03-29 00:00:00.000      2
2013-12-05 00:00:00.000      2
2023-10-16 18:50:10.097      2
2014-03-25 00:00:00.000      2
2011-10-16 00:00:00.000      2
26.09.2023 14:20             2
2014-02-21 00:00:00.000      2
2013-11-29 00:00:00.000      2
2014-03-23 00:00:00.000      2
17.03.2023 08:54             2
2014-04-15 00:00:00.000      2
2015-05-16 00:00:00.000      2
2014-04-14 00:00:00.000      2
2011-03-19 00:00:00.000      2
2016-07-20 00:00:00.000      2
2011-10-03 00:00:00.000      2
2017-12-28 00:00:00.000      2
2016-07-29 00:00:00.000      2
2024-10-28 00:00:00.000      2
2019-04-18 00:00:00.000      2
2017-02-27 00:00:00.000      2
2023-09-13 09:10:09.013      2
2005-11-21 00:00:00.000      2
25.09.2023 12:16             2
2017-02-26 00:00:00.000      2
2017-05-11 00:00:00.000      2
25.09.2023 12:21             2
2023-11-21 00:00:00.000      2
11.05.2023 08:34             2
2011-03-20 00:00:00.000      2
01.08.2023 08:28             2
2014-02-15 00:00:00.000      2
2014-03-05 00:00:00.000      2
2017-02-20 00:00:00.000      2
2016-07-11 00:00:00.000      2
2014-02-17 00:00:00.000      2
2005-09-12 00:00:00.000      2
2018-06-29 00:00:00.000      2
2005-12-26 00:00:00.000      2
2014-02-18 00:00:00.000      2
2018-07-10 00:00:00.000      2
2005-09-19 00:00:00.000      2
2014-02-25 00:00:00.000      2
2018-07-02 00:00:00.000      2
2014-02-24 00:00:00.000      2
25.10.2023 13:21             2
30.05.2023 15:27             2
22.05.2023 08:51             2
2023-10-26 00:00:00.000      2
2024-07-11 00:00:00.000      2
15.05.2023 12:05             2
2014-03-19 00:00:00.000      2
2011-11-21 00:00:00.000      2
2014-03-17 00:00:00.000      2
2016-07-26 00:00:00.000      2
2011-10-19 00:00:00.000      2
2019-04-25 00:00:00.000      2
2014-02-13 00:00:00.000      2
2011-11-07 00:00:00.000      2
2011-11-19 00:00:00.000      2
2005-12-12 00:00:00.000      2
2019-04-15 00:00:00.000      2
2014-03-12 00:00:00.000      2
2013-12-14 00:00:00.000      2
2014-03-10 00:00:00.000      2
2005-10-31 00:00:00.000      2
2019-08-27 00:00:00.000      2
2024-08-21 00:00:00.000      2
2023-03-11 00:00:00.000      2
2011-08-26 00:00:00.000      2
2011-08-14 00:00:00.000      2
2011-08-22 00:00:00.000      2
2008-03-26 00:00:00.000      2
2020-02-06 00:00:00.000      2
2019-05-27 00:00:00.000      2
2019-05-24 00:00:00.000      2
2011-07-16 00:00:00.000      2
2017-01-31 00:00:00.000      2
2014-10-02 00:00:00.000      2
2018-12-17 00:00:00.000      2
2017-08-01 00:00:00.000      2
2014-09-26 00:00:00.000      2
23.01.2017 15:41             2
2014-09-24 00:00:00.000      2
2017-02-02 00:00:00.000      2
2011-07-08 00:00:00.000      2
2014-09-18 00:00:00.000      2
2016-08-29 00:00:00.000      2
2011-07-07 00:00:00.000      2
2017-02-03 00:00:00.000      2
2018-09-13 00:00:00.000      2
2020-03-05 00:00:00.000      2
2011-06-25 00:00:00.000      2
06.03.2020 06:50             2
2020-01-30 00:00:00.000      2
2011-08-13 00:00:00.000      2
2011-09-30 00:00:00.000      2
2014-11-15 00:00:00.000      2
2018-11-19 00:00:00.000      2
2016-09-09 00:00:00.000      2
2019-05-29 00:00:00.000      2
2008-08-04 00:00:00.000      2
2014-11-27 00:00:00.000      2
2014-12-11 00:00:00.000      2
2014-11-22 00:00:00.000      2
2014-11-19 00:00:00.000      2
2014-11-18 00:00:00.000      2
2019-11-25 00:00:00.000      2
2017-01-11 00:00:00.000      2
2017-01-13 00:00:00.000      2
2018-10-01 00:00:00.000      2
2017-01-16 00:00:00.000      2
2014-11-10 00:00:00.000      2
2014-12-12 00:00:00.000      2
2017-01-17 00:00:00.000      2
2017-01-19 00:00:00.000      2
2024-09-06 00:00:00.000      2
19.01.2017 15:09             2
2008-04-01 00:00:00.000      2
2014-10-31 00:00:00.000      2
2024-07-31 00:00:00.000      2
28.05.2019 11:38             2
2007-10-01 00:00:00.000      2
2016-09-14 00:00:00.000      2
2018-09-06 00:00:00.000      2
2019-05-06 00:00:00.000      2
2011-09-15 00:00:00.000      2
2011-09-18 00:00:00.000      2
2005-07-25 00:00:00.000      2
2011-06-07 00:00:00.000      2
2017-11-28 00:00:00.000      2
2016-08-04 00:00:00.000      2
2014-05-23 00:00:00.000      2
2011-09-23 00:00:00.000      2
2014-05-20 00:00:00.000      2
2006-11-06 00:00:00.000      2
2014-05-14 00:00:00.000      2
2014-05-09 00:00:00.000      2
2007-09-10 00:00:00.000      2
2014-05-08 00:00:00.000      2
2018-07-25 00:00:00.000      2
2019-01-24 00:00:00.000      2
2014-05-05 00:00:00.000      2
2019-05-02 00:00:00.000      2
2024-07-22 00:00:00.000      2
2006-10-16 00:00:00.000      2
23.11.2022 11:44             2
2016-08-01 00:00:00.000      2
2014-04-23 00:00:00.000      2
2022-12-07 14:48:30.000      2
2024-07-24 00:00:00.000      2
2014-06-12 00:00:00.000      2
2017-07-27 00:00:00.000      2
2014-06-16 00:00:00.000      2
2018-09-04 00:00:00.000      2
2020-03-11 00:00:00.000      2
2018-08-31 00:00:00.000      2
2007-09-03 00:00:00.000      2
2014-08-22 00:00:00.000      2
2007-08-27 00:00:00.000      2
2024-09-30 00:00:00.000      2
2014-08-15 00:00:00.000      2
2007-08-13 00:00:00.000      2
2014-08-12 00:00:00.000      2
2011-09-02 00:00:00.000      2
2017-02-09 00:00:00.000      2
2014-07-28 00:00:00.000      2
2018-08-22 00:00:00.000      2
2019-05-13 00:00:00.000      2
2007-07-23 00:00:00.000      2
2014-07-15 00:00:00.000      2
2018-08-09 00:00:00.000      2
2007-02-05 00:00:00.000      2
2014-06-25 00:00:00.000      2
2016-08-09 00:00:00.000      2
2015-05-01 00:00:00.000      2
2006-12-04 00:00:00.000      2
2011-09-20 00:00:00.000      2
2011-03-16 00:00:00.000      2
13.12.2023 16:09             2
2016-06-06 00:00:00.000      2
2015-07-30 00:00:00.000      2
2019-03-26 00:00:00.000      2
2012-07-23 00:00:00.000      2
2016-06-08 00:00:00.000      2
2024-03-26 00:00:00.000      2
2015-08-05 00:00:00.000      2
2016-09-27 00:00:00.000      2
2019-02-13 00:00:00.000      2
2015-08-10 00:00:00.000      2
2018-03-13 00:00:00.000      2
2011-02-24 00:00:00.000      2
2017-04-06 00:00:00.000      2
2019-03-27 00:00:00.000      2
2017-03-16 00:00:00.000      2
2015-08-18 00:00:00.000      2
2015-08-21 00:00:00.000      2
23.01.2015 13:00             2
2012-08-27 00:00:00.000      2
2011-02-13 00:00:00.000      2
2015-09-16 00:00:00.000      2
2016-06-01 00:00:00.000      2
2001-07-22 00:00:00.000      2
2011-02-11 00:00:00.000      2
2001-07-13 00:00:00.000      2
2013-07-18 00:00:00.000      2
2012-07-16 00:00:00.000      2
2016-05-26 00:00:00.000      2
2024-09-03 00:00:00.000      2
2012-06-05 00:00:00.000      2
2012-06-11 00:00:00.000      2
2003-08-18 00:00:00.000      2
2024-02-29 00:00:00.000      2
2013-08-03 00:00:00.000      2
29.02.2024 08:46             2
2011-03-12 00:00:00.000      2
2016-09-22 00:00:00.000      2
2016-06-16 00:00:00.000      2
2018-01-03 00:00:00.000      2
2015-07-18 00:00:00.000      2
2019-04-01 00:00:00.000      2
2015-07-28 00:00:00.000      2
2003-02-19 00:00:00.000      2
2024-03-12 00:00:00.000      2
2024-05-31 00:00:00.000      2
2015-07-24 00:00:00.000      2
2024-03-15 00:00:00.000      2
2017-05-23 00:00:00.000      2
2012-07-02 00:00:00.000      2
2011-03-04 00:00:00.000      2
2017-09-11 00:00:00.000      2
2019-02-11 00:00:00.000      2
2012-07-10 00:00:00.000      2
2001-07-11 00:00:00.000      2
2017-05-03 00:00:00.000      2
2003-09-15 00:00:00.000      2
2018-04-06 00:00:00.000      2
2013-03-17 00:00:00.000      2
2019-03-08 00:00:00.000      2
2016-05-03 00:00:00.000      2
2013-03-23 00:00:00.000      2
2013-03-25 00:00:00.000      2
2017-05-02 00:00:00.000      2
2017-06-01 00:00:00.000      2
2016-04-29 00:00:00.000      2
2017-06-12 00:00:00.000      2
2017-03-29 00:00:00.000      2
2010-02-13 00:00:00.000      2
2018-04-16 00:00:00.000      2
2013-03-11 00:00:00.000      2
2010-02-17 00:00:00.000      2
2013-04-01 00:00:00.000      2
26.02.2019 14:22             2
2010-05-22 00:00:00.000      2
2013-04-13 00:00:00.000      2
2013-04-14 00:00:00.000      2
2016-04-04 00:00:00.000      2
2025-02-27 00:00:00.000      2
2016-04-20 00:00:00.000      2
2017-08-24 00:00:00.000      2
2018-04-12 00:00:00.000      2
2016-05-04 00:00:00.000      2
2017-03-30 00:00:00.000      2
2018-03-22 00:00:00.000      2
2025-02-03 00:00:00.000      2
2018-04-24 00:00:00.000      2
2019-01-21 00:00:00.000      2
2024-08-14 00:00:00.000      2
2016-05-21 00:00:00.000      2
2016-05-20 00:00:00.000      2
2018-03-27 00:00:00.000      2
2013-07-07 00:00:00.000      2
2012-12-06 00:00:00.000      2
2017-03-23 00:00:00.000      2
2013-07-05 00:00:00.000      2
28.04.2017 07:07             2
2017-09-04 00:00:00.000      2
2016-05-06 00:00:00.000      2
2019-03-15 00:00:00.000      2
2018-04-18 00:00:00.000      2
2012-12-10 00:00:00.000      2
2024-05-15 00:00:00.000      2
2013-06-30 00:00:00.000      2
2019-01-18 00:00:00.000      2
2019-01-17 00:00:00.000      2
2017-04-03 00:00:00.000      2
2001-05-11 00:00:00.000      2
2010-09-17 00:00:00.000      2
2017-03-31 00:00:00.000      2
2012-06-03 00:00:00.000      2
2017-06-26 00:00:00.000      2
2024-02-26 00:00:00.000      2
2004-08-30 00:00:00.000      2
2016-09-19 00:00:00.000      2
2004-11-08 00:00:00.000      2
2004-09-20 00:00:00.000      2
2018-01-17 00:00:00.000      2
2015-06-02 00:00:00.000      2
2012-02-29 00:00:00.000      2
2013-10-08 00:00:00.000      2
2016-06-29 00:00:00.000      2
2024-06-18 00:00:00.000      2
2012-03-06 00:00:00.000      2
2018-01-22 00:00:00.000      2
2024-06-17 00:00:00.000      2
2015-05-29 00:00:00.000      2
2004-08-16 00:00:00.000      2
2013-10-01 00:00:00.000      2
2013-09-28 00:00:00.000      2
2015-06-08 00:00:00.000      2
2012-05-28 00:00:00.000      2
2015-01-11 00:00:00.000      2
2013-09-26 00:00:00.000      2
2013-09-25 00:00:00.000      2
2013-09-24 00:00:00.000      2
2011-03-13 00:00:00.000      2
2018-05-29 00:00:00.000      2
2018-06-09 00:00:00.000      2
2024-01-25 00:00:00.000      2
2013-09-22 00:00:00.000      2
2004-12-13 00:00:00.000      2
2013-11-19 00:00:00.000      2
20.12.2023 07:11             2
2024-07-08 00:00:00.000      2
2013-11-11 00:00:00.000      2
2013-11-08 00:00:00.000      2
2018-06-20 00:00:00.000      2
2017-05-16 00:00:00.000      2
2018-06-19 00:00:00.000      2
2017-04-19 00:00:00.000      2
2013-11-05 00:00:00.000      2
2019-08-20 00:00:00.000      2
2018-06-16 00:00:00.000      2
2018-06-10 00:00:00.000      2
2018-06-15 00:00:00.000      2
27.05.2015 06:52             2
2016-09-16 00:00:00.000      2
2019-05-31 13:27:04.017      2
2019-04-11 00:00:00.000      2
2004-12-06 00:00:00.000      2
2016-07-02 00:00:00.000      2
2012-02-08 00:00:00.000      2
2013-10-21 00:00:00.000      2
2019-04-10 00:00:00.000      2
2004-11-29 00:00:00.000      2
2024-11-19 00:00:00.000      2
2018-05-30 00:00:00.000      2
2004-06-21 00:00:00.000      2
2015-06-26 10:15:38.000      2
2013-09-11 00:00:00.000      2
2004-03-01 00:00:00.000      2
2012-05-06 00:00:00.000      2
2012-05-09 00:00:00.000      2
2019-04-03 00:00:00.000      2
2019-08-08 00:00:00.000      2
18.05.2018 07:52             2
2012-05-12 00:00:00.000      2
2013-09-03 00:00:00.000      2
2012-05-14 00:00:00.000      2
2004-01-12 00:00:00.000      2
2012-05-17 00:00:00.000      2
2013-08-27 00:00:00.000      2
2012-04-30 00:00:00.000      2
2009-09-21 00:00:00.000      2
2013-08-26 00:00:00.000      2
2013-08-25 00:00:00.000      2
2017-03-12 00:00:00.000      2
2018-05-15 00:00:00.000      2
2016-06-20 00:00:00.000      2
2009-09-28 00:00:00.000      2
2003-10-27 00:00:00.000      2
2003-10-06 00:00:00.000      2
2017-06-29 00:00:00.000      2
2013-08-17 00:00:00.000      2
2018-05-14 00:00:00.000      2
2013-09-12 00:00:00.000      2
2008-12-08 00:00:00.000      2
2015-06-18 00:00:00.000      2
2018-02-06 00:00:00.000      2
2019-04-04 00:00:00.000      2
2018-05-24 00:00:00.000      2
2012-04-14 00:00:00.000      2
2019-04-05 00:00:00.000      2
2012-04-19 00:00:00.000      2
2024-11-26 00:00:00.000      2
2012-04-20 00:00:00.000      2
2018-02-05 00:00:00.000      2
2004-05-10 00:00:00.000      2
2015-06-14 00:00:00.000      2
2004-03-22 00:00:00.000      2
2018-02-07 00:00:00.000      2
31.01.2018 11:23             2
2004-06-14 00:00:00.000      2
2013-09-13 00:00:00.000      2
2017-08-09 00:00:00.000      1
17.08.2017 11:43             1
21.01.2019 14:42             1
2017-08-03 00:00:00.000      1
11.08.2017 10:54             1
21.01.2019 16:20             1
2017-08-14 00:00:00.000      1
21.01.2019 12:18             1
08.08.2017 09:38             1
2019-01-21 11:23:02.073      1
03.08.2017 08:22             1
08.08.2017 11:49             1
03.08.2017 08:37             1
21.01.2019 15:56             1
04.08.2017 08:18             1
21.01.2019 15:50             1
10.08.2017 15:24             1
07.08.2017 10:19             1
16.01.2019 10:46             1
21.01.2019 14:20             1
16.01.2019 09:34             1
21.01.2019 14:39             1
11.08.2017 10:07             1
03.08.2017 16:40             1
2017-08-07 14:11:56.073      1
21.01.2019 14:24             1
21.01.2019 14:31             1
21.01.2019 14:23             1
2017-08-07 00:00:00.000      1
07.08.2017 13:36             1
21.01.2019 14:26             1
04.08.2017 08:07             1
11.04.2018 18:00             1
02.08.2017 10:58             1
13.02.2019 08:10             1
19.02.2019 08:44             1
2019-02-19 00:00:00.000      1
2017-06-20 00:00:00.000      1
20.06.2017 08:01             1
18.02.2019 14:01             1
2017-06-21 00:00:00.000      1
2019-02-18 00:00:00.000      1
14.02.2019 10:28             1
14.02.2019 09:40             1
2019-02-14 00:00:00.000      1
2017-06-21 17:06:58.027      1
22.06.2017 08:09             1
19.02.2019 10:42             1
22.06.2017 11:17             1
08.02.2019 13:25             1
22.06.2017 12:48             1
08.02.2019 12:50             1
07.02.2019 14:37             1
22.06.2017 13:00             1
22.06.2017 14:54             1
26.06.2017 07:03             1
2017-06-26 13:56:41.030      1
26.06.2017 14:13             1
06.02.2019 12:28             1
2017-06-19 00:00:00.000      1
16.06.2017 07:35             1
02.08.2017 09:25             1
25.02.2019 07:53             1
07.06.2017 06:59             1
2017-06-07 07:21:53.020      1
2017-06-08 00:00:00.000      1
2019-02-27 00:00:00.000      1
26.02.2019 15:05             1
25.02.2019 15:54             1
08.06.2017 15:41             1
09.06.2017 09:17             1
2017-06-12 11:53:04.077      1
12.06.2017 13:52             1
25.02.2019 15:33             1
13.06.2017 06:49             1
2019-02-19 12:05:57.047      1
13.06.2017 07:01             1
13.06.2017 13:15             1
2019-02-24 00:00:00.000      1
2017-06-14 00:00:00.000      1
21.02.2019 15:43             1
14.06.2017 07:37             1
20.02.2019 09:41             1
20.02.2019 07:05             1
2017-06-15 00:00:00.000      1
16.06.2017 07:17             1
19.02.2019 15:38             1
06.02.2019 07:59             1
2017-06-30 00:00:00.000      1
2019-02-05 00:00:00.000      1
21.01.2019 17:00             1
22.01.2019 11:48             1
22.01.2019 11:46             1
27.07.2017 14:32             1
2017-07-28 00:00:00.000      1
28.07.2017 08:33             1
22.01.2019 11:44             1
22.01.2019 11:42             1
2017-07-31 00:00:00.000      1
22.01.2019 10:22             1
31.07.2017 08:07             1
31.07.2017 12:31             1
21.01.2019 16:55             1
04.02.2019 14:45             1
21.01.2019 16:49             1
01.08.2017 07:33             1
21.01.2019 16:46             1
01.08.2017 08:04             1
01.08.2017 08:23             1
01.08.2017 08:42             1
21.01.2019 16:43             1
01.08.2017 10:16             1
01.08.2017 10:35             1
21.01.2019 16:39             1
01.08.2017 14:09             1
22.01.2019 14:58             1
23.01.2019 11:20             1
26.07.2017 10:37             1
2017-07-25 00:00:00.000      1
04.07.2017 14:07             1
2017-07-04 18:29:45.077      1
2017-07-05 00:00:00.000      1
01.02.2019 11:38             1
01.02.2019 07:13             1
2019-02-01 00:00:00.000      1
31.01.2019 16:02             1
31.01.2019 13:41             1
11.07.2017 11:58             1
2019-01-31 00:00:00.000      1
2019-01-30 00:00:00.000      1
28.01.2019 09:58             1
15.01.2019 09:03             1
28.01.2019 07:29             1
12.07.2017 14:33             1
28.01.2019 07:18             1
2017-07-14 00:00:00.000      1
2019-01-27 00:00:00.000      1
25.01.2019 18:48             1
14.07.2017 11:06             1
2017-07-15 00:00:00.000      1
2017-07-17 00:00:00.000      1
24.07.2017 06:49             1
2019-01-28 07:59:35.093      1
2018-09-28 00:00:00.000      1
23.08.2017 09:31             1
12.02.2018 09:13             1
20.02.2018 13:11             1
20.02.2018 07:28             1
15.05.2018 11:53             1
2018-05-16 00:00:00.000      1
2018-02-19 00:00:00.000      1
2018-02-13 00:00:00.000      1
2018-05-17 00:00:00.000      1
2018-02-12 14:21:57.070      1
18.05.2018 09:33             1
07.05.2018 09:48             1
2018-05-20 00:00:00.000      1
2018-02-12 00:00:00.000      1
2018-05-21 00:00:00.000      1
22.05.2018 09:37             1
22.05.2018 13:33             1
23.05.2018 07:01             1
23.05.2018 11:42             1
02.02.2018 12:18             1
20.02.2018 16:49             1
20.02.2018 17:06             1
14.05.2018 16:27             1
14.05.2018 10:40             1
05.03.2018 17:28             1
2018-05-08 00:00:00.000      1
08.05.2018 09:44             1
02.03.2018 16:09             1
2018-03-02 00:00:00.000      1
01.03.2018 16:48             1
09.05.2018 17:04             1
01.03.2018 16:33             1
2018-03-01 00:00:00.000      1
26.02.2018 08:57             1
23.02.2018 11:51             1
22.02.2018 11:17             1
22.02.2018 07:17             1
2018-02-21 00:00:00.000      1
11.05.2018 19:42             1
14.05.2018 10:38             1
20.02.2018 17:09             1
23.05.2018 11:53             1
23.05.2018 15:30             1
24.05.2018 12:06             1
15.01.2018 10:46             1
11.06.2018 13:03             1
2018-01-11 00:00:00.000      1
09.01.2018 15:41             1
2018-06-13 00:00:00.000      1
2018-01-09 00:00:00.000      1
14.06.2018 11:27             1
05.01.2018 08:54             1
2018-06-18 00:00:00.000      1
2018-01-04 00:00:00.000      1
2018-06-19 13:51:30.017      1
20.06.2018 07:22             1
2018-01-03 07:14:28.060      1
21.06.2018 07:55             1
22.06.2018 11:29             1
22.06.2018 13:22             1
02.01.2018 17:19             1
2018-01-02 00:00:00.000      1
15.01.2018 09:56             1
16.01.2018 10:16             1
24.05.2018 16:23             1
16.01.2018 10:36             1
2018-02-01 00:00:00.000      1
28.05.2018 11:26             1
2018-01-31 00:00:00.000      1
29.05.2018 09:32             1
2018-01-30 00:00:00.000      1
30.05.2018 14:43             1
2018-01-29 00:00:00.000      1
26.01.2018 07:05             1
2018-01-23 00:00:00.000      1
22.01.2018 07:49             1
22.01.2018 07:30             1
2018-01-18 00:00:00.000      1
05.06.2018 07:36             1
2018-06-08 00:00:00.000      1
08.06.2018 10:37             1
08.06.2018 12:26             1
08.06.2018 12:28             1
07.05.2018 10:12             1
05.03.2018 17:31             1
23.08.2017 15:34             1
27.03.2018 17:08             1
03.04.2018 15:31             1
03.04.2018 10:40             1
2018-04-17 08:14:12.033      1
17.04.2018 13:29             1
2018-04-02 00:00:00.000      1
28.03.2018 16:10             1
27.03.2018 17:11             1
17.04.2018 13:53             1
27.03.2018 17:04             1
2018-03-06 00:00:00.000      1
27.03.2018 15:55             1
18.04.2018 07:20             1
2018-03-27 10:21:06.020      1
18.04.2018 08:38             1
27.03.2018 07:27             1
2018-03-26 00:00:00.000      1
2018-04-21 00:00:00.000      1
2018-04-22 00:00:00.000      1
03.04.2018 17:32             1
2018-04-04 16:16:22.070      1
16.04.2018 13:35             1
04.04.2018 16:49             1
10.04.2018 16:53             1
13.04.2018 11:14             1
2018-04-10 00:00:00.000      1
09.04.2018 16:47             1
13.04.2018 11:22             1
2019-02-28 00:00:00.000      1
13.04.2018 11:24             1
09.04.2018 16:43             1
2018-04-09 16:39:03.067      1
2018-04-14 00:00:00.000      1
2018-04-06 14:59:37.087      1
16.04.2018 06:53             1
05.04.2018 16:46             1
16.04.2018 12:44             1
05.04.2018 14:45             1
05.04.2018 13:50             1
04.04.2018 17:01             1
23.03.2018 12:19             1
23.04.2018 10:22             1
23.04.2018 14:50             1
30.04.2018 11:37             1
2018-05-01 00:00:00.000      1
2018-03-14 00:00:00.000      1
13.03.2018 08:05             1
02.05.2018 13:14             1
02.05.2018 16:39             1
2018-03-09 00:00:00.000      1
07.03.2018 14:40             1
2018-05-03 09:50:55.067      1
2018-05-03 10:33:04.090      1
2018-03-07 12:05:59.097      1
2018-05-04 00:00:00.000      1
07.03.2018 11:33             1
04.05.2018 10:29             1
2018-03-07 00:00:00.000      1
06.03.2018 15:23             1
2018-05-05 00:00:00.000      1
06.03.2018 10:11             1
30.04.2018 14:09             1
30.04.2018 10:38             1
24.04.2018 11:11             1
30.04.2018 08:56             1
24.04.2018 14:22             1
24.04.2018 14:34             1
25.04.2018 11:15             1
25.04.2018 13:47             1
20.03.2018 11:01             1
2018-03-20 00:00:00.000      1
26.04.2018 14:58             1
2018-04-26 15:15:36.010      1
19.03.2018 14:21             1
19.03.2018 11:27             1
27.04.2018 09:02             1
15.03.2018 17:56             1
27.04.2018 11:34             1
2018-03-15 11:21:18.013      1
2018-04-30 00:00:00.000      1
2018-03-15 00:00:00.000      1
14.03.2018 12:04             1
26.06.2018 11:43             1
27.06.2018 08:06             1
27.06.2018 08:24             1
2018-12-11 00:00:00.000      1
12.10.2017 10:49             1
2018-11-20 00:00:00.000      1
11.10.2017 16:23             1
2018-11-29 00:00:00.000      1
29.11.2018 11:38             1
2018-12-03 00:00:00.000      1
2018-12-04 00:00:00.000      1
2018-12-05 00:00:00.000      1
13.12.2018 13:59             1
28.12.2017 14:41             1
09.10.2017 17:18             1
2017-10-06 00:00:00.000      1
2018-12-20 00:00:00.000      1
20.12.2018 15:44             1
2018-12-27 00:00:00.000      1
02.01.2019 08:45             1
2019-01-03 00:00:00.000      1
03.01.2019 14:29             1
2017-10-23 14:05:55.020      1
14.11.2018 07:34             1
24.10.2017 08:11             1
2018-11-08 00:00:00.000      1
11.04.2018 17:03             1
2017-10-26 00:00:00.000      1
01.10.2018 09:00             1
24.10.2017 11:03             1
2018-10-02 00:00:00.000      1
2018-10-02 14:46:54.047      1
04.10.2018 13:49             1
09.10.2018 15:32             1
11.10.2018 14:44             1
2018-10-15 14:46:41.067      1
19.10.2018 09:36             1
2018-10-22 00:00:00.000      1
2018-10-25 00:00:00.000      1
25.10.2018 08:55             1
2018-10-31 00:00:00.000      1
2018-11-01 00:00:00.000      1
2018-11-03 00:00:00.000      1
07.01.2019 09:00             1
28.09.2017 09:02             1
07.01.2019 09:15             1
08.01.2019 10:41             1
2019-01-09 00:00:00.000      1
04.09.2017 06:53             1
09.01.2019 15:03             1
2019-01-10 00:00:00.000      1
01.09.2017 10:53             1
10.01.2019 09:49             1
01.09.2017 10:48             1
2017-09-01 00:00:00.000      1
2017-08-31 09:24:37.080      1
11.01.2019 08:26             1
2019-01-14 00:00:00.000      1
30.08.2017 13:25             1
14.01.2019 10:54             1
14.01.2019 11:52             1
29.08.2017 16:23             1
28.08.2017 08:42             1
2017-08-25 00:00:00.000      1
2017-09-05 00:00:00.000      1
05.09.2017 07:53             1
07.01.2019 13:59             1
2017-09-06 00:00:00.000      1
07.01.2019 14:23             1
07.01.2019 14:30             1
07.01.2019 14:35             1
2017-09-26 00:00:00.000      1
07.01.2019 14:51             1
07.01.2019 14:52             1
07.01.2019 14:56             1
2017-09-22 00:00:00.000      1
2017-09-15 00:00:00.000      1
14.09.2017 08:26             1
2019-01-08 00:00:00.000      1
2017-09-13 00:00:00.000      1
08.01.2019 09:37             1
08.01.2019 10:36             1
08.01.2019 10:39             1
06.09.2017 16:19             1
06.09.2017 09:48             1
2018-09-24 14:59:38.003      1
2017-10-27 00:00:00.000      1
24.09.2018 14:52             1
11.07.2018 09:25             1
12.07.2018 15:49             1
2018-07-13 00:00:00.000      1
2017-12-22 00:00:00.000      1
2017-12-21 00:00:00.000      1
2018-07-17 00:00:00.000      1
2018-07-17 14:35:43.047      1
18.07.2018 14:07             1
2017-12-15 00:00:00.000      1
2018-07-20 00:00:00.000      1
20.07.2018 07:16             1
20.07.2018 08:00             1
2017-12-13 00:00:00.000      1
07.12.2017 11:46             1
20.07.2018 10:02             1
24.07.2018 12:56             1
24.07.2018 13:37             1
2017-12-04 00:00:00.000      1
2017-12-27 00:00:00.000      1
2018-07-10 08:01:51.057      1
26.07.2018 14:58             1
10.07.2018 08:00             1
27.06.2018 08:29             1
02.07.2018 11:44             1
02.07.2018 16:26             1
02.07.2018 16:38             1
02.07.2018 16:42             1
02.07.2018 16:45             1
02.07.2018 16:50             1
2018-07-02 17:55:53.067      1
2018-07-03 00:00:00.000      1
03.07.2018 06:46             1
03.07.2018 15:40             1
04.07.2018 09:00             1
27.12.2017 11:37             1
05.07.2018 13:40             1
2018-07-06 00:00:00.000      1
2018-07-07 00:00:00.000      1
2018-07-08 00:00:00.000      1
2018-07-26 11:44:07.027      1
2018-07-27 00:00:00.000      1
24.09.2018 13:17             1
2018-08-29 00:00:00.000      1
29.08.2018 08:44             1
29.08.2018 10:18             1
2018-09-05 00:00:00.000      1
06.09.2018 12:48             1
06.09.2018 14:58             1
2017-11-06 00:00:00.000      1
2018-09-07 00:00:00.000      1
2018-09-11 00:00:00.000      1
11.09.2018 14:25             1
13.09.2018 10:45             1
18.09.2018 07:23             1
18.09.2018 15:59             1
2018-09-19 00:00:00.000      1
2018-09-20 00:00:00.000      1
20.09.2018 08:35             1
20.09.2018 14:47             1
24.09.2018 13:02             1
20.11.2017 13:51             1
28.08.2018 14:04             1
27.07.2018 08:00             1
28.08.2018 13:29             1
2018-07-31 00:00:00.000      1
01.08.2018 10:22             1
02.08.2018 08:55             1
03.08.2018 07:57             1
03.08.2018 11:28             1
2017-11-27 00:00:00.000      1
06.08.2018 10:04             1
2018-08-08 00:00:00.000      1
10.08.2018 11:31             1
2018-08-13 00:00:00.000      1
2017-11-22 00:00:00.000      1
16.08.2018 08:14             1
2018-08-20 00:00:00.000      1
2018-08-21 00:00:00.000      1
2018-08-23 00:00:00.000      1
24.08.2018 11:21             1
2018-08-28 13:15:58.090      1
2000-01-31 00:00:00.000      1
17.08.2023 06:35             1
01.03.2019 11:32             1
15.05.2024 06:48             1
08.05.2024 10:11             1
2024-05-10 00:00:00.000      1
11.05.2024 15:09             1
13.05.2024 12:58             1
13.05.2024 13:57             1
14.05.2024 11:31             1
14.05.2024 14:21             1
15.05.2024 06:41             1
2024-05-15 06:46:48.067      1
15.05.2024 11:49             1
12.06.2024 11:48             1
15.05.2024 12:04             1
16.05.2024 08:21             1
16.05.2024 09:02             1
16.05.2024 09:05             1
2024-05-17 00:00:00.000      1
17.05.2024 07:39             1
17.05.2024 09:06             1
17.05.2024 12:29             1
19.05.2024 12:14             1
2024-05-08 00:00:00.000      1
07.05.2024 12:24             1
06.05.2024 06:41             1
06.05.2024 06:39             1
22.04.2024 10:19             1
22.04.2024 15:11             1
2024-04-23 00:00:00.000      1
23.04.2024 14:00             1
25.04.2024 06:52             1
26.04.2024 08:21             1
26.04.2024 09:36             1
29.04.2024 10:36             1
29.04.2024 13:11             1
29.04.2024 13:29             1
30.04.2024 07:57             1
30.04.2024 14:53             1
02.05.2024 06:42             1
02.05.2024 09:26             1
2024-05-03 00:00:00.000      1
03.05.2024 07:28             1
2024-05-03 13:01:14.017      1
04.05.2024 12:56             1
06.05.2024 06:36             1
2024-05-21 00:00:00.000      1
2024-05-21 07:24:27.040      1
2024-05-21 08:11:57.027      1
05.06.2024 06:56             1
05.06.2024 11:12             1
06.06.2024 06:52             1
06.06.2024 08:56             1
06.06.2024 09:02             1
06.06.2024 11:21             1
06.06.2024 13:36             1
06.06.2024 13:46             1
2024-06-06 13:59:38.090      1
06.06.2024 14:04             1
2024-06-07 00:00:00.000      1
07.06.2024 07:54             1
07.06.2024 14:34             1
2024-06-10 06:18:23.033      1
10.06.2024 06:30             1
2024-06-11 00:00:00.000      1
11.06.2024 14:16             1
11.06.2024 14:18             1
2024-06-12 00:00:00.000      1
12.06.2024 08:45             1
05.06.2024 09:39             1
04.06.2024 08:39             1
21.05.2024 15:25             1
03.06.2024 15:42             1
22.05.2024 08:19             1
22.05.2024 11:41             1
22.05.2024 13:50             1
2024-05-23 00:00:00.000      1
23.05.2024 08:20             1
23.05.2024 09:05             1
24.05.2024 08:16             1
27.05.2024 12:18             1
27.05.2024 12:23             1
27.05.2024 15:00             1
27.05.2024 16:07             1
28.05.2024 16:16             1
29.05.2024 09:04             1
31.05.2024 09:13             1
31.05.2024 11:17             1
31.05.2024 15:17             1
2024-06-02 00:00:00.000      1
2024-06-03 00:00:00.000      1
03.06.2024 09:37             1
2024-04-22 07:01:41.043      1
2024-04-22 06:23:05.010      1
22.04.2024 06:20             1
23.02.2024 16:01             1
2024-03-05 00:00:00.000      1
2024-03-05 16:17:40.020      1
06.03.2024 12:58             1
2024-03-07 00:00:00.000      1
2024-03-11 14:40:55.093      1
13.03.2024 08:30             1
2024-03-18 00:00:00.000      1
2024-03-20 00:00:00.000      1
20.03.2024 06:31             1
20.03.2024 11:35             1
20.03.2024 15:27             1
25.03.2024 07:55             1
26.03.2024 10:08             1
27.03.2024 14:49             1
28.03.2024 14:43             1
2024-04-02 00:00:00.000      1
03.04.2024 06:32             1
05.04.2024 07:25             1
05.04.2024 10:05             1
2024-03-01 00:00:00.000      1
2024-02-23 00:00:00.000      1
08.04.2024 09:50             1
22.02.2024 10:26             1
14.02.2024 08:30             1
14.02.2024 13:22             1
14.02.2024 14:05             1
15.02.2024 14:37             1
2024-02-15 22:53:08.017      1
16.02.2024 09:39             1
16.02.2024 13:37             1
19.02.2024 06:32             1
19.02.2024 09:48             1
20.02.2024 11:28             1
20.02.2024 16:36             1
21.02.2024 08:48             1
21.02.2024 14:13             1
21.02.2024 15:24             1
2024-02-22 00:00:00.000      1
22.02.2024 05:51             1
22.02.2024 05:52             1
22.02.2024 05:54             1
2024-02-22 10:15:45.097      1
08.04.2024 07:25             1
08.04.2024 09:52             1
2024-04-22 00:00:00.000      1
15.04.2024 09:03             1
16.04.2024 06:26             1
16.04.2024 09:34             1
16.04.2024 10:57             1
17.04.2024 06:18             1
17.04.2024 06:22             1
17.04.2024 10:52             1
17.04.2024 12:29             1
17.04.2024 12:35             1
17.04.2024 14:13             1
18.04.2024 06:55             1
18.04.2024 07:02             1
18.04.2024 07:08             1
18.04.2024 11:55             1
18.04.2024 15:04             1
19.04.2024 08:58             1
19.04.2024 08:59             1
19.04.2024 09:02             1
19.04.2024 09:05             1
21.04.2024 20:04             1
15.04.2024 09:22             1
2024-04-14 12:16:45.050      1
08.04.2024 09:55             1
14.04.2024 11:39             1
08.04.2024 09:58             1
08.04.2024 10:04             1
08.04.2024 10:19             1
08.04.2024 15:00             1
2024-04-09 00:00:00.000      1
2024-04-10 00:00:00.000      1
10.04.2024 07:19             1
10.04.2024 07:37             1
10.04.2024 08:23             1
10.04.2024 08:58             1
10.04.2024 13:24             1
11.04.2024 10:55             1
11.04.2024 12:42             1
11.04.2024 12:55             1
2024-04-12 06:26:18.033      1
12.04.2024 06:46             1
12.04.2024 11:51             1
12.04.2024 13:58             1
14.04.2024 11:04             1
12.06.2024 09:21             1
13.06.2024 04:55             1
04.03.2019 13:54             1
15.10.2024 09:03             1
2024-09-23 00:00:00.000      1
23.09.2024 09:09             1
2024-09-24 00:00:00.000      1
25.09.2024 10:37             1
30.09.2024 11:31             1
02.10.2024 15:15             1
04.10.2024 11:22             1
2024-10-11 00:00:00.000      1
14.10.2024 15:52             1
15.10.2024 09:17             1
13.06.2024 15:22             1
15.10.2024 09:29             1
2024-10-17 00:00:00.000      1
2024-10-21 00:00:00.000      1
2024-10-22 00:00:00.000      1
2024-10-25 00:00:00.000      1
28.10.2024 11:35             1
2024-10-29 00:00:00.000      1
2024-11-05 00:00:00.000      1
2024-11-08 00:00:00.000      1
2024-09-20 00:00:00.000      1
2024-09-19 00:00:00.000      1
17.09.2024 15:34             1
17.09.2024 14:34             1
04.09.2024 12:23             1
04.09.2024 12:35             1
04.09.2024 12:58             1
04.09.2024 14:16             1
05.09.2024 12:41             1
05.09.2024 12:50             1
05.09.2024 12:53             1
2024-09-07 00:00:00.000      1
09.09.2024 06:24             1
09.09.2024 13:40             1
09.09.2024 14:41             1
10.09.2024 10:27             1
2024-09-11 00:00:00.000      1
11.09.2024 14:13             1
12.09.2024 09:41             1
12.09.2024 14:38             1
2024-09-16 00:00:00.000      1
16.09.2024 10:32             1
17.09.2024 07:16             1
11.11.2024 12:00             1
11.11.2024 12:18             1
11.11.2024 17:32             1
29.01.2025 09:49             1
30.01.2025 07:19             1
30.01.2025 15:02             1
2025-01-31 00:00:00.000      1
2025-02-03 13:04:01.097      1
03.02.2025 13:13             1
2025-02-04 00:00:00.000      1
2025-02-06 00:00:00.000      1
10.02.2025 09:34             1
2025-02-12 00:00:00.000      1
17.02.2025 09:27             1
18.02.2025 13:29             1
20.02.2025 14:06             1
21.02.2025 06:28             1
2025-02-24 00:00:00.000      1
25.02.2025 12:47             1
2025-02-26 00:00:00.000      1
2025-02-26 08:48:36.063      1
28.02.2025 07:33             1
2025-03-03 00:00:00.000      1
29.01.2025 11:08             1
2025-01-29 00:00:00.000      1
22.11.2024 07:46             1
28.01.2025 08:40             1
2024-12-02 00:00:00.000      1
16.12.2024 09:19             1
16.12.2024 13:57             1
2024-12-19 06:26:53.073      1
23.12.2024 11:47             1
2024-12-27 00:00:00.000      1
02.01.2025 16:42             1
2025-01-07 00:00:00.000      1
09.01.2025 07:22             1
09.01.2025 12:47             1
11.01.2025 22:32             1
13.01.2025 08:23             1
13.01.2025 11:56             1
14.01.2025 12:30             1
20.01.2025 08:25             1
20.01.2025 09:51             1
21.01.2025 06:06             1
22.01.2025 11:06             1
27.01.2025 13:57             1
03.09.2024 15:13             1
2024-08-29 18:16:56.030      1
28.08.2024 11:43             1
08.07.2024 06:23             1
10.07.2024 15:58             1
2024-07-12 00:00:00.000      1
15.07.2024 12:46             1
16.07.2024 09:31             1
17.07.2024 11:27             1
17.07.2024 12:00             1
18.07.2024 14:04             1
18.07.2024 14:05             1
19.07.2024 06:37             1
19.07.2024 08:59             1
19.07.2024 09:21             1
2024-07-21 00:00:00.000      1
2024-07-22 12:06:05.003      1
22.07.2024 12:54             1
24.07.2024 10:15             1
25.07.2024 07:37             1
25.07.2024 14:06             1
26.07.2024 06:34             1
26.07.2024 12:01             1
08.07.2024 14:56             1
04.07.2024 09:20             1
2024-07-29 15:57:04.033      1
2024-07-03 00:00:00.000      1
14.06.2024 10:10             1
14.06.2024 10:26             1
14.06.2024 13:57             1
17.06.2024 07:39             1
17.06.2024 08:44             1
2024-06-17 09:34:48.090      1
19.06.2024 11:02             1
19.06.2024 12:39             1
20.06.2024 10:28             1
20.06.2024 15:37             1
2024-06-21 00:00:00.000      1
21.06.2024 12:14             1
2024-06-25 00:00:00.000      1
2024-06-25 06:29:57.080      1
25.06.2024 10:27             1
2024-06-26 00:00:00.000      1
2024-06-27 00:00:00.000      1
27.06.2024 14:25             1
01.07.2024 09:11             1
29.07.2024 07:45             1
29.07.2024 17:07             1
28.08.2024 11:07             1
15.08.2024 11:08             1
2024-08-17 00:00:00.000      1
2024-08-19 00:00:00.000      1
19.08.2024 11:25             1
19.08.2024 11:26             1
19.08.2024 11:27             1
2024-08-19 16:02:03.080      1
2024-08-19 16:08:52.013      1
19.08.2024 16:13             1
19.08.2024 16:18             1
2024-08-20 00:00:00.000      1
2024-08-23 00:00:00.000      1
26.08.2024 07:44             1
2024-08-26 15:51:35.043      1
26.08.2024 15:56             1
27.08.2024 08:19             1
27.08.2024 10:04             1
27.08.2024 12:39             1
27.08.2024 15:36             1
28.08.2024 09:22             1
2024-08-16 00:00:00.000      1
2024-08-15 00:00:00.000      1
2024-07-30 00:00:00.000      1
14.08.2024 12:21             1
2024-07-31 07:26:15.007      1
31.07.2024 07:54             1
31.07.2024 10:20             1
31.07.2024 12:36             1
31.07.2024 15:05             1
2024-08-01 00:00:00.000      1
2024-08-02 00:00:00.000      1
02.08.2024 11:57             1
2024-08-05 00:00:00.000      1
2024-08-05 09:15:14.027      1
05.08.2024 09:29             1
05.08.2024 09:37             1
05.08.2024 09:40             1
2024-08-09 00:00:00.000      1
09.08.2024 18:51             1
12.08.2024 09:05             1
2024-08-13 00:00:00.000      1
13.08.2024 06:44             1
13.08.2024 13:05             1
14.02.2024 08:27             1
2024-02-13 00:00:00.000      1
12.02.2024 09:25             1
18.06.2019 06:42             1
2019-06-03 11:11:50.060      1
03.06.2019 16:10             1
2019-06-04 00:00:00.000      1
04.06.2019 15:51             1
2019-06-11 00:00:00.000      1
11.06.2019 11:47             1
2019-06-11 13:22:30.063      1
15.06.2019 12:52             1
2019-06-17 00:00:00.000      1
19.06.2019 06:40             1
2024-02-12 00:00:00.000      1
20.06.2019 11:51             1
2019-06-21 00:00:00.000      1
24.06.2019 09:15             1
27.06.2019 07:06             1
28.06.2019 13:43             1
2019-06-28 14:30:25.003      1
2019-06-29 00:00:00.000      1
2019-07-01 00:00:00.000      1
01.07.2019 13:11             1
31.05.2019 08:21             1
29.05.2019 15:26             1
28.05.2019 16:02             1
28.05.2019 10:51             1
02.05.2019 14:48             1
2019-05-07 00:00:00.000      1
07.05.2019 09:15             1
2019-05-09 00:00:00.000      1
09.05.2019 08:01             1
2019-05-10 00:00:00.000      1
13.05.2019 14:07             1
13.05.2019 14:58             1
14.05.2019 13:57             1
15.05.2019 09:32             1
15.05.2019 10:51             1
2019-05-17 00:00:00.000      1
17.05.2019 08:05             1
20.05.2019 13:26             1
21.05.2019 12:46             1
2019-05-22 07:26:32.033      1
22.05.2019 09:48             1
2019-05-22 10:42:01.007      1
2019-05-23 00:00:00.000      1
04.07.2019 10:54             1
04.07.2019 12:25             1
04.07.2019 12:51             1
19.08.2019 12:18             1
2019-08-21 00:00:00.000      1
2019-08-22 00:00:00.000      1
2019-08-23 00:00:00.000      1
28.08.2019 08:16             1
28.08.2019 12:12             1
2019-09-02 00:00:00.000      1
2019-09-03 00:00:00.000      1
2019-09-04 00:00:00.000      1
2019-09-05 00:00:00.000      1
09.09.2019 11:18             1
11.09.2019 10:59             1
11.09.2019 11:29             1
2019-09-12 00:00:00.000      1
13.09.2019 13:37             1
17.09.2019 15:20             1
18.09.2019 11:29             1
2019-09-20 00:00:00.000      1
23.09.2019 06:38             1
2019-09-26 00:00:00.000      1
19.08.2019 16:34             1
2019-08-13 00:00:00.000      1
2019-07-04 16:21:38.023      1
12.08.2019 07:14             1
2019-07-08 00:00:00.000      1
08.07.2019 15:00             1
09.07.2019 14:56             1
2019-07-10 00:00:00.000      1
10.07.2019 11:07             1
2019-07-11 00:00:00.000      1
2019-07-12 00:00:00.000      1
12.07.2019 16:19             1
19.07.2019 10:14             1
19.07.2019 12:28             1
2019-07-22 00:00:00.000      1
24.07.2019 08:26             1
25.07.2019 15:29             1
2019-07-26 00:00:00.000      1
2019-07-27 13:49:06.063      1
30.07.2019 11:29             1
06.08.2019 11:34             1
2019-08-07 00:00:00.000      1
2019-08-09 00:00:00.000      1
2019-04-30 11:51:31.093      1
30.04.2019 08:51             1
29.04.2019 11:38             1
2019-03-16 00:00:00.000      1
18.03.2019 16:50             1
19.03.2019 06:11             1
2019-03-19 12:16:07.000      1
19.03.2019 14:54             1
2019-03-20 00:00:00.000      1
20.03.2019 10:54             1
20.03.2019 14:46             1
20.03.2019 16:16             1
21.03.2019 07:52             1
2019-03-21 13:38:23.037      1
21.03.2019 15:21             1
2019-03-21 18:45:52.083      1
2019-03-23 00:00:00.000      1
25.03.2019 07:29             1
25.03.2019 07:58             1
25.03.2019 08:05             1
25.03.2019 08:16             1
25.03.2019 08:42             1
25.03.2019 09:01             1
2019-03-17 00:00:00.000      1
15.03.2019 07:58             1
25.03.2019 12:58             1
15.03.2019 06:52             1
06.03.2019 07:38             1
06.03.2019 10:36             1
06.03.2019 11:20             1
06.03.2019 12:57             1
06.03.2019 14:04             1
06.03.2019 17:08             1
07.03.2019 08:07             1
07.03.2019 10:17             1
2019-03-07 15:10:55.020      1
08.03.2019 10:07             1
11.03.2019 07:43             1
2019-03-11 12:47:25.000      1
11.03.2019 13:46             1
13.03.2019 09:35             1
13.03.2019 13:57             1
13.03.2019 16:26             1
13.03.2019 16:31             1
13.03.2019 16:40             1
14.03.2019 15:04             1
25.03.2019 09:23             1
25.03.2019 14:16             1
25.04.2019 16:54             1
09.04.2019 08:45             1
10.04.2019 07:38             1
10.04.2019 14:52             1
11.04.2019 07:19             1
11.04.2019 15:25             1
11.04.2019 15:46             1
12.04.2019 07:40             1
12.04.2019 10:33             1
15.04.2019 08:02             1
15.04.2019 08:41             1
15.04.2019 15:49             1
2019-04-16 00:00:00.000      1
2019-04-17 00:00:00.000      1
18.04.2019 15:21             1
18.04.2019 15:49             1
18.04.2019 15:54             1
2019-04-21 00:00:00.000      1
2019-04-22 00:00:00.000      1
24.04.2019 13:54             1
25.04.2019 15:40             1
09.04.2019 16:18             1
08.04.2019 12:20             1
2019-03-25 14:58:43.057      1
08.04.2019 09:18             1
25.03.2019 15:30             1
27.03.2019 11:28             1
27.03.2019 14:25             1
28.03.2019 13:10             1
28.03.2019 14:04             1
2019-03-28 15:30:32.097      1
29.03.2019 07:07             1
02.04.2019 07:29             1
02.04.2019 07:40             1
2019-04-02 07:54:41.080      1
02.04.2019 08:23             1
02.04.2019 09:34             1
02.04.2019 10:05             1
02.04.2019 10:14             1
02.04.2019 16:56             1
04.04.2019 17:55             1
05.04.2019 07:06             1
05.04.2019 10:26             1
2019-04-06 00:00:00.000      1
2019-10-01 00:00:00.000      1
2019-10-16 00:00:00.000      1
2019-10-28 00:00:00.000      1
2023-08-25 11:33:32.063      1
28.08.2023 11:13             1
31.08.2023 13:25             1
04.09.2023 09:42             1
2023-10-12 00:00:00.000      1
19.10.2023 07:58             1
2023-10-27 00:00:00.000      1
2023-10-30 00:00:00.000      1
2023-11-08 00:00:00.000      1
08.11.2023 15:22             1
09.11.2023 07:28             1
2023-11-09 15:20:40.010      1
2023-11-13 00:00:00.000      1
13.11.2023 13:29             1
2023-11-20 00:00:00.000      1
2023-11-22 00:00:00.000      1
24.11.2023 12:48             1
2023-11-30 00:00:00.000      1
2023-12-05 00:00:00.000      1
07.12.2023 08:39             1
2023-08-28 00:00:00.000      1
17.08.2023 06:42             1
13.12.2023 07:34             1
06.06.2017 14:39             1
2023-05-04 00:00:00.000      1
12.05.2023 08:39             1
2023-05-16 00:00:00.000      1
2023-05-26 00:00:00.000      1
01.07.2023 07:15             1
01.07.2023 07:41             1
05.07.2023 08:58             1
2023-07-11 09:05:54.050      1
21.07.2023 07:47             1
03.08.2023 07:44             1
05.08.2023 07:31             1
05.08.2023 07:45             1
05.08.2023 07:53             1
2023-08-11 07:19:59.060      1
11.08.2023 07:44             1
11.08.2023 07:53             1
14.08.2023 14:11             1
14.08.2023 16:32             1
14.08.2023 16:36             1
2023-12-13 00:00:00.000      1
2023-12-18 00:00:00.000      1
28.04.2023 08:37             1
29.01.2024 09:45             1
29.01.2024 12:27             1
29.01.2024 15:22             1
30.01.2024 13:37             1
31.01.2024 09:06             1
01.02.2024 09:36             1
01.02.2024 09:47             1
02.02.2024 10:28             1
02.02.2024 11:07             1
2024-02-05 00:00:00.000      1
05.02.2024 08:34             1
2024-02-05 09:57:19.010      1
05.02.2024 12:38             1
05.02.2024 13:11             1
06.02.2024 12:14             1
06.02.2024 14:59             1
06.02.2024 15:54             1
2024-02-07 00:00:00.000      1
09.02.2024 11:28             1
09.02.2024 11:55             1
29.01.2024 10:44             1
2024-01-28 00:00:00.000      1
2024-01-05 00:00:00.000      1
26.01.2024 11:39             1
2024-01-08 00:00:00.000      1
15.01.2024 08:38             1
15.01.2024 08:44             1
16.01.2024 13:18             1
16.01.2024 13:21             1
16.01.2024 13:28             1
2024-01-16 13:32:45.010      1
16.01.2024 13:37             1
16.01.2024 13:40             1
16.01.2024 13:42             1
2024-01-16 13:45:25.013      1
16.01.2024 13:49             1
2024-01-17 00:00:00.000      1
17.01.2024 07:58             1
2024-01-18 06:46:39.013      1
22.01.2024 07:10             1
2024-01-24 00:00:00.000      1
25.01.2024 13:48             1
2024-01-26 09:44:14.043      1
03.05.2023 13:29             1
2023-04-25 00:00:00.000      1
28.10.2019 08:07             1
2020-01-31 00:00:00.000      1
2020-02-05 00:00:00.000      1
2020-02-08 00:00:00.000      1
12.02.2020 06:24             1
12.02.2020 09:53             1
2020-02-14 00:00:00.000      1
14.02.2020 09:37             1
14.02.2020 12:16             1
17.02.2020 13:34             1
20.02.2020 06:54             1
2020-02-21 00:00:00.000      1
24.02.2020 06:31             1
24.02.2020 08:22             1
24.02.2020 11:49             1
25.02.2020 14:32             1
27.02.2020 15:39             1
28.02.2020 22:57             1
03.03.2020 10:54             1
2020-03-04 00:00:00.000      1
05.03.2020 06:21             1
03.02.2020 14:02             1
2020-01-24 00:00:00.000      1
09.03.2020 08:21             1
22.01.2020 09:14             1
2019-10-29 00:00:00.000      1
31.10.2019 09:43             1
2019-11-12 00:00:00.000      1
2019-11-22 00:00:00.000      1
28.11.2019 17:28             1
29.11.2019 12:35             1
2019-12-02 00:00:00.000      1
2019-12-05 00:00:00.000      1
06.12.2019 13:36             1
17.12.2019 12:27             1
2019-12-18 00:00:00.000      1
27.12.2019 11:49             1
2020-01-08 16:47:25.053      1
09.01.2020 13:14             1
2020-01-10 00:00:00.000      1
15.01.2020 14:50             1
2020-01-20 00:00:00.000      1
21.01.2020 10:38             1
22.01.2020 07:33             1
05.03.2020 06:24             1
2020-03-10 06:39:21.010      1
18.04.2023 11:21             1
2021-11-12 00:00:00.000      1
2021-12-21 00:00:00.000      1
2021-12-23 00:00:00.000      1
04.01.2022 11:29             1
10.02.2022 10:12             1
2022-02-17 00:00:00.000      1
17.02.2022 08:05             1
2022-02-21 00:00:00.000      1
2022-03-01 00:00:00.000      1
2022-03-29 09:16:04.057      1
08.04.2022 10:37             1
2022-05-23 00:00:00.000      1
2022-06-15 00:00:00.000      1
12.07.2022 10:42             1
2022-08-10 00:00:00.000      1
2022-10-12 00:00:00.000      1
04.01.2023 14:29             1
30.01.2023 10:23             1
05.04.2023 14:29             1
2023-04-17 13:34:40.030      1
2021-12-15 00:00:00.000      1
2021-11-03 09:17:03.040      1
10.03.2020 07:28             1
2021-11-03 00:00:00.000      1
10.03.2020 13:25             1
10.03.2020 15:55             1
11.03.2020 15:53             1
11.03.2020 15:58             1
11.03.2020 16:01             1
2020-03-12 00:00:00.000      1
12.03.2020 13:44             1
12.03.2020 17:22             1
20.03.2020 13:46             1
24.03.2020 16:13             1
28.03.2020 12:19             1
11.04.2020 16:13             1
11.04.2020 16:23             1
11.04.2020 16:27             1
11.04.2020 16:38             1
11.04.2020 16:48             1
03.11.2020 15:36             1
2021-01-14 00:00:00.000      1
2021-03-03 00:00:00.000      1
06.06.2017 16:39             1
2016-07-21 00:00:00.000      1
06.06.2017 10:51             1
2013-12-27 00:00:00.000      1
2013-12-07 00:00:00.000      1
2013-12-09 00:00:00.000      1
2013-12-11 00:00:00.000      1
2013-12-12 00:00:00.000      1
2013-12-13 00:00:00.000      1
2013-12-16 00:00:00.000      1
2013-12-19 00:00:00.000      1
19.12.2013 17:17             1
2013-12-22 00:00:00.000      1
2013-12-27 12:28:16.020      1
2014-01-20 00:00:00.000      1
2013-12-30 00:00:00.000      1
2014-01-01 00:00:00.000      1
2014-01-05 00:00:00.000      1
08.01.2014 11:06             1
08.01.2014 11:08             1
08.01.2014 11:09             1
2014-01-09 10:13:18.063      1
2014-01-10 00:00:00.000      1
2014-01-12 00:00:00.000      1
2013-12-03 00:00:00.000      1
2013-11-26 00:00:00.000      1
25.11.2013 15:29             1
25.11.2013 15:24             1
2013-10-25 00:00:00.000      1
2013-10-26 00:00:00.000      1
2013-10-28 00:00:00.000      1
29.10.2013 11:03             1
2013-10-30 00:00:00.000      1
30.10.2013 11:29             1
30.10.2013 11:49             1
06.11.2013 18:17             1
2013-11-07 00:00:00.000      1
07.11.2013 14:43             1
2013-11-09 00:00:00.000      1
2013-11-13 00:00:00.000      1
2013-11-16 00:00:00.000      1
2013-11-18 00:00:00.000      1
2013-11-20 00:00:00.000      1
2013-11-22 00:00:00.000      1
2013-11-23 00:00:00.000      1
2013-11-25 00:00:00.000      1
25.11.2013 15:15             1
13.01.2014 10:04             1
21.01.2014 07:43             1
22.10.2013 14:13             1
2014-04-06 00:00:00.000      1
2014-03-20 00:00:00.000      1
2014-03-21 00:00:00.000      1
2014-03-22 00:00:00.000      1
2014-03-24 00:00:00.000      1
25.03.2014 10:55             1
2014-03-26 00:00:00.000      1
2014-03-29 00:00:00.000      1
01.04.2014 14:46             1
2014-04-02 00:00:00.000      1
2014-04-08 00:00:00.000      1
21.01.2014 12:24             1
2014-04-09 00:00:00.000      1
2014-04-11 00:00:00.000      1
2014-04-16 00:00:00.000      1
2014-04-17 00:00:00.000      1
17.04.2014 09:09             1
2014-04-19 00:00:00.000      1
2014-04-21 00:00:00.000      1
2014-04-28 00:00:00.000      1
2014-04-29 00:00:00.000      1
2014-03-16 00:00:00.000      1
2014-03-08 00:00:00.000      1
06.03.2014 15:00             1
2014-03-06 00:00:00.000      1
2014-01-22 00:00:00.000      1
2014-01-24 00:00:00.000      1
2014-01-25 00:00:00.000      1
2014-01-27 00:00:00.000      1
29.01.2014 09:23             1
29.01.2014 10:37             1
2014-01-30 13:46:03.070      1
2014-02-03 00:00:00.000      1
2014-02-06 00:00:00.000      1
2014-02-07 00:00:00.000      1
12.02.2014 14:32             1
2014-02-14 00:00:00.000      1
14.02.2014 09:33             1
14.02.2014 14:35             1
2014-02-26 00:00:00.000      1
2014-02-27 00:00:00.000      1
27.02.2014 16:28             1
2014-03-01 00:00:00.000      1
2014-03-04 00:00:00.000      1
2013-10-24 00:00:00.000      1
18.10.2013 11:27             1
06.06.2017 10:44             1
02.08.2013 10:50             1
29.07.2013 16:11             1
31.07.2013 09:02             1
31.07.2013 09:04             1
31.07.2013 15:08             1
01.08.2013 09:52             1
01.08.2013 16:33             1
01.08.2013 16:51             1
01.08.2013 17:01             1
02.08.2013 08:34             1
2013-08-04 00:00:00.000      1
26.08.2013 11:27             1
13.08.2013 11:02             1
16.08.2013 11:39             1
16.08.2013 11:48             1
16.08.2013 12:00             1
2013-08-18 00:00:00.000      1
19.08.2013 13:58             1
19.08.2013 14:01             1
23.08.2013 11:05             1
23.08.2013 11:27             1
29.07.2013 16:09             1
2013-07-28 00:00:00.000      1
23.07.2013 14:38             1
23.07.2013 14:32             1
15.07.2013 11:42             1
15.07.2013 11:47             1
15.07.2013 11:59             1
15.07.2013 12:04             1
15.07.2013 12:39             1
15.07.2013 13:59             1
15.07.2013 17:43             1
15.07.2013 17:47             1
2013-07-16 14:29:12.093      1
2013-07-16 15:13:28.097      1
16.07.2013 15:31             1
16.07.2013 15:34             1
17.07.2013 08:36             1
17.07.2013 09:48             1
17.07.2013 13:58             1
17.07.2013 14:58             1
17.07.2013 15:58             1
2013-07-17 16:04:05.060      1
19.07.2013 09:27             1
23.08.2013 12:03             1
27.08.2013 09:00             1
2013-10-18 00:00:00.000      1
2013-10-08 10:19:57.013      1
23.09.2013 14:47             1
2013-09-27 00:00:00.000      1
27.09.2013 11:33             1
27.09.2013 11:39             1
2013-09-30 00:00:00.000      1
2013-10-01 09:51:09.063      1
01.10.2013 09:56             1
01.10.2013 12:27             1
04.10.2013 11:59             1
08.10.2013 10:27             1
27.08.2013 10:37             1
08.10.2013 12:02             1
08.10.2013 12:09             1
09.10.2013 10:25             1
2013-10-10 00:00:00.000      1
10.10.2013 15:11             1
2013-10-11 00:00:00.000      1
2013-10-16 00:00:00.000      1
2013-10-17 00:00:00.000      1
2013-10-17 11:09:21.043      1
23.09.2013 14:39             1
2013-09-23 00:00:00.000      1
2013-09-21 00:00:00.000      1
19.09.2013 12:39             1
30.08.2013 13:46             1
03.09.2013 09:08             1
04.09.2013 13:49             1
04.09.2013 16:45             1
06.09.2013 12:07             1
2013-09-08 00:00:00.000      1
11.09.2013 14:12             1
2013-09-12 15:48:37.010      1
12.09.2013 15:58             1
12.09.2013 16:04             1
13.09.2013 10:44             1
2013-09-14 00:00:00.000      1
16.09.2013 14:15             1
17.09.2013 12:21             1
18.09.2013 10:54             1
18.09.2013 11:18             1
18.09.2013 11:25             1
19.09.2013 12:13             1
19.09.2013 12:30             1
2014-05-03 00:00:00.000      1
2014-05-06 00:00:00.000      1
06.05.2014 13:10             1
19.01.2015 11:53             1
09.01.2015 07:12             1
09.01.2015 09:18             1
09.01.2015 12:13             1
09.01.2015 12:18             1
12.01.2015 09:24             1
12.01.2015 10:51             1
12.01.2015 11:36             1
2015-01-12 11:43:07.003      1
16.01.2015 06:25             1
19.01.2015 17:00             1
10.02.2015 13:10             1
20.01.2015 13:18             1
27.01.2015 08:40             1
2015-01-29 13:34:44.027      1
30.01.2015 12:23             1
30.01.2015 12:26             1
03.02.2015 15:23             1
04.02.2015 15:56             1
05.02.2015 15:51             1
06.02.2015 12:04             1
08.01.2015 09:25             1
08.01.2015 08:20             1
05.01.2015 15:18             1
05.01.2015 14:57             1
2014-12-07 00:00:00.000      1
2014-12-08 00:00:00.000      1
2014-12-09 00:00:00.000      1
10.12.2014 15:30             1
10.12.2014 15:38             1
10.12.2014 15:50             1
10.12.2014 16:00             1
10.12.2014 16:11             1
11.12.2014 16:24             1
12.12.2014 10:18             1
2014-12-14 00:00:00.000      1
16.12.2014 06:39             1
19.12.2014 08:07             1
22.12.2014 13:46             1
29.12.2014 08:54             1
05.01.2015 13:00             1
05.01.2015 14:34             1
05.01.2015 14:46             1
05.01.2015 14:53             1
10.02.2015 11:33             1
13.02.2015 11:15             1
19.05.2014 09:23             1
09.04.2015 11:04             1
19.03.2015 15:26             1
23.03.2015 13:38             1
26.03.2015 08:36             1
27.03.2015 08:44             1
27.03.2015 08:46             1
01.04.2015 12:11             1
2015-04-07 08:28:56.000      1
07.04.2015 10:04             1
09.04.2015 10:57             1
09.04.2015 13:56             1
16.02.2015 16:46             1
2015-04-09 14:25:23.017      1
2015-04-10 08:11:01.017      1
13.04.2015 07:27             1
13.04.2015 14:15             1
14.04.2015 16:48             1
16.04.2015 15:04             1
20.04.2015 09:57             1
22.04.2015 09:51             1
22.04.2015 10:32             1
19.03.2015 13:56             1
2015-03-18 12:23:24.060      1
17.03.2015 16:15             1
17.03.2015 11:01             1
18.02.2015 17:27             1
23.02.2015 09:42             1
23.02.2015 14:28             1
24.02.2015 07:24             1
24.02.2015 11:30             1
26.02.2015 16:07             1
02.03.2015 10:55             1
02.03.2015 12:57             1
02.03.2015 13:50             1
02.03.2015 14:34             1
03.03.2015 10:01             1
03.03.2015 10:36             1
05.03.2015 11:26             1
2015-03-05 14:50:01.040      1
06.03.2015 10:39             1
09.03.2015 11:28             1
10.03.2015 15:13             1
11.03.2015 08:55             1
11.03.2015 15:41             1
2014-12-05 00:00:00.000      1
2014-12-02 00:00:00.000      1
2014-11-29 00:00:00.000      1
26.08.2014 12:22             1
2014-08-13 00:00:00.000      1
13.08.2014 10:32             1
2014-08-17 00:00:00.000      1
2014-08-18 00:00:00.000      1
2014-08-21 00:00:00.000      1
21.08.2014 14:22             1
2014-08-25 00:00:00.000      1
2014-08-25 09:19:50.090      1
25.08.2014 09:53             1
27.08.2014 13:15             1
28.11.2014 09:42             1
28.08.2014 09:22             1
2014-08-29 00:00:00.000      1
2014-09-01 00:00:00.000      1
01.09.2014 11:35             1
2014-09-04 00:00:00.000      1
2014-09-05 00:00:00.000      1
2014-09-08 00:00:00.000      1
2014-09-09 00:00:00.000      1
2014-09-11 00:00:00.000      1
2014-08-08 00:00:00.000      1
06.08.2014 13:37             1
2014-08-06 00:00:00.000      1
2014-07-27 00:00:00.000      1
2014-05-30 00:00:00.000      1
2014-06-02 00:00:00.000      1
2014-06-03 00:00:00.000      1
2014-06-06 00:00:00.000      1
2014-06-11 00:00:00.000      1
2014-06-14 00:00:00.000      1
2014-06-17 00:00:00.000      1
2014-06-18 00:00:00.000      1
2014-06-20 00:00:00.000      1
20.06.2014 14:30             1
2014-07-01 00:00:00.000      1
2014-07-02 00:00:00.000      1
2014-07-03 00:00:00.000      1
2014-07-07 00:00:00.000      1
2014-07-09 00:00:00.000      1
2014-07-10 00:00:00.000      1
2014-07-17 00:00:00.000      1
2014-07-22 00:00:00.000      1
2014-07-25 00:00:00.000      1
2014-09-12 00:00:00.000      1
2014-09-15 00:00:00.000      1
2014-09-17 00:00:00.000      1
2014-10-22 00:00:00.000      1
27.10.2014 15:15             1
2014-11-02 00:00:00.000      1
2014-11-03 00:00:00.000      1
03.11.2014 14:23             1
2014-11-05 00:00:00.000      1
2014-11-06 00:00:00.000      1
06.11.2014 11:54             1
2014-11-08 00:00:00.000      1
2014-11-09 00:00:00.000      1
10.11.2014 14:28             1
2014-11-11 00:00:00.000      1
2014-11-12 00:00:00.000      1
2014-11-14 00:00:00.000      1
2014-11-17 00:00:00.000      1
17.11.2014 14:57             1
18.11.2014 06:25             1
2014-11-24 00:00:00.000      1
2014-11-26 00:00:00.000      1
2014-11-28 00:00:00.000      1
2014-10-24 00:00:00.000      1
21.10.2014 13:52             1
17.09.2014 10:21             1
2014-10-21 13:48:14.017      1
2014-09-19 00:00:00.000      1
2014-09-20 00:00:00.000      1
2014-09-21 00:00:00.000      1
2014-09-23 00:00:00.000      1
2014-09-25 00:00:00.000      1
2014-09-29 00:00:00.000      1
29.09.2014 16:11             1
01.10.2014 06:56             1
2014-10-04 00:00:00.000      1
2014-10-05 00:00:00.000      1
2014-10-07 00:00:00.000      1
2014-10-12 00:00:00.000      1
2014-10-14 00:00:00.000      1
14.10.2014 09:18             1
16.10.2014 07:25             1
2014-10-17 00:00:00.000      1
2014-10-18 00:00:00.000      1
21.10.2014 13:27             1
21.10.2014 13:33             1
12.07.2013 12:00             1
11.07.2013 07:53             1
10.07.2013 11:42             1
2010-02-14 00:00:00.000      1
2010-01-12 00:00:00.000      1
2010-01-19 00:00:00.000      1
2010-01-20 00:00:00.000      1
2010-01-26 00:00:00.000      1
2010-01-27 00:00:00.000      1
2010-02-02 00:00:00.000      1
2010-02-07 00:00:00.000      1
2010-02-10 00:00:00.000      1
2010-02-11 00:00:00.000      1
2010-03-04 00:00:00.000      1
2010-05-23 00:00:00.000      1
2010-03-06 00:00:00.000      1
2010-03-10 00:00:00.000      1
2010-03-21 00:00:00.000      1
2010-03-26 00:00:00.000      1
2010-05-05 00:00:00.000      1
2010-05-08 00:00:00.000      1
2010-05-14 00:00:00.000      1
2010-05-16 00:00:00.000      1
2010-05-18 00:00:00.000      1
2009-12-28 00:00:00.000      1
2009-11-30 00:00:00.000      1
2009-11-23 00:00:00.000      1
2009-11-16 00:00:00.000      1
2008-10-13 00:00:00.000      1
2008-11-03 00:00:00.000      1
2008-12-01 00:00:00.000      1
2008-12-22 00:00:00.000      1
2009-01-05 00:00:00.000      1
2009-04-24 00:00:00.000      1
2009-05-22 00:00:00.000      1
2009-06-02 00:00:00.000      1
2009-06-29 00:00:00.000      1
2009-07-06 00:00:00.000      1
2009-07-13 00:00:00.000      1
2009-07-27 00:00:00.000      1
2009-08-03 00:00:00.000      1
2009-08-10 00:00:00.000      1
2009-08-24 00:00:00.000      1
2009-08-31 00:00:00.000      1
2009-09-14 00:00:00.000      1
2009-10-19 00:00:00.000      1
2009-11-02 00:00:00.000      1
2010-05-19 00:00:00.000      1
2010-06-06 00:00:00.000      1
2011-09-26 00:00:00.000      1
2011-08-25 00:00:00.000      1
2011-07-22 00:00:00.000      1
2011-07-26 00:00:00.000      1
2011-08-03 00:00:00.000      1
2011-08-06 00:00:00.000      1
2011-08-07 00:00:00.000      1
2011-08-10 00:00:00.000      1
2011-08-12 00:00:00.000      1
2011-08-17 00:00:00.000      1
2011-08-21 00:00:00.000      1
2011-08-27 00:00:00.000      1
2010-08-11 00:00:00.000      1
2011-08-28 00:00:00.000      1
2011-08-29 00:00:00.000      1
2011-09-01 00:00:00.000      1
2011-09-04 00:00:00.000      1
2011-09-13 00:00:00.000      1
2011-09-14 00:00:00.000      1
2011-09-16 00:00:00.000      1
2011-09-22 00:00:00.000      1
2011-09-24 00:00:00.000      1
2011-07-09 00:00:00.000      1
2011-03-17 00:00:00.000      1
2011-03-15 00:00:00.000      1
2011-03-11 00:00:00.000      1
2011-01-18 00:00:00.000      1
2011-01-21 00:00:00.000      1
2011-01-22 00:00:00.000      1
2011-01-25 00:00:00.000      1
2011-01-27 00:00:00.000      1
2011-01-28 00:00:00.000      1
2011-01-30 00:00:00.000      1
2011-02-03 00:00:00.000      1
2011-02-06 00:00:00.000      1
2011-02-12 00:00:00.000      1
2011-02-15 00:00:00.000      1
2011-02-17 00:00:00.000      1
2011-02-19 00:00:00.000      1
2011-02-23 00:00:00.000      1
2011-02-26 00:00:00.000      1
2011-02-27 00:00:00.000      1
2011-03-01 00:00:00.000      1
2011-03-05 00:00:00.000      1
2011-03-08 00:00:00.000      1
2008-10-06 00:00:00.000      1
2008-07-29 00:00:00.000      1
2008-07-28 00:00:00.000      1
2002-07-07 00:00:00.000      1
2001-07-08 00:00:00.000      1
2001-07-18 00:00:00.000      1
2001-07-21 00:00:00.000      1
2001-08-03 00:00:00.000      1
2001-08-09 00:00:00.000      1
2001-08-16 00:00:00.000      1
2001-11-09 00:00:00.000      1
2002-03-06 00:00:00.000      1
2002-06-13 00:00:00.000      1
2002-08-17 00:00:00.000      1
2008-05-03 00:00:00.000      1
2003-01-15 00:00:00.000      1
2003-01-18 00:00:00.000      1
2003-02-20 00:00:00.000      1
2003-05-08 00:00:00.000      1
2003-05-14 00:00:00.000      1
2003-05-17 00:00:00.000      1
2003-06-22 00:00:00.000      1
2003-09-19 00:00:00.000      1
2003-09-29 00:00:00.000      1
2001-07-07 00:00:00.000      1
2001-07-05 00:00:00.000      1
2001-07-04 00:00:00.000      1
2001-06-30 00:00:00.000      1
2001-01-25 00:00:00.000      1
2001-01-30 00:00:00.000      1
2001-02-03 00:00:00.000      1
2001-02-09 00:00:00.000      1
2001-02-21 00:00:00.000      1
2001-02-22 00:00:00.000      1
2001-02-23 00:00:00.000      1
2001-03-10 00:00:00.000      1
2001-03-21 00:00:00.000      1
2001-03-27 00:00:00.000      1
2001-04-08 00:00:00.000      1
2001-04-20 00:00:00.000      1
2001-04-22 00:00:00.000      1
2001-05-01 00:00:00.000      1
2001-05-09 00:00:00.000      1
2001-05-25 00:00:00.000      1
2001-06-10 00:00:00.000      1
2001-06-16 00:00:00.000      1
2001-06-23 00:00:00.000      1
2004-01-05 00:00:00.000      1
2004-01-26 00:00:00.000      1
2004-03-27 00:00:00.000      1
2006-07-15 00:00:00.000      1
2006-08-21 00:00:00.000      1
2006-09-12 00:00:00.000      1
2006-11-13 00:00:00.000      1
2006-11-27 00:00:00.000      1
2007-08-14 00:00:00.000      1
2007-08-20 00:00:00.000      1
2007-08-25 00:00:00.000      1
2007-08-28 00:00:00.000      1
2007-09-17 00:00:00.000      1
2007-10-30 00:00:00.000      1
2007-11-14 00:00:00.000      1
2007-12-24 00:00:00.000      1
2008-01-10 00:00:00.000      1
2008-03-25 00:00:00.000      1
2008-03-29 00:00:00.000      1
2008-04-03 00:00:00.000      1
2008-04-04 00:00:00.000      1
2008-04-12 00:00:00.000      1
2008-05-01 00:00:00.000      1
2006-07-22 00:00:00.000      1
2006-07-14 00:00:00.000      1
2004-06-07 00:00:00.000      1
2006-07-12 00:00:00.000      1
2004-06-28 00:00:00.000      1
2004-07-12 00:00:00.000      1
2004-08-23 00:00:00.000      1
2004-09-06 00:00:00.000      1
2004-09-13 00:00:00.000      1
2004-11-22 00:00:00.000      1
2004-12-20 00:00:00.000      1
2005-01-26 00:00:00.000      1
2005-01-30 00:00:00.000      1
2005-05-03 00:00:00.000      1
2005-05-20 00:00:00.000      1
2005-08-15 00:00:00.000      1
2005-10-03 00:00:00.000      1
2005-11-14 00:00:00.000      1
2005-12-19 00:00:00.000      1
2006-04-28 00:00:00.000      1
2006-05-02 00:00:00.000      1
2006-05-10 00:00:00.000      1
2006-07-11 00:00:00.000      1
2011-09-25 00:00:00.000      1
2011-09-27 00:00:00.000      1
10.07.2013 10:40             1
14.03.2013 12:11             1
22.02.2013 09:00             1
2013-03-01 00:00:00.000      1
2013-03-02 00:00:00.000      1
2013-03-05 00:00:00.000      1
2013-03-06 00:00:00.000      1
2013-03-07 00:00:00.000      1
2013-03-08 00:00:00.000      1
2013-03-09 00:00:00.000      1
2013-03-14 00:00:00.000      1
2013-03-20 00:00:00.000      1
2013-04-08 00:00:00.000      1
2013-03-21 00:00:00.000      1
2013-03-22 00:00:00.000      1
2013-03-26 00:00:00.000      1
28.03.2013 11:03             1
28.03.2013 11:06             1
28.03.2013 11:08             1
28.03.2013 11:10             1
2013-03-29 00:00:00.000      1
2013-03-30 00:00:00.000      1
2013-02-12 00:00:00.000      1
2013-02-02 00:00:00.000      1
2013-01-31 00:00:00.000      1
2013-01-27 00:00:00.000      1
17.08.2012 08:31             1
2012-08-23 00:00:00.000      1
28.08.2012 08:52             1
2012-08-29 00:00:00.000      1
2012-09-03 00:00:00.000      1
2012-09-04 00:00:00.000      1
2012-09-22 00:00:00.000      1
2012-10-16 00:00:00.000      1
2012-11-02 00:00:00.000      1
2012-11-04 00:00:00.000      1
2012-11-08 00:00:00.000      1
2012-11-26 00:00:00.000      1
2012-11-30 00:00:00.000      1
2012-12-02 00:00:00.000      1
2012-12-07 00:00:00.000      1
2012-12-09 00:00:00.000      1
2013-01-15 00:00:00.000      1
2013-01-18 00:00:00.000      1
2013-01-20 00:00:00.000      1
2013-04-04 00:00:00.000      1
2013-04-09 00:00:00.000      1
2011-09-29 00:00:00.000      1
08.07.2013 11:23             1
03.07.2013 15:36             1
04.07.2013 15:31             1
04.07.2013 15:34             1
05.07.2013 10:11             1
08.07.2013 10:49             1
08.07.2013 11:12             1
08.07.2013 11:15             1
08.07.2013 11:18             1
08.07.2013 11:21             1
08.07.2013 11:27             1
25.04.2013 10:39             1
08.07.2013 11:30             1
09.07.2013 09:01             1
09.07.2013 09:03             1
09.07.2013 09:48             1
09.07.2013 09:50             1
09.07.2013 09:53             1
09.07.2013 12:30             1
09.07.2013 13:12             1
09.07.2013 13:18             1
03.07.2013 13:11             1
26.06.2013 14:32             1
21.06.2013 08:13             1
2013-06-21 07:30:10.017      1
30.04.2013 12:23             1
30.04.2013 16:56             1
06.05.2013 09:00             1
06.05.2013 10:58             1
06.05.2013 15:27             1
2013-05-16 14:17:21.067      1
21.05.2013 13:56             1
21.05.2013 14:32             1
21.05.2013 14:43             1
23.05.2013 07:22             1
27.05.2013 14:36             1
31.05.2013 12:22             1
03.06.2013 11:27             1
04.06.2013 11:22             1
06.06.2013 08:04             1
07.06.2013 15:45             1
14.06.2013 12:23             1
19.06.2013 15:25             1
2013-06-20 15:32:47.023      1
2012-08-16 00:00:00.000      1
10.08.2012 10:47             1
2012-08-05 00:00:00.000      1
2012-02-13 00:00:00.000      1
2012-01-17 00:00:00.000      1
2012-01-24 00:00:00.000      1
2012-01-26 00:00:00.000      1
2012-01-30 00:00:00.000      1
2012-01-31 00:00:00.000      1
2012-02-02 00:00:00.000      1
2012-02-07 00:00:00.000      1
2012-02-09 00:00:00.000      1
2012-02-11 00:00:00.000      1
2012-02-16 00:00:00.000      1
2012-08-03 00:00:00.000      1
2012-02-20 00:00:00.000      1
2012-03-02 00:00:00.000      1
2012-03-03 00:00:00.000      1
2012-03-15 00:00:00.000      1
2012-03-19 00:00:00.000      1
2012-03-22 00:00:00.000      1
2012-03-23 00:00:00.000      1
23.03.2012 12:30             1
2012-04-05 00:00:00.000      1
2012-01-04 00:00:00.000      1
2011-12-30 00:00:00.000      1
2011-12-18 00:00:00.000      1
2011-12-07 00:00:00.000      1
2011-10-04 00:00:00.000      1
2011-10-05 00:00:00.000      1
2011-10-10 00:00:00.000      1
2011-10-11 00:00:00.000      1
2011-10-20 00:00:00.000      1
2011-10-24 00:00:00.000      1
2011-10-25 00:00:00.000      1
2011-10-27 00:00:00.000      1
2011-10-31 00:00:00.000      1
2011-11-12 00:00:00.000      1
2011-11-14 00:00:00.000      1
2011-11-15 00:00:00.000      1
2011-11-16 00:00:00.000      1
2011-11-18 00:00:00.000      1
2011-11-20 00:00:00.000      1
2011-11-30 00:00:00.000      1
2011-12-01 00:00:00.000      1
2011-12-04 00:00:00.000      1
2011-12-05 00:00:00.000      1
2012-04-06 00:00:00.000      1
2012-04-07 00:00:00.000      1
2012-04-08 00:00:00.000      1
2012-06-04 00:00:00.000      1
2012-06-13 00:00:00.000      1
2012-06-15 00:00:00.000      1
2012-06-16 00:00:00.000      1
18.06.2012 16:46             1
2012-06-20 00:00:00.000      1
2012-06-22 00:00:00.000      1
2012-06-23 00:00:00.000      1
2012-06-24 00:00:00.000      1
2012-06-25 00:00:00.000      1
2012-06-26 00:00:00.000      1
2012-06-28 00:00:00.000      1
2012-07-04 00:00:00.000      1
2012-07-06 00:00:00.000      1
2012-07-07 00:00:00.000      1
2012-07-15 00:00:00.000      1
2012-07-17 00:00:00.000      1
2012-07-22 00:00:00.000      1
2012-07-24 00:00:00.000      1
2012-08-02 00:00:00.000      1
2012-06-06 00:00:00.000      1
2012-06-02 00:00:00.000      1
2012-04-09 00:00:00.000      1
2012-06-01 00:00:00.000      1
2012-04-10 00:00:00.000      1
2012-04-11 00:00:00.000      1
2012-04-17 00:00:00.000      1
2012-04-18 00:00:00.000      1
2012-04-26 00:00:00.000      1
2012-04-27 00:00:00.000      1
2012-04-29 00:00:00.000      1
2012-05-02 00:00:00.000      1
2012-05-11 00:00:00.000      1
11.05.2012 09:16             1
2012-05-15 00:00:00.000      1
2012-05-16 00:00:00.000      1
2012-05-18 00:00:00.000      1
2012-05-20 00:00:00.000      1
2012-05-21 00:00:00.000      1
2012-05-24 00:00:00.000      1
25.05.2012 08:06             1
25.05.2012 08:48             1
2012-05-29 00:00:00.000      1
22.04.2015 10:52             1
2015-04-22 13:31:33.083      1
22.04.2015 13:42             1
27.03.2017 13:23             1
24.03.2017 16:20             1
27.03.2017 11:39             1
27.03.2017 11:59             1
27.03.2017 12:26             1
27.03.2017 12:29             1
27.03.2017 12:35             1
27.03.2017 12:38             1
27.03.2017 12:43             1
27.03.2017 13:11             1
27.03.2017 14:16             1
28.03.2017 16:27             1
27.03.2017 14:29             1
27.03.2017 14:53             1
27.03.2017 16:31             1
27.03.2017 17:12             1
28.03.2017 08:44             1
28.03.2017 15:45             1
28.03.2017 16:08             1
28.03.2017 16:12             1
28.03.2017 16:17             1
24.03.2017 16:15             1
24.03.2017 12:11             1
24.03.2017 11:59             1
23.03.2017 17:23             1
20.03.2017 08:09             1
20.03.2017 08:18             1
2017-03-20 09:35:44.070      1
20.03.2017 15:13             1
21.03.2017 08:31             1
21.03.2017 16:33             1
2017-03-21 16:38:15.057      1
21.03.2017 16:41             1
21.03.2017 17:44             1
2017-03-22 00:00:00.000      1
22.03.2017 06:15             1
22.03.2017 10:13             1
22.03.2017 13:04             1
22.03.2017 15:49             1
22.03.2017 16:58             1
22.03.2017 17:04             1
2017-03-23 08:11:44.077      1
23.03.2017 16:17             1
2017-03-23 17:18:09.000      1
2017-03-28 16:21:50.083      1
29.03.2017 09:49             1
07.04.2017 07:18             1
06.04.2017 07:46             1
04.04.2017 08:30             1
04.04.2017 13:46             1
04.04.2017 14:37             1
04.04.2017 15:16             1
04.04.2017 15:36             1
04.04.2017 15:59             1
04.04.2017 16:57             1
05.04.2017 15:23             1
06.04.2017 07:36             1
06.04.2017 07:50             1
29.03.2017 16:42             1
06.04.2017 07:59             1
06.04.2017 10:08             1
2017-04-06 10:22:42.010      1
2017-04-06 10:38:00.087      1
06.04.2017 12:42             1
06.04.2017 14:41             1
06.04.2017 15:11             1
06.04.2017 16:05             1
2017-04-06 16:20:29.030      1
03.04.2017 15:21             1
03.04.2017 15:08             1
2017-04-03 13:31:25.097      1
03.04.2017 13:22             1
29.03.2017 17:07             1
29.03.2017 17:17             1
29.03.2017 17:20             1
29.03.2017 17:28             1
2017-03-29 17:35:46.097      1
29.03.2017 17:41             1
29.03.2017 17:49             1
30.03.2017 09:57             1
31.03.2017 07:42             1
31.03.2017 07:51             1
31.03.2017 07:59             1
31.03.2017 08:03             1
31.03.2017 14:05             1
03.04.2017 07:13             1
03.04.2017 07:21             1
03.04.2017 07:27             1
03.04.2017 07:38             1
2017-04-03 12:43:56.003      1
03.04.2017 13:02             1
20.03.2017 07:46             1
20.03.2017 07:38             1
17.03.2017 17:16             1
03.03.2017 16:56             1
02.03.2017 16:31             1
2017-03-03 00:00:00.000      1
03.03.2017 06:57             1
03.03.2017 09:51             1
03.03.2017 10:15             1
03.03.2017 10:28             1
03.03.2017 11:34             1
03.03.2017 16:37             1
03.03.2017 16:52             1
03.03.2017 17:01             1
17.03.2017 17:12             1
03.03.2017 17:19             1
06.03.2017 07:09             1
06.03.2017 07:44             1
07.03.2017 10:07             1
07.03.2017 15:50             1
07.03.2017 16:46             1
07.03.2017 17:16             1
07.03.2017 17:20             1
07.03.2017 17:35             1
02.03.2017 12:40             1
2017-03-02 00:00:00.000      1
01.03.2017 18:03             1
01.03.2017 17:52             1
24.02.2017 16:57             1
24.02.2017 17:40             1
28.02.2017 07:47             1
28.02.2017 10:08             1
28.02.2017 13:26             1
28.02.2017 13:30             1
28.02.2017 13:48             1
28.02.2017 13:52             1
2017-02-28 13:55:03.073      1
28.02.2017 13:58             1
28.02.2017 14:32             1
28.02.2017 14:37             1
28.02.2017 16:59             1
28.02.2017 17:59             1
28.02.2017 18:06             1
01.03.2017 07:00             1
01.03.2017 07:05             1
01.03.2017 10:24             1
01.03.2017 17:22             1
2017-03-08 00:00:00.000      1
08.03.2017 07:08             1
08.03.2017 17:45             1
2017-03-13 15:31:59.060      1
14.03.2017 06:25             1
14.03.2017 07:02             1
14.03.2017 15:45             1
14.03.2017 17:59             1
2017-03-14 18:02:47.047      1
14.03.2017 18:05             1
14.03.2017 18:08             1
14.03.2017 18:11             1
14.03.2017 18:14             1
2017-03-15 00:00:00.000      1
15.03.2017 09:31             1
2017-03-15 11:00:51.010      1
2017-03-15 15:49:06.010      1
15.03.2017 17:40             1
15.03.2017 17:46             1
15.03.2017 17:51             1
2017-03-17 00:00:00.000      1
17.03.2017 14:04             1
17.03.2017 14:14             1
13.03.2017 16:52             1
13.03.2017 14:58             1
08.03.2017 18:13             1
13.03.2017 14:31             1
08.03.2017 18:16             1
09.03.2017 10:46             1
09.03.2017 14:31             1
09.03.2017 14:34             1
09.03.2017 14:51             1
09.03.2017 17:52             1
09.03.2017 18:13             1
09.03.2017 18:26             1
10.03.2017 09:35             1
10.03.2017 11:49             1
10.03.2017 15:48             1
10.03.2017 15:52             1
2017-03-11 00:00:00.000      1
13.03.2017 09:02             1
13.03.2017 13:55             1
13.03.2017 14:01             1
13.03.2017 14:04             1
2017-03-13 14:14:21.020      1
13.03.2017 14:28             1
06.04.2017 16:27             1
07.04.2017 08:14             1
24.02.2017 16:50             1
08.05.2017 14:49             1
04.05.2017 09:31             1
04.05.2017 11:10             1
04.05.2017 11:33             1
05.05.2017 11:14             1
05.05.2017 11:30             1
05.05.2017 12:33             1
08.05.2017 10:09             1
08.05.2017 12:06             1
08.05.2017 12:54             1
08.05.2017 15:14             1
2017-05-10 00:00:00.000      1
09.05.2017 08:47             1
09.05.2017 09:00             1
09.05.2017 09:12             1
09.05.2017 09:28             1
09.05.2017 09:44             1
09.05.2017 09:56             1
09.05.2017 10:25             1
09.05.2017 10:28             1
09.05.2017 10:40             1
03.05.2017 16:24             1
03.05.2017 16:22             1
03.05.2017 16:16             1
03.05.2017 14:27             1
28.04.2017 13:38             1
02.05.2017 07:49             1
02.05.2017 08:36             1
02.05.2017 09:44             1
02.05.2017 09:58             1
02.05.2017 11:34             1
02.05.2017 12:08             1
02.05.2017 12:13             1
02.05.2017 12:30             1
02.05.2017 12:36             1
02.05.2017 12:54             1
02.05.2017 13:00             1
02.05.2017 14:01             1
02.05.2017 15:52             1
03.05.2017 10:47             1
03.05.2017 11:03             1
03.05.2017 11:41             1
03.05.2017 11:55             1
03.05.2017 13:20             1
09.05.2017 12:19             1
10.05.2017 08:17             1
2017-04-07 09:04:01.050      1
31.05.2017 08:01             1
24.05.2017 15:26             1
26.05.2017 12:09             1
26.05.2017 14:47             1
26.05.2017 16:30             1
29.05.2017 13:59             1
30.05.2017 09:19             1
30.05.2017 11:13             1
30.05.2017 12:41             1
2017-05-31 00:00:00.000      1
31.05.2017 09:25             1
10.05.2017 09:04             1
31.05.2017 10:20             1
31.05.2017 13:11             1
31.05.2017 14:00             1
2017-05-31 16:26:00.013      1
01.06.2017 07:50             1
01.06.2017 08:04             1
01.06.2017 12:16             1
06.06.2017 09:40             1
06.06.2017 10:31             1
24.05.2017 10:01             1
23.05.2017 14:37             1
23.05.2017 08:51             1
23.05.2017 07:01             1
10.05.2017 11:15             1
11.05.2017 08:37             1
11.05.2017 09:06             1
11.05.2017 17:02             1
2017-05-12 00:00:00.000      1
2017-05-15 11:51:30.067      1
15.05.2017 12:04             1
15.05.2017 12:52             1
16.05.2017 07:02             1
17.05.2017 08:14             1
17.05.2017 11:00             1
18.05.2017 06:35             1
18.05.2017 13:08             1
19.05.2017 11:58             1
19.05.2017 14:06             1
19.05.2017 14:40             1
19.05.2017 17:32             1
22.05.2017 08:23             1
22.05.2017 15:52             1
28.04.2017 13:21             1
28.04.2017 13:04             1
28.04.2017 11:52             1
12.04.2017 10:10             1
11.04.2017 07:02             1
11.04.2017 10:23             1
11.04.2017 10:42             1
11.04.2017 10:46             1
11.04.2017 11:35             1
11.04.2017 13:33             1
11.04.2017 14:08             1
11.04.2017 14:31             1
11.04.2017 15:58             1
12.04.2017 11:21             1
28.04.2017 11:07             1
12.04.2017 13:43             1
12.04.2017 13:58             1
12.04.2017 15:26             1
13.04.2017 06:49             1
13.04.2017 07:49             1
13.04.2017 12:17             1
18.04.2017 10:13             1
18.04.2017 10:39             1
18.04.2017 11:46             1
11.04.2017 06:57             1
10.04.2017 16:56             1
10.04.2017 16:43             1
10.04.2017 16:22             1
07.04.2017 11:50             1
07.04.2017 12:01             1
07.04.2017 13:23             1
07.04.2017 15:14             1
07.04.2017 15:20             1
07.04.2017 15:24             1
07.04.2017 15:28             1
07.04.2017 15:53             1
10.04.2017 07:25             1
10.04.2017 07:33             1
10.04.2017 07:38             1
10.04.2017 07:39             1
10.04.2017 07:44             1
10.04.2017 07:49             1
10.04.2017 11:03             1
10.04.2017 12:56             1
10.04.2017 13:53             1
10.04.2017 15:33             1
10.04.2017 16:05             1
18.04.2017 12:28             1
18.04.2017 14:06             1
19.04.2017 10:59             1
24.04.2017 06:48             1
2017-04-25 00:00:00.000      1
25.04.2017 10:20             1
25.04.2017 10:41             1
25.04.2017 10:43             1
25.04.2017 10:45             1
25.04.2017 16:07             1
26.04.2017 12:14             1
26.04.2017 12:26             1
26.04.2017 13:29             1
26.04.2017 13:44             1
26.04.2017 15:35             1
26.04.2017 15:52             1
26.04.2017 16:08             1
26.04.2017 16:16             1
2017-04-27 00:00:00.000      1
27.04.2017 09:32             1
27.04.2017 12:59             1
27.04.2017 15:46             1
28.04.2017 08:02             1
24.04.2017 10:01             1
21.04.2017 16:37             1
19.04.2017 12:09             1
21.04.2017 16:24             1
19.04.2017 13:06             1
19.04.2017 13:51             1
19.04.2017 14:05             1
19.04.2017 15:08             1
2017-04-19 15:28:00.090      1
20.04.2017 08:31             1
20.04.2017 10:28             1
20.04.2017 10:47             1
20.04.2017 11:26             1
20.04.2017 11:41             1
20.04.2017 11:54             1
20.04.2017 12:06             1
20.04.2017 12:25             1
20.04.2017 15:16             1
20.04.2017 16:44             1
21.04.2017 11:19             1
21.04.2017 11:21             1
21.04.2017 12:05             1
2017-04-21 14:23:14.093      1
24.02.2017 16:54             1
24.02.2017 16:18             1
24.04.2015 11:05             1
16.03.2016 14:19             1
2016-02-01 00:00:00.000      1
05.02.2016 15:54             1
2016-02-06 00:00:00.000      1
2016-02-09 00:00:00.000      1
17.02.2016 10:45             1
29.02.2016 08:35             1
01.03.2016 18:05             1
08.03.2016 12:05             1
14.03.2016 15:10             1
2016-03-18 00:00:00.000      1
15.04.2016 09:35             1
2016-03-21 00:00:00.000      1
23.03.2016 11:58             1
29.03.2016 15:59             1
29.03.2016 16:06             1
2016-04-01 00:00:00.000      1
01.04.2016 08:36             1
04.04.2016 15:32             1
2016-04-07 00:00:00.000      1
11.04.2016 07:31             1
2016-01-26 12:30:27.043      1
25.01.2016 14:15             1
2016-01-25 00:00:00.000      1
22.01.2016 10:53             1
2015-10-08 00:00:00.000      1
08.10.2015 11:29             1
08.10.2015 13:32             1
2015-10-13 00:00:00.000      1
14.10.2015 15:34             1
21.10.2015 14:28             1
26.10.2015 10:32             1
27.10.2015 16:52             1
2015-11-01 00:00:00.000      1
03.11.2015 15:36             1
2015-11-07 00:00:00.000      1
2015-11-12 00:00:00.000      1
2015-11-16 00:00:00.000      1
2015-12-10 00:00:00.000      1
2015-12-24 00:00:00.000      1
2015-12-29 00:00:00.000      1
2015-12-30 00:00:00.000      1
2016-01-16 00:00:00.000      1
19.01.2016 16:45             1
2016-04-13 00:00:00.000      1
18.04.2016 15:26             1
2016-07-12 00:00:00.000      1
22.06.2016 15:25             1
06.06.2016 13:06             1
2016-06-07 00:00:00.000      1
2016-06-09 00:00:00.000      1
2016-06-10 00:00:00.000      1
2016-06-11 00:00:00.000      1
13.06.2016 08:58             1
17.06.2016 10:03             1
2016-06-18 00:00:00.000      1
2016-06-20 15:17:49.023      1
2016-06-23 00:00:00.000      1
20.04.2016 13:43             1
2016-06-25 00:00:00.000      1
2016-06-26 00:00:00.000      1
2016-06-30 00:00:00.000      1
2016-07-01 00:00:00.000      1
2016-07-05 00:00:00.000      1
2016-07-06 00:00:00.000      1
06.07.2016 14:17             1
2016-07-07 00:00:00.000      1
2016-07-10 00:00:00.000      1
06.06.2016 12:27             1
06.06.2016 11:14             1
2016-06-05 00:00:00.000      1
2016-06-03 00:00:00.000      1
2016-04-22 00:00:00.000      1
25.04.2016 12:15             1
2016-04-26 00:00:00.000      1
2016-05-05 00:00:00.000      1
2016-05-07 00:00:00.000      1
2016-05-11 00:00:00.000      1
2016-05-12 00:00:00.000      1
2016-05-14 00:00:00.000      1
2016-05-15 00:00:00.000      1
2016-05-16 00:00:00.000      1
2016-05-18 00:00:00.000      1
18.05.2016 09:44             1
2016-05-22 00:00:00.000      1
2016-05-23 00:00:00.000      1
25.05.2016 13:28             1
2016-05-30 00:00:00.000      1
31.05.2016 11:50             1
01.06.2016 10:18             1
02.06.2016 13:25             1
2015-10-06 00:00:00.000      1
2015-10-05 00:00:00.000      1
2015-10-02 13:57:53.063      1
22.05.2015 10:54             1
18.05.2015 11:29             1
2015-05-18 12:01:24.023      1
2015-05-18 12:31:38.020      1
18.05.2015 14:46             1
2015-05-18 14:52:41.093      1
18.05.2015 14:55             1
18.05.2015 15:01             1
19.05.2015 14:55             1
2015-05-21 08:02:59.047      1
26.05.2015 15:31             1
2015-10-01 00:00:00.000      1
27.05.2015 07:04             1
27.05.2015 09:19             1
2015-05-27 10:29:27.083      1
27.05.2015 10:47             1
27.05.2015 13:43             1
27.05.2015 13:58             1
28.05.2015 14:08             1
2015-05-30 00:00:00.000      1
01.06.2015 12:04             1
18.05.2015 10:14             1
15.05.2015 11:27             1
13.05.2015 10:06             1
13.05.2015 09:59             1
27.04.2015 14:51             1
30.04.2015 16:05             1
04.05.2015 10:07             1
04.05.2015 11:57             1
04.05.2015 12:06             1
04.05.2015 13:35             1
2015-05-04 13:46:32.030      1
04.05.2015 16:13             1
05.05.2015 07:49             1
07.05.2015 10:40             1
07.05.2015 14:40             1
2015-05-11 11:39:18.043      1
11.05.2015 11:45             1
11.05.2015 11:48             1
11.05.2015 11:52             1
11.05.2015 14:49             1
12.05.2015 14:22             1
13.05.2015 09:32             1
2015-05-13 09:52:56.053      1
03.06.2015 11:19             1
04.06.2015 09:28             1
05.06.2015 11:06             1
2015-07-26 00:00:00.000      1
27.07.2015 13:50             1
28.07.2015 15:42             1
30.07.2015 15:15             1
2015-08-02 00:00:00.000      1
05.08.2015 10:59             1
2015-08-09 00:00:00.000      1
2015-08-11 00:00:00.000      1
2015-08-13 00:00:00.000      1
2015-08-15 00:00:00.000      1
2015-08-24 00:00:00.000      1
26.08.2015 15:03             1
2015-08-27 00:00:00.000      1
09.09.2015 13:54             1
2015-09-10 00:00:00.000      1
2015-09-13 00:00:00.000      1
22.09.2015 17:21             1
23.09.2015 12:14             1
2015-09-24 00:00:00.000      1
2015-09-25 08:26:16.040      1
2015-07-27 00:00:00.000      1
2015-07-25 00:00:00.000      1
2015-06-06 00:00:00.000      1
24.07.2015 09:03             1
2015-06-08 11:57:44.043      1
08.06.2015 14:19             1
11.06.2015 15:05             1
15.06.2015 11:42             1
15.06.2015 15:06             1
23.06.2015 13:02             1
2015-06-26 00:00:00.000      1
2015-06-27 00:00:00.000      1
2015-06-28 00:00:00.000      1
2015-07-01 00:00:00.000      1
02.07.2015 09:12             1
2015-07-04 00:00:00.000      1
2015-07-12 00:00:00.000      1
16.07.2015 15:55             1
2015-07-19 00:00:00.000      1
2015-07-22 00:00:00.000      1
22.07.2015 07:33             1
2015-07-23 00:00:00.000      1
24.07.2015 07:24             1
11.07.2016 13:47             1
13.07.2016 08:19             1
23.02.2017 15:48             1
08.02.2017 16:08             1
06.02.2017 15:23             1
06.02.2017 15:43             1
06.02.2017 15:52             1
06.02.2017 18:11             1
07.02.2017 14:24             1
2017-02-07 16:22:37.080      1
08.02.2017 12:35             1
08.02.2017 15:31             1
08.02.2017 15:44             1
08.02.2017 16:47             1
13.02.2017 17:52             1
09.02.2017 09:59             1
09.02.2017 14:10             1
2017-02-10 00:00:00.000      1
10.02.2017 10:17             1
13.02.2017 07:40             1
13.02.2017 09:25             1
13.02.2017 10:40             1
13.02.2017 11:08             1
13.02.2017 17:38             1
06.02.2017 07:59             1
06.02.2017 07:42             1
03.02.2017 16:52             1
03.02.2017 14:59             1
2017-01-20 00:00:00.000      1
20.01.2017 13:05             1
23.01.2017 10:13             1
23.01.2017 13:28             1
25.01.2017 09:56             1
27.01.2017 07:22             1
2017-01-30 12:52:09.063      1
01.02.2017 07:45             1
2017-02-01 09:37:54.077      1
01.02.2017 11:03             1
01.02.2017 11:49             1
01.02.2017 13:41             1
02.02.2017 09:26             1
02.02.2017 10:04             1
02.02.2017 13:34             1
02.02.2017 14:52             1
03.02.2017 08:02             1
03.02.2017 08:21             1
03.02.2017 14:39             1
13.02.2017 17:49             1
13.02.2017 17:58             1
2016-07-15 00:00:00.000      1
21.02.2017 10:43             1
20.02.2017 11:28             1
20.02.2017 13:51             1
20.02.2017 16:33             1
20.02.2017 16:41             1
20.02.2017 16:43             1
20.02.2017 16:49             1
20.02.2017 16:54             1
20.02.2017 17:00             1
21.02.2017 09:27             1
21.02.2017 11:40             1
13.02.2017 18:01             1
21.02.2017 15:01             1
21.02.2017 17:18             1
2017-02-22 08:28:52.037      1
22.02.2017 12:28             1
22.02.2017 12:47             1
23.02.2017 07:05             1
23.02.2017 09:01             1
23.02.2017 09:28             1
23.02.2017 15:44             1
20.02.2017 10:29             1
20.02.2017 07:35             1
20.02.2017 07:18             1
17.02.2017 17:23             1
2017-02-13 18:07:31.053      1
13.02.2017 18:09             1
2017-02-14 00:00:00.000      1
14.02.2017 12:39             1
15.02.2017 09:50             1
15.02.2017 11:06             1
15.02.2017 11:08             1
15.02.2017 12:03             1
15.02.2017 15:54             1
15.02.2017 15:59             1
15.02.2017 16:06             1
16.02.2017 09:02             1
16.02.2017 09:33             1
16.02.2017 10:58             1
16.02.2017 16:36             1
16.02.2017 16:47             1
17.02.2017 07:20             1
17.02.2017 08:06             1
17.02.2017 15:57             1
2017-01-19 15:09:31.097      1
2017-01-18 00:00:00.000      1
16.01.2017 16:24             1
11.10.2016 09:50             1
13.09.2016 11:10             1
2016-09-17 00:00:00.000      1
2016-09-20 00:00:00.000      1
2016-09-24 00:00:00.000      1
2016-09-26 00:00:00.000      1
2016-09-29 00:00:00.000      1
2016-10-05 00:00:00.000      1
2016-10-08 00:00:00.000      1
2016-10-09 00:00:00.000      1
2016-10-14 00:00:00.000      1
2017-01-12 00:00:00.000      1
17.10.2016 15:22             1
18.10.2016 13:15             1
2016-10-25 00:00:00.000      1
25.10.2016 12:37             1
25.10.2016 15:23             1
2016-10-28 00:00:00.000      1
01.11.2016 13:33             1
2016-11-02 08:54:21.020      1
02.11.2016 16:33             1
13.09.2016 08:26             1
2016-09-13 00:00:00.000      1
2016-09-10 00:00:00.000      1
2016-09-08 00:00:00.000      1
2000-10-07 00:00:00.000      1
2016-07-24 00:00:00.000      1
2016-07-25 00:00:00.000      1
2016-07-27 00:00:00.000      1
2016-07-28 00:00:00.000      1
2016-08-02 00:00:00.000      1
2016-08-08 00:00:00.000      1
09.08.2016 15:13             1
2016-08-10 00:00:00.000      1
2016-08-14 00:00:00.000      1
2016-08-16 00:00:00.000      1
23.08.2016 09:38             1
2016-08-24 00:00:00.000      1
2016-08-30 00:00:00.000      1
2016-09-01 00:00:00.000      1
01.09.2016 11:35             1
2016-09-02 00:00:00.000      1
2016-09-04 00:00:00.000      1
2016-09-06 00:00:00.000      1
02.11.2016 16:40             1
02.11.2016 16:49             1
03.11.2016 16:21             1
2016-11-28 12:43:04.010      1
28.11.2016 14:04             1
30.11.2016 14:20             1
02.12.2016 12:37             1
2016-12-05 00:00:00.000      1
2016-12-08 12:50:32.067      1
08.12.2016 15:46             1
2016-12-14 00:00:00.000      1
2016-12-22 00:00:00.000      1
2016-12-28 00:00:00.000      1
2016-12-29 00:00:00.000      1
29.12.2016 15:36             1
2016-12-30 00:00:00.000      1
30.12.2016 12:14             1
2017-01-05 00:00:00.000      1
2017-01-08 00:00:00.000      1
09.01.2017 10:24             1
09.01.2017 10:43             1
2017-01-09 14:31:10.017      1
11.01.2017 14:23             1
2016-11-28 13:23:45.073      1
28.11.2016 11:40             1
04.11.2016 11:36             1
28.11.2016 11:14             1
2016-11-07 00:00:00.000      1
2016-11-08 00:00:00.000      1
09.11.2016 15:04             1
2016-11-10 00:00:00.000      1
10.11.2016 12:39             1
14.11.2016 11:13             1
15.11.2016 07:53             1
2016-11-16 13:29:16.077      1
16.11.2016 14:59             1
17.11.2016 14:13             1
17.11.2016 16:18             1
18.11.2016 08:30             1
18.11.2016 08:37             1
18.11.2016 09:45             1
2016-11-24 00:00:00.000      1
25.11.2016 13:11             1
25.11.2016 13:17             1
28.11.2016 08:02             1
28.11.2016 11:11             1
03.03.2025 06:30             1

Value counts for column 'Erkrankungsbeginn':
Erkrankungsbeginn
2002-01-28 00:00:00.000    80
2001-05-07 00:00:00.000    61
2002-02-25 00:00:00.000    61
2002-03-04 00:00:00.000    54
2001-04-30 00:00:00.000    54
2002-02-18 00:00:00.000    54
2001-03-26 00:00:00.000    53
2001-04-02 00:00:00.000    50
2001-05-18 00:00:00.000    49
2002-02-04 00:00:00.000    48
2001-03-01 00:00:00.000    47
2001-04-23 00:00:00.000    46
2002-01-14 00:00:00.000    46
2002-02-21 00:00:00.000    46
2001-04-20 00:00:00.000    45
2001-04-17 00:00:00.000    45
2002-02-26 00:00:00.000    45
2001-03-12 00:00:00.000    44
2002-02-14 00:00:00.000    44
2001-04-18 00:00:00.000    43
2001-04-12 00:00:00.000    43
2001-05-04 00:00:00.000    43
2001-05-03 00:00:00.000    43
2001-04-09 00:00:00.000    43
2001-04-19 00:00:00.000    43
2001-03-15 00:00:00.000    43
2001-05-28 00:00:00.000    43
2002-01-21 00:00:00.000    42
2001-03-30 00:00:00.000    42
2001-05-08 00:00:00.000    42
2001-05-14 00:00:00.000    42
2002-02-19 00:00:00.000    42
2002-01-25 00:00:00.000    42
2002-03-05 00:00:00.000    41
2002-01-17 00:00:00.000    41
2001-03-14 00:00:00.000    41
2001-04-04 00:00:00.000    40
2001-03-19 00:00:00.000    40
2001-05-02 00:00:00.000    40
2002-02-11 00:00:00.000    40
2001-06-11 00:00:00.000    39
2002-01-18 00:00:00.000    39
2006-04-03 00:00:00.000    39
2001-03-13 00:00:00.000    38
2002-03-11 00:00:00.000    38
2001-03-10 00:00:00.000    38
2001-03-27 00:00:00.000    37
2002-01-02 00:00:00.000    37
2001-05-25 00:00:00.000    37
2001-03-20 00:00:00.000    37
2002-03-06 00:00:00.000    37
2001-04-03 00:00:00.000    36
2001-03-16 00:00:00.000    36
2001-03-09 00:00:00.000    36
2001-05-10 00:00:00.000    36
2002-03-14 00:00:00.000    36
2002-03-01 00:00:00.000    35
2002-02-22 00:00:00.000    35
2001-05-17 00:00:00.000    35
2001-04-08 00:00:00.000    34
2001-03-17 00:00:00.000    34
2001-04-22 00:00:00.000    34
2001-04-05 00:00:00.000    34
2002-01-07 00:00:00.000    33
2001-04-24 00:00:00.000    33
2002-03-25 00:00:00.000    33
2001-03-02 00:00:00.000    33
2001-02-28 00:00:00.000    33
2001-05-21 00:00:00.000    32
2001-04-06 00:00:00.000    32
2001-06-18 00:00:00.000    32
2001-03-29 00:00:00.000    32
2006-04-04 00:00:00.000    32
2002-02-27 00:00:00.000    32
2006-04-18 00:00:00.000    32
2002-02-28 00:00:00.000    32
2002-02-15 00:00:00.000    32
2001-04-10 00:00:00.000    31
2001-06-01 00:00:00.000    31
2002-04-08 00:00:00.000    31
2001-04-15 00:00:00.000    31
2001-05-15 00:00:00.000    31
2002-03-15 00:00:00.000    31
2002-03-18 00:00:00.000    31
2002-03-07 00:00:00.000    31
2001-03-05 00:00:00.000    31
2001-04-21 00:00:00.000    30
2001-04-01 00:00:00.000    30
2006-04-17 00:00:00.000    30
2001-04-11 00:00:00.000    30
2001-05-30 00:00:00.000    30
2002-02-20 00:00:00.000    30
2001-06-05 00:00:00.000    30
2001-03-23 00:00:00.000    30
2006-03-22 00:00:00.000    30
2006-04-10 00:00:00.000    29
2001-02-20 00:00:00.000    29
2015-03-20 00:00:00.000    29
2006-03-24 00:00:00.000    29
2006-04-06 00:00:00.000    29
2001-04-26 00:00:00.000    29
2001-04-25 00:00:00.000    29
2002-05-13 00:00:00.000    29
2001-03-21 00:00:00.000    29
2001-03-25 00:00:00.000    29
2002-02-01 00:00:00.000    29
2006-03-27 00:00:00.000    29
2001-03-28 00:00:00.000    29
2001-02-26 00:00:00.000    28
2002-01-10 00:00:00.000    28
2002-02-13 00:00:00.000    28
2002-02-12 00:00:00.000    28
2001-04-27 00:00:00.000    28
2001-05-11 00:00:00.000    28
2001-05-09 00:00:00.000    28
2015-01-15 00:00:00.000    28
2001-05-31 00:00:00.000    28
2001-04-16 00:00:00.000    28
2001-04-07 00:00:00.000    28
2001-05-20 00:00:00.000    28
2006-03-13 00:00:00.000    28
2001-03-07 00:00:00.000    27
2015-03-16 00:00:00.000    27
2002-04-02 00:00:00.000    27
2002-03-26 00:00:00.000    27
2001-02-19 00:00:00.000    27
2002-02-08 00:00:00.000    27
2001-03-06 00:00:00.000    27
2002-01-22 00:00:00.000    27
2001-05-19 00:00:00.000    26
2011-04-20 00:00:00.000    26
2002-01-15 00:00:00.000    26
2001-05-05 00:00:00.000    26
2002-01-24 00:00:00.000    26
2002-02-05 00:00:00.000    26
2001-05-06 00:00:00.000    26
2015-02-13 00:00:00.000    26
2002-01-03 00:00:00.000    26
2001-07-02 00:00:00.000    26
2015-03-12 00:00:00.000    26
2002-02-17 00:00:00.000    26
2015-03-30 00:00:00.000    26
2006-03-30 00:00:00.000    26
2015-04-01 00:00:00.000    26
2015-02-27 00:00:00.000    26
2006-04-05 00:00:00.000    26
2006-03-20 00:00:00.000    26
2001-05-01 00:00:00.000    26
2001-03-11 00:00:00.000    25
2001-03-22 00:00:00.000    25
2015-02-25 00:00:00.000    25
2006-03-23 00:00:00.000    25
2001-05-22 00:00:00.000    25
2006-04-07 00:00:00.000    25
2002-04-22 00:00:00.000    25
2006-04-20 00:00:00.000    25
2001-04-14 00:00:00.000    25
2001-12-27 00:00:00.000    25
2015-04-09 00:00:00.000    25
2015-04-16 00:00:00.000    25
2002-03-28 00:00:00.000    24
2006-03-21 00:00:00.000    24
2006-04-25 00:00:00.000    24
2006-04-01 00:00:00.000    24
2006-03-06 00:00:00.000    24
2002-03-20 00:00:00.000    24
2006-04-13 00:00:00.000    24
2013-05-17 00:00:00.000    24
2015-04-08 00:00:00.000    24
2002-03-19 00:00:00.000    24
2015-02-23 00:00:00.000    24
2001-03-08 00:00:00.000    24
2013-05-15 00:00:00.000    24
2001-03-04 00:00:00.000    24
2001-03-18 00:00:00.000    24
2013-05-23 00:00:00.000    23
2015-03-27 00:00:00.000    23
2011-05-02 00:00:00.000    23
2015-03-09 00:00:00.000    23
2002-03-02 00:00:00.000    23
2001-03-03 00:00:00.000    23
2015-01-16 00:00:00.000    23
2001-06-07 00:00:00.000    23
2001-06-15 00:00:00.000    23
2013-05-18 00:00:00.000    23
2006-04-16 00:00:00.000    23
2002-02-03 00:00:00.000    23
2001-05-29 00:00:00.000    23
2011-04-18 00:00:00.000    22
2006-03-10 00:00:00.000    22
2002-02-10 00:00:00.000    22
2008-04-24 00:00:00.000    22
2015-03-02 00:00:00.000    22
2015-04-07 00:00:00.000    22
2006-04-02 00:00:00.000    22
2001-02-13 00:00:00.000    22
2013-05-16 00:00:00.000    22
2015-01-20 00:00:00.000    22
2013-05-13 00:00:00.000    22
2002-03-30 00:00:00.000    22
2002-03-10 00:00:00.000    22
2001-04-13 00:00:00.000    22
2015-01-04 00:00:00.000    22
2013-06-02 00:00:00.000    22
2024-08-30 00:00:00.000    21
2006-03-11 00:00:00.000    21
2001-12-28 00:00:00.000    21
2013-06-03 00:00:00.000    21
2006-04-15 00:00:00.000    21
2001-12-17 00:00:00.000    21
2013-06-07 00:00:00.000    21
2002-03-08 00:00:00.000    21
2006-03-29 00:00:00.000    21
2006-05-11 00:00:00.000    21
2001-04-28 00:00:00.000    21
2015-03-24 00:00:00.000    21
2015-02-17 00:00:00.000    21
2015-03-18 00:00:00.000    21
2015-03-19 00:00:00.000    21
2001-03-24 00:00:00.000    21
2002-02-02 00:00:00.000    20
2001-02-27 00:00:00.000    20
2002-02-06 00:00:00.000    20
2006-05-24 00:00:00.000    20
2015-03-13 00:00:00.000    20
2001-06-19 00:00:00.000    20
2006-04-27 00:00:00.000    20
2002-05-05 00:00:00.000    20
2001-02-02 00:00:00.000    20
2015-01-17 00:00:00.000    20
2002-02-16 00:00:00.000    20
2001-02-21 00:00:00.000    20
2015-01-18 00:00:00.000    20
2015-04-03 00:00:00.000    20
2015-03-25 00:00:00.000    20
2015-04-23 00:00:00.000    20
2002-01-31 00:00:00.000    20
2011-04-17 00:00:00.000    20
2001-03-31 00:00:00.000    20
2002-02-07 00:00:00.000    20
2015-02-28 00:00:00.000    20
2015-04-20 00:00:00.000    20
2002-03-17 00:00:00.000    20
2002-01-23 00:00:00.000    20
2002-03-12 00:00:00.000    20
2001-05-23 00:00:00.000    20
2013-05-10 00:00:00.000    20
2001-05-16 00:00:00.000    20
2013-05-30 00:00:00.000    19
2013-05-24 00:00:00.000    19
2002-03-03 00:00:00.000    19
2015-03-22 00:00:00.000    19
2002-04-11 00:00:00.000    19
2006-06-09 00:00:00.000    19
2001-06-29 00:00:00.000    19
2015-03-28 00:00:00.000    19
2013-05-28 00:00:00.000    19
2013-05-06 00:00:00.000    19
2001-06-08 00:00:00.000    19
2001-06-20 00:00:00.000    19
2001-06-22 00:00:00.000    19
2006-05-17 00:00:00.000    19
2006-04-24 00:00:00.000    19
2015-01-19 00:00:00.000    19
2002-03-16 00:00:00.000    19
2006-04-21 00:00:00.000    19
2001-04-29 00:00:00.000    19
2011-05-01 00:00:00.000    19
2002-05-20 00:00:00.000    19
2002-01-09 00:00:00.000    19
2011-04-19 00:00:00.000    19
2006-03-16 00:00:00.000    19
2011-05-09 00:00:00.000    19
2011-04-22 00:00:00.000    19
2015-03-10 00:00:00.000    19
2006-05-15 00:00:00.000    19
2008-03-29 00:00:00.000    19
2011-05-16 00:00:00.000    19
2002-01-29 00:00:00.000    19
2015-04-10 00:00:00.000    19
2006-05-01 00:00:00.000    18
2015-03-31 00:00:00.000    18
2002-03-21 00:00:00.000    18
2006-02-24 00:00:00.000    18
2001-06-13 00:00:00.000    18
2014-12-20 00:00:00.000    18
2002-01-30 00:00:00.000    18
2001-06-14 00:00:00.000    18
2006-03-17 00:00:00.000    18
2015-02-16 00:00:00.000    18
2013-05-19 00:00:00.000    18
2013-05-21 00:00:00.000    18
2001-07-09 00:00:00.000    18
2013-06-11 00:00:00.000    18
2001-02-15 00:00:00.000    18
2015-03-17 00:00:00.000    18
2013-06-01 00:00:00.000    18
2015-01-14 00:00:00.000    18
2001-12-03 00:00:00.000    18
2002-04-20 00:00:00.000    18
2001-06-28 00:00:00.000    18
2015-03-14 00:00:00.000    18
2015-03-15 00:00:00.000    18
2002-05-03 00:00:00.000    18
2013-05-26 00:00:00.000    17
2001-02-10 00:00:00.000    17
2015-03-23 00:00:00.000    17
2015-02-22 00:00:00.000    17
2002-03-13 00:00:00.000    17
2002-01-08 00:00:00.000    17
2013-05-14 00:00:00.000    17
2002-02-24 00:00:00.000    17
2015-03-01 00:00:00.000    17
2001-01-29 00:00:00.000    17
2008-04-28 00:00:00.000    17
2008-04-13 00:00:00.000    17
2015-03-06 00:00:00.000    17
2005-05-20 00:00:00.000    17
2002-02-09 00:00:00.000    17
2001-12-10 00:00:00.000    17
2006-04-11 00:00:00.000    17
2011-04-11 00:00:00.000    17
2006-03-01 00:00:00.000    17
2006-05-19 00:00:00.000    17
2001-06-25 00:00:00.000    17
2002-05-10 00:00:00.000    17
2002-05-14 00:00:00.000    17
2002-06-16 00:00:00.000    17
2002-05-08 00:00:00.000    17
2006-03-08 00:00:00.000    17
2011-04-21 00:00:00.000    17
2011-05-19 00:00:00.000    17
2015-02-05 00:00:00.000    17
2011-04-08 00:00:00.000    17
2015-04-02 00:00:00.000    17
2002-05-24 00:00:00.000    17
2001-07-03 00:00:00.000    17
2011-05-23 00:00:00.000    17
2006-05-02 00:00:00.000    17
2011-05-06 00:00:00.000    17
2013-05-02 00:00:00.000    17
2015-02-06 00:00:00.000    16
2002-01-01 00:00:00.000    16
2002-05-06 00:00:00.000    16
2002-04-29 00:00:00.000    16
2002-05-12 00:00:00.000    16
2006-05-13 00:00:00.000    16
2001-01-31 00:00:00.000    16
2015-03-07 00:00:00.000    16
2001-05-12 00:00:00.000    16
2015-02-11 00:00:00.000    16
2015-03-04 00:00:00.000    16
2008-04-25 00:00:00.000    16
2011-04-14 00:00:00.000    16
2006-05-12 00:00:00.000    16
2006-04-19 00:00:00.000    16
2015-01-09 00:00:00.000    16
2008-04-11 00:00:00.000    16
2011-04-07 00:00:00.000    16
2011-04-05 00:00:00.000    16
2002-06-03 00:00:00.000    16
2002-05-27 00:00:00.000    16
2002-01-26 00:00:00.000    16
2015-02-24 00:00:00.000    16
2011-05-12 00:00:00.000    16
2001-12-24 00:00:00.000    16
2015-04-24 00:00:00.000    16
2015-04-19 00:00:00.000    16
2006-05-22 00:00:00.000    16
2001-05-27 00:00:00.000    16
2001-05-24 00:00:00.000    16
2001-06-02 00:00:00.000    16
2001-06-09 00:00:00.000    16
2001-06-10 00:00:00.000    16
2002-03-29 00:00:00.000    16
2002-04-09 00:00:00.000    16
2002-04-13 00:00:00.000    16
2015-04-17 00:00:00.000    16
2006-03-28 00:00:00.000    16
2002-04-10 00:00:00.000    16
2011-05-13 00:00:00.000    16
2013-05-29 00:00:00.000    16
2001-06-26 00:00:00.000    16
2001-05-26 00:00:00.000    16
2001-02-23 00:00:00.000    16
2006-03-31 00:00:00.000    16
2002-04-16 00:00:00.000    16
2013-06-04 00:00:00.000    16
2001-02-12 00:00:00.000    16
2002-04-24 00:00:00.000    16
2001-02-09 00:00:00.000    16
2015-03-26 00:00:00.000    16
2015-01-29 00:00:00.000    16
2015-01-05 00:00:00.000    15
2006-03-09 00:00:00.000    15
2015-04-11 00:00:00.000    15
2015-01-12 00:00:00.000    15
2015-04-06 00:00:00.000    15
2002-06-10 00:00:00.000    15
2006-03-15 00:00:00.000    15
2015-02-21 00:00:00.000    15
2002-04-15 00:00:00.000    15
2015-01-07 00:00:00.000    15
2002-06-17 00:00:00.000    15
2015-03-03 00:00:00.000    15
2015-03-05 00:00:00.000    15
2015-03-29 00:00:00.000    15
2015-02-08 00:00:00.000    15
2011-05-31 00:00:00.000    15
2006-05-10 00:00:00.000    15
2001-02-01 00:00:00.000    15
2006-04-23 00:00:00.000    15
2006-06-23 00:00:00.000    15
2011-05-11 00:00:00.000    15
2011-04-29 00:00:00.000    15
2001-02-08 00:00:00.000    15
2001-02-16 00:00:00.000    15
2013-05-31 00:00:00.000    15
2001-01-24 00:00:00.000    15
2015-04-13 00:00:00.000    15
2008-04-16 00:00:00.000    15
2006-04-14 00:00:00.000    15
2001-12-13 00:00:00.000    15
2006-06-02 00:00:00.000    15
2008-04-14 00:00:00.000    15
2011-04-16 00:00:00.000    15
2001-12-19 00:00:00.000    15
2006-05-09 00:00:00.000    15
2001-02-22 00:00:00.000    15
2001-07-01 00:00:00.000    15
2011-05-17 00:00:00.000    15
2001-02-25 00:00:00.000    15
2002-01-04 00:00:00.000    15
2001-06-16 00:00:00.000    15
2006-04-29 00:00:00.000    15
2011-05-20 00:00:00.000    15
2006-04-26 00:00:00.000    15
2001-01-08 00:00:00.000    15
2006-03-26 00:00:00.000    15
2002-01-20 00:00:00.000    15
2001-01-26 00:00:00.000    15
2006-03-07 00:00:00.000    14
2011-05-05 00:00:00.000    14
2011-05-03 00:00:00.000    14
2001-01-27 00:00:00.000    14
2015-03-11 00:00:00.000    14
2011-05-14 00:00:00.000    14
2011-04-28 00:00:00.000    14
2015-02-09 00:00:00.000    14
2015-03-08 00:00:00.000    14
2015-03-21 00:00:00.000    14
2002-05-21 00:00:00.000    14
2002-05-11 00:00:00.000    14
2001-01-22 00:00:00.000    14
2015-01-23 00:00:00.000    14
2001-06-06 00:00:00.000    14
2015-02-04 00:00:00.000    14
2002-06-21 00:00:00.000    14
2001-06-21 00:00:00.000    14
2001-06-27 00:00:00.000    14
2006-05-07 00:00:00.000    14
2006-04-28 00:00:00.000    14
2015-01-06 00:00:00.000    14
2001-02-05 00:00:00.000    14
2015-01-30 00:00:00.000    14
2006-06-08 00:00:00.000    14
2001-02-07 00:00:00.000    14
2011-04-01 00:00:00.000    14
2006-03-25 00:00:00.000    14
2014-12-08 00:00:00.000    14
2017-03-10 00:00:00.000    14
2006-02-14 00:00:00.000    14
2008-05-02 00:00:00.000    14
2015-04-29 00:00:00.000    14
2002-04-03 00:00:00.000    14
2013-05-20 00:00:00.000    14
2002-03-23 00:00:00.000    14
2015-02-18 00:00:00.000    14
2013-06-15 00:00:00.000    14
2001-12-26 00:00:00.000    14
2013-05-03 00:00:00.000    14
2008-05-06 00:00:00.000    14
2013-07-11 00:00:00.000    14
2013-07-15 00:00:00.000    14
2013-05-08 00:00:00.000    14
2008-03-18 00:00:00.000    14
2002-01-11 00:00:00.000    14
2015-02-07 00:00:00.000    14
2013-06-06 00:00:00.000    13
2011-04-03 00:00:00.000    13
2001-02-03 00:00:00.000    13
2013-05-12 00:00:00.000    13
2006-06-06 00:00:00.000    13
2017-02-24 00:00:00.000    13
2001-11-21 00:00:00.000    13
2013-05-27 00:00:00.000    13
2014-12-31 00:00:00.000    13
2002-04-14 00:00:00.000    13
2013-06-05 00:00:00.000    13
2015-01-13 00:00:00.000    13
2001-01-30 00:00:00.000    13
2013-06-14 00:00:00.000    13
2006-05-30 00:00:00.000    13
2001-12-21 00:00:00.000    13
2010-04-01 00:00:00.000    13
2015-02-15 00:00:00.000    13
2001-12-31 00:00:00.000    13
2006-05-20 00:00:00.000    13
2015-02-14 00:00:00.000    13
2015-02-12 00:00:00.000    13
2013-07-03 00:00:00.000    13
2002-01-16 00:00:00.000    13
2002-01-12 00:00:00.000    13
2013-06-13 00:00:00.000    13
2013-05-11 00:00:00.000    13
2001-01-28 00:00:00.000    13
2002-04-04 00:00:00.000    13
2003-02-04 00:00:00.000    13
2011-05-24 00:00:00.000    13
2006-04-30 00:00:00.000    13
2002-04-18 00:00:00.000    13
2002-04-05 00:00:00.000    13
2002-04-26 00:00:00.000    13
2001-01-21 00:00:00.000    13
2003-01-01 00:00:00.000    13
2002-12-31 00:00:00.000    13
2011-04-10 00:00:00.000    13
2002-04-01 00:00:00.000    13
2017-04-01 00:00:00.000    13
2011-05-07 00:00:00.000    13
2002-05-07 00:00:00.000    13
2006-06-12 00:00:00.000    13
2013-05-22 00:00:00.000    13
2011-04-24 00:00:00.000    13
2002-03-22 00:00:00.000    13
2015-02-26 00:00:00.000    13
2011-05-04 00:00:00.000    13
2006-05-21 00:00:00.000    13
2017-02-12 00:00:00.000    12
2008-04-15 00:00:00.000    12
2008-05-04 00:00:00.000    12
2008-05-09 00:00:00.000    12
2006-05-29 00:00:00.000    12
2001-01-18 00:00:00.000    12
2008-03-15 00:00:00.000    12
2006-05-27 00:00:00.000    12
2015-02-19 00:00:00.000    12
2006-05-26 00:00:00.000    12
2008-04-01 00:00:00.000    12
2008-05-03 00:00:00.000    12
2013-07-01 00:00:00.000    12
2024-08-29 00:00:00.000    12
2015-04-18 00:00:00.000    12
2011-05-22 00:00:00.000    12
2011-05-15 00:00:00.000    12
2011-05-10 00:00:00.000    12
2015-05-14 00:00:00.000    12
2002-05-02 00:00:00.000    12
2015-05-11 00:00:00.000    12
2013-05-04 00:00:00.000    12
2002-05-16 00:00:00.000    12
2011-04-27 00:00:00.000    12
2015-05-08 00:00:00.000    12
2015-05-04 00:00:00.000    12
2014-12-23 00:00:00.000    12
2013-05-09 00:00:00.000    12
2002-05-26 00:00:00.000    12
2013-05-25 00:00:00.000    12
2002-05-29 00:00:00.000    12
2001-06-12 00:00:00.000    12
2001-06-30 00:00:00.000    12
2010-03-19 00:00:00.000    12
2006-05-06 00:00:00.000    12
2006-05-08 00:00:00.000    12
2002-01-06 00:00:00.000    12
2018-06-11 00:00:00.000    12
2002-06-04 00:00:00.000    12
2015-01-02 00:00:00.000    12
2013-07-05 00:00:00.000    12
2013-06-20 00:00:00.000    11
2013-06-25 00:00:00.000    11
2013-06-12 00:00:00.000    11
2013-07-10 00:00:00.000    11
2013-04-24 00:00:00.000    11
2008-04-30 00:00:00.000    11
2013-05-07 00:00:00.000    11
2013-07-09 00:00:00.000    11
2006-02-25 00:00:00.000    11
2013-04-30 00:00:00.000    11
2006-05-25 00:00:00.000    11
2006-02-17 00:00:00.000    11
2011-04-09 00:00:00.000    11
2011-03-12 00:00:00.000    11
2015-01-27 00:00:00.000    11
2006-06-03 00:00:00.000    11
2011-03-19 00:00:00.000    11
2011-03-21 00:00:00.000    11
2015-01-31 00:00:00.000    11
2011-04-04 00:00:00.000    11
2011-04-02 00:00:00.000    11
2015-02-01 00:00:00.000    11
2011-06-04 00:00:00.000    11
2015-02-03 00:00:00.000    11
2013-07-04 00:00:00.000    11
2011-04-23 00:00:00.000    11
2011-04-26 00:00:00.000    11
2011-05-08 00:00:00.000    11
2015-01-26 00:00:00.000    11
2011-05-26 00:00:00.000    11
2024-07-13 00:00:00.000    11
2008-05-08 00:00:00.000    11
2015-02-20 00:00:00.000    11
2001-02-24 00:00:00.000    11
2002-01-27 00:00:00.000    11
2001-12-14 00:00:00.000    11
2001-12-18 00:00:00.000    11
2001-12-20 00:00:00.000    11
2001-11-24 00:00:00.000    11
2001-11-26 00:00:00.000    11
2006-04-09 00:00:00.000    11
2001-07-08 00:00:00.000    11
2002-05-17 00:00:00.000    11
2015-04-05 00:00:00.000    11
2017-02-21 00:00:00.000    11
2002-05-01 00:00:00.000    11
2001-11-19 00:00:00.000    11
2002-01-19 00:00:00.000    11
2017-03-24 00:00:00.000    11
2001-12-04 00:00:00.000    11
2001-02-14 00:00:00.000    11
2016-07-01 00:00:00.000    11
2002-05-22 00:00:00.000    11
2002-04-23 00:00:00.000    11
2002-04-19 00:00:00.000    11
2001-02-04 00:00:00.000    11
2015-05-02 00:00:00.000    11
2002-04-27 00:00:00.000    11
2002-07-12 00:00:00.000    11
2001-02-17 00:00:00.000    11
2015-05-15 00:00:00.000    11
2002-05-23 00:00:00.000    11
2002-04-12 00:00:00.000    11
2001-11-29 00:00:00.000    10
2015-05-06 00:00:00.000    10
2015-04-22 00:00:00.000    10
2003-05-27 00:00:00.000    10
2013-05-05 00:00:00.000    10
2015-04-30 00:00:00.000    10
2015-02-10 00:00:00.000    10
2001-12-25 00:00:00.000    10
2001-12-15 00:00:00.000    10
2013-06-09 00:00:00.000    10
2013-06-08 00:00:00.000    10
2001-12-22 00:00:00.000    10
2006-03-19 00:00:00.000    10
2013-06-18 00:00:00.000    10
2013-06-22 00:00:00.000    10
2013-06-26 00:00:00.000    10
2013-06-28 00:00:00.000    10
2002-02-23 00:00:00.000    10
2002-04-07 00:00:00.000    10
2013-07-18 00:00:00.000    10
2006-02-28 00:00:00.000    10
2013-08-11 00:00:00.000    10
2006-03-03 00:00:00.000    10
2015-05-07 00:00:00.000    10
2011-07-15 00:00:00.000    10
2013-04-25 00:00:00.000    10
2009-02-17 00:00:00.000    10
2010-03-20 00:00:00.000    10
2001-06-24 00:00:00.000    10
2001-06-04 00:00:00.000    10
2001-06-03 00:00:00.000    10
2009-05-23 00:00:00.000    10
2001-02-18 00:00:00.000    10
2009-03-03 00:00:00.000    10
2006-06-14 00:00:00.000    10
2010-06-07 00:00:00.000    10
2006-06-19 00:00:00.000    10
2001-01-25 00:00:00.000    10
2001-01-15 00:00:00.000    10
2017-02-14 00:00:00.000    10
2017-02-10 00:00:00.000    10
2008-03-28 00:00:00.000    10
2008-04-03 00:00:00.000    10
2010-03-22 00:00:00.000    10
2006-04-12 00:00:00.000    10
2006-04-22 00:00:00.000    10
2006-04-08 00:00:00.000    10
2018-06-25 00:00:00.000    10
2002-04-25 00:00:00.000    10
2011-06-27 00:00:00.000    10
2011-06-10 00:00:00.000    10
2011-06-01 00:00:00.000    10
2017-05-01 00:00:00.000    10
2011-05-21 00:00:00.000    10
2017-04-02 00:00:00.000    10
2001-07-17 00:00:00.000    10
2011-04-30 00:00:00.000    10
2011-04-25 00:00:00.000    10
2011-04-15 00:00:00.000    10
2011-04-13 00:00:00.000    10
2001-08-01 00:00:00.000    10
2011-03-20 00:00:00.000    10
2006-05-04 00:00:00.000    10
2002-04-17 00:00:00.000    10
2011-05-27 00:00:00.000    10
2002-04-28 00:00:00.000    10
2014-12-25 00:00:00.000    10
2015-04-04 00:00:00.000    10
2002-05-18 00:00:00.000    10
2002-05-25 00:00:00.000    10
2015-01-25 00:00:00.000    10
2006-03-18 00:00:00.000    10
2003-01-03 00:00:00.000    10
2015-01-21 00:00:00.000    10
2015-01-10 00:00:00.000    10
2002-06-06 00:00:00.000     9
2011-03-05 00:00:00.000     9
2011-03-24 00:00:00.000     9
2017-02-26 00:00:00.000     9
2015-04-21 00:00:00.000     9
2017-05-12 00:00:00.000     9
2001-07-23 00:00:00.000     9
2001-11-27 00:00:00.000     9
2015-04-14 00:00:00.000     9
2006-05-03 00:00:00.000     9
2017-02-25 00:00:00.000     9
2014-12-12 00:00:00.000     9
2015-04-12 00:00:00.000     9
2002-06-09 00:00:00.000     9
2006-05-05 00:00:00.000     9
2001-12-16 00:00:00.000     9
2002-06-07 00:00:00.000     9
2013-06-17 00:00:00.000     9
2002-06-19 00:00:00.000     9
2006-05-18 00:00:00.000     9
2001-07-30 00:00:00.000     9
2010-06-14 00:00:00.000     9
2001-11-20 00:00:00.000     9
2002-01-05 00:00:00.000     9
2018-05-19 00:00:00.000     9
2013-04-08 00:00:00.000     9
2015-05-20 00:00:00.000     9
2015-05-27 00:00:00.000     9
2013-04-10 00:00:00.000     9
2011-06-24 00:00:00.000     9
2015-01-01 00:00:00.000     9
2024-07-15 00:00:00.000     9
2015-05-13 00:00:00.000     9
2011-05-25 00:00:00.000     9
2017-04-25 00:00:00.000     9
2015-05-12 00:00:00.000     9
2011-05-18 00:00:00.000     9
2024-08-27 00:00:00.000     9
2017-04-06 00:00:00.000     9
2017-03-30 00:00:00.000     9
2017-03-22 00:00:00.000     9
2017-03-05 00:00:00.000     9
2001-11-12 00:00:00.000     9
2002-05-19 00:00:00.000     9
2001-08-03 00:00:00.000     9
2015-04-25 00:00:00.000     9
2006-02-26 00:00:00.000     9
2002-03-09 00:00:00.000     9
2005-03-17 00:00:00.000     9
2006-03-12 00:00:00.000     9
2006-02-27 00:00:00.000     9
2017-02-16 00:00:00.000     9
2017-02-09 00:00:00.000     9
2013-07-20 00:00:00.000     9
2008-04-10 00:00:00.000     9
2008-04-12 00:00:00.000     9
2009-02-25 00:00:00.000     9
2001-01-23 00:00:00.000     9
2001-02-06 00:00:00.000     9
2002-03-27 00:00:00.000     9
2002-03-24 00:00:00.000     9
2001-02-11 00:00:00.000     9
2009-01-27 00:00:00.000     9
2002-01-13 00:00:00.000     9
2017-01-29 00:00:00.000     9
2008-05-10 00:00:00.000     9
2013-07-06 00:00:00.000     9
2003-01-02 00:00:00.000     9
2007-04-07 00:00:00.000     9
2008-03-30 00:00:00.000     9
2007-05-31 00:00:00.000     9
2006-06-21 00:00:00.000     9
2017-04-15 00:00:00.000     8
2017-03-23 00:00:00.000     8
2001-01-12 00:00:00.000     8
2006-06-25 00:00:00.000     8
2017-03-31 00:00:00.000     8
2017-04-10 00:00:00.000     8
2017-03-25 00:00:00.000     8
2008-04-21 00:00:00.000     8
2002-05-31 00:00:00.000     8
2017-04-19 00:00:00.000     8
2019-03-25 00:00:00.000     8
2005-06-02 00:00:00.000     8
2017-04-20 00:00:00.000     8
2008-04-22 00:00:00.000     8
2008-04-17 00:00:00.000     8
2005-06-03 00:00:00.000     8
2008-04-02 00:00:00.000     8
2008-03-26 00:00:00.000     8
2006-02-15 00:00:00.000     8
2011-06-11 00:00:00.000     8
2011-06-22 00:00:00.000     8
2015-05-26 00:00:00.000     8
2008-03-25 00:00:00.000     8
2008-03-16 00:00:00.000     8
2007-04-08 00:00:00.000     8
2008-04-26 00:00:00.000     8
2008-06-01 00:00:00.000     8
2005-05-02 00:00:00.000     8
2010-05-08 00:00:00.000     8
2009-02-23 00:00:00.000     8
2001-01-04 00:00:00.000     8
2019-01-04 00:00:00.000     8
2002-06-12 00:00:00.000     8
2024-08-21 00:00:00.000     8
2010-05-24 00:00:00.000     8
2010-04-26 00:00:00.000     8
2001-08-07 00:00:00.000     8
2009-04-01 00:00:00.000     8
2001-07-06 00:00:00.000     8
2010-03-31 00:00:00.000     8
2005-03-07 00:00:00.000     8
2015-02-02 00:00:00.000     8
2001-05-13 00:00:00.000     8
2011-03-06 00:00:00.000     8
2001-07-18 00:00:00.000     8
2011-03-11 00:00:00.000     8
2016-05-18 00:00:00.000     8
2011-03-22 00:00:00.000     8
2002-07-09 00:00:00.000     8
2011-03-28 00:00:00.000     8
2001-07-25 00:00:00.000     8
2006-06-13 00:00:00.000     8
2006-06-15 00:00:00.000     8
2002-07-11 00:00:00.000     8
2006-06-17 00:00:00.000     8
2019-03-07 00:00:00.000     8
2008-05-23 00:00:00.000     8
2017-03-04 00:00:00.000     8
2008-05-19 00:00:00.000     8
2003-01-17 00:00:00.000     8
2013-09-26 00:00:00.000     8
2007-03-19 00:00:00.000     8
2013-06-10 00:00:00.000     8
2013-04-06 00:00:00.000     8
2006-03-04 00:00:00.000     8
2002-04-21 00:00:00.000     8
2013-04-14 00:00:00.000     8
2003-01-31 00:00:00.000     8
2002-04-06 00:00:00.000     8
2003-02-10 00:00:00.000     8
2013-06-16 00:00:00.000     8
2013-06-19 00:00:00.000     8
2002-04-30 00:00:00.000     8
2015-05-03 00:00:00.000     8
2013-04-18 00:00:00.000     8
2013-05-01 00:00:00.000     8
2013-04-13 00:00:00.000     8
2013-08-02 00:00:00.000     8
2006-02-22 00:00:00.000     8
2013-04-22 00:00:00.000     8
2013-06-24 00:00:00.000     8
2014-12-22 00:00:00.000     8
2015-04-28 00:00:00.000     8
2001-11-28 00:00:00.000     8
2001-11-23 00:00:00.000     8
2002-05-15 00:00:00.000     8
2001-11-30 00:00:00.000     8
2001-12-12 00:00:00.000     8
2013-04-12 00:00:00.000     8
2015-04-15 00:00:00.000     8
2001-12-07 00:00:00.000     8
2013-07-02 00:00:00.000     8
2002-12-09 00:00:00.000     8
2001-12-06 00:00:00.000     8
2006-05-31 00:00:00.000     7
2002-06-24 00:00:00.000     7
2013-06-29 00:00:00.000     7
2013-06-23 00:00:00.000     7
2006-05-23 00:00:00.000     7
2002-06-25 00:00:00.000     7
2002-12-30 00:00:00.000     7
2015-01-22 00:00:00.000     7
2016-06-15 00:00:00.000     7
2006-05-16 00:00:00.000     7
2009-05-22 00:00:00.000     7
2010-04-16 00:00:00.000     7
2019-02-28 00:00:00.000     7
2019-01-11 00:00:00.000     7
2006-03-14 00:00:00.000     7
2011-03-04 00:00:00.000     7
2001-07-15 00:00:00.000     7
2001-12-05 00:00:00.000     7
2011-02-25 00:00:00.000     7
2011-01-31 00:00:00.000     7
2019-01-07 00:00:00.000     7
2019-01-14 00:00:00.000     7
2016-05-28 00:00:00.000     7
2010-03-08 00:00:00.000     7
2019-01-28 00:00:00.000     7
2001-07-11 00:00:00.000     7
2010-06-06 00:00:00.000     7
2010-06-04 00:00:00.000     7
2003-01-07 00:00:00.000     7
2017-05-27 00:00:00.000     7
2017-02-18 00:00:00.000     7
2002-06-20 00:00:00.000     7
2009-03-09 00:00:00.000     7
2005-04-08 00:00:00.000     7
2005-03-16 00:00:00.000     7
2003-01-27 00:00:00.000     7
2017-02-11 00:00:00.000     7
2008-04-09 00:00:00.000     7
2002-07-25 00:00:00.000     7
2001-01-10 00:00:00.000     7
2008-04-08 00:00:00.000     7
2008-04-07 00:00:00.000     7
2008-03-31 00:00:00.000     7
2001-01-03 00:00:00.000     7
2002-08-04 00:00:00.000     7
2017-01-30 00:00:00.000     7
2008-03-23 00:00:00.000     7
2008-04-23 00:00:00.000     7
2013-08-24 00:00:00.000     7
2008-03-27 00:00:00.000     7
2008-03-19 00:00:00.000     7
2001-01-05 00:00:00.000     7
2008-03-14 00:00:00.000     7
2008-03-01 00:00:00.000     7
2007-11-23 00:00:00.000     7
2006-07-05 00:00:00.000     7
2006-07-12 00:00:00.000     7
2013-09-27 00:00:00.000     7
2008-04-18 00:00:00.000     7
2013-08-07 00:00:00.000     7
2006-06-01 00:00:00.000     7
2008-05-15 00:00:00.000     7
2009-03-04 00:00:00.000     7
2006-06-10 00:00:00.000     7
2009-02-15 00:00:00.000     7
2009-02-05 00:00:00.000     7
2011-03-26 00:00:00.000     7
2013-07-22 00:00:00.000     7
2003-02-19 00:00:00.000     7
2003-02-16 00:00:00.000     7
2002-07-13 00:00:00.000     7
2003-02-20 00:00:00.000     7
2008-05-14 00:00:00.000     7
2013-08-01 00:00:00.000     7
2017-02-15 00:00:00.000     7
2001-01-19 00:00:00.000     7
2008-05-01 00:00:00.000     7
2002-07-15 00:00:00.000     7
2001-01-14 00:00:00.000     7
2001-01-11 00:00:00.000     7
2002-07-18 00:00:00.000     7
2008-04-20 00:00:00.000     7
2006-06-22 00:00:00.000     7
2002-07-22 00:00:00.000     7
2002-05-09 00:00:00.000     7
2001-10-17 00:00:00.000     7
2001-11-16 00:00:00.000     7
2015-01-03 00:00:00.000     7
2015-05-09 00:00:00.000     7
2014-12-29 00:00:00.000     7
2017-03-09 00:00:00.000     7
2001-08-13 00:00:00.000     7
2017-04-21 00:00:00.000     7
2018-06-02 00:00:00.000     7
2017-04-18 00:00:00.000     7
2013-04-28 00:00:00.000     7
2002-06-11 00:00:00.000     7
2017-03-21 00:00:00.000     7
2011-06-08 00:00:00.000     7
2017-04-12 00:00:00.000     7
2024-06-04 00:00:00.000     7
2013-03-28 00:00:00.000     7
2003-06-27 00:00:00.000     7
2006-02-13 00:00:00.000     7
2011-06-06 00:00:00.000     7
2017-03-18 00:00:00.000     7
2015-06-18 00:00:00.000     7
2015-06-04 00:00:00.000     7
2017-03-20 00:00:00.000     7
2017-04-04 00:00:00.000     7
2017-04-03 00:00:00.000     7
2002-11-29 00:00:00.000     7
2015-05-28 00:00:00.000     7
2015-05-10 00:00:00.000     7
2011-05-28 00:00:00.000     7
2014-12-17 00:00:00.000     7
2014-12-24 00:00:00.000     7
2018-04-22 00:00:00.000     7
2018-04-12 00:00:00.000     7
2013-04-21 00:00:00.000     7
2018-04-16 00:00:00.000     7
2018-03-30 00:00:00.000     7
2015-04-26 00:00:00.000     7
2001-07-27 00:00:00.000     7
2018-04-20 00:00:00.000     7
2001-11-13 00:00:00.000     7
2017-04-26 00:00:00.000     7
2011-03-30 00:00:00.000     7
2015-05-16 00:00:00.000     7
2014-12-21 00:00:00.000     7
2006-03-05 00:00:00.000     7
2017-03-07 00:00:00.000     7
2015-04-27 00:00:00.000     7
2009-02-04 00:00:00.000     6
2011-06-17 00:00:00.000     6
2005-04-12 00:00:00.000     6
2013-04-23 00:00:00.000     6
2009-01-22 00:00:00.000     6
2008-04-29 00:00:00.000     6
2011-06-15 00:00:00.000     6
2009-02-01 00:00:00.000     6
2015-05-31 00:00:00.000     6
2024-07-26 00:00:00.000     6
2005-05-10 00:00:00.000     6
2003-01-14 00:00:00.000     6
2006-02-18 00:00:00.000     6
2015-06-12 00:00:00.000     6
2001-01-20 00:00:00.000     6
2013-07-24 00:00:00.000     6
2005-04-17 00:00:00.000     6
2008-05-27 00:00:00.000     6
2011-05-30 00:00:00.000     6
2011-06-03 00:00:00.000     6
2006-03-02 00:00:00.000     6
2008-05-13 00:00:00.000     6
2011-05-29 00:00:00.000     6
2008-05-31 00:00:00.000     6
2013-07-29 00:00:00.000     6
2008-05-17 00:00:00.000     6
2005-04-26 00:00:00.000     6
2003-02-17 00:00:00.000     6
2024-09-05 00:00:00.000     6
2024-08-05 00:00:00.000     6
2003-02-03 00:00:00.000     6
2005-05-18 00:00:00.000     6
2002-08-19 00:00:00.000     6
2005-06-09 00:00:00.000     6
2005-06-13 00:00:00.000     6
2001-10-15 00:00:00.000     6
2015-05-19 00:00:00.000     6
2003-01-18 00:00:00.000     6
2018-05-15 00:00:00.000     6
2008-03-21 00:00:00.000     6
2013-09-01 00:00:00.000     6
2008-03-17 00:00:00.000     6
2017-01-19 00:00:00.000     6
2008-03-03 00:00:00.000     6
2006-07-06 00:00:00.000     6
2008-02-17 00:00:00.000     6
2006-02-16 00:00:00.000     6
2007-11-13 00:00:00.000     6
2015-05-18 00:00:00.000     6
2013-09-02 00:00:00.000     6
2007-04-27 00:00:00.000     6
2007-04-11 00:00:00.000     6
2013-09-15 00:00:00.000     6
2012-05-01 00:00:00.000     6
2013-08-20 00:00:00.000     6
2018-06-01 00:00:00.000     6
2003-02-11 00:00:00.000     6
2003-06-25 00:00:00.000     6
2011-06-29 00:00:00.000     6
2011-07-04 00:00:00.000     6
2011-07-03 00:00:00.000     6
2011-07-11 00:00:00.000     6
2011-07-07 00:00:00.000     6
2011-07-13 00:00:00.000     6
2013-08-12 00:00:00.000     6
2003-02-25 00:00:00.000     6
2014-03-10 00:00:00.000     6
2013-08-15 00:00:00.000     6
2011-07-25 00:00:00.000     6
2005-05-29 00:00:00.000     6
2013-08-14 00:00:00.000     6
2013-08-16 00:00:00.000     6
2018-08-20 00:00:00.000     6
2018-06-26 00:00:00.000     6
2017-02-07 00:00:00.000     6
2014-12-26 00:00:00.000     6
2018-06-10 00:00:00.000     6
2015-07-05 00:00:00.000     6
2002-03-31 00:00:00.000     6
2005-04-02 00:00:00.000     6
2017-05-14 00:00:00.000     6
2010-11-13 00:00:00.000     6
2002-06-13 00:00:00.000     6
2003-04-22 00:00:00.000     6
2024-04-04 00:00:00.000     6
2001-07-16 00:00:00.000     6
2017-05-08 00:00:00.000     6
2010-08-05 00:00:00.000     6
2017-03-11 00:00:00.000     6
2019-01-16 00:00:00.000     6
2017-03-17 00:00:00.000     6
2002-11-07 00:00:00.000     6
2010-04-09 00:00:00.000     6
2017-05-16 00:00:00.000     6
2010-06-05 00:00:00.000     6
2002-05-04 00:00:00.000     6
2010-06-09 00:00:00.000     6
2017-03-16 00:00:00.000     6
2010-05-07 00:00:00.000     6
2001-07-10 00:00:00.000     6
2002-07-10 00:00:00.000     6
2018-03-25 00:00:00.000     6
2010-04-18 00:00:00.000     6
2010-11-29 00:00:00.000     6
2001-12-09 00:00:00.000     6
2003-05-26 00:00:00.000     6
2011-02-03 00:00:00.000     6
2001-11-22 00:00:00.000     6
2024-05-11 00:00:00.000     6
2011-03-25 00:00:00.000     6
2015-01-11 00:00:00.000     6
2014-12-09 00:00:00.000     6
2014-12-10 00:00:00.000     6
2011-03-29 00:00:00.000     6
2001-07-22 00:00:00.000     6
2011-03-16 00:00:00.000     6
2003-05-04 00:00:00.000     6
2011-03-09 00:00:00.000     6
2017-02-27 00:00:00.000     6
2003-05-03 00:00:00.000     6
2016-04-20 00:00:00.000     6
2017-03-02 00:00:00.000     6
2011-03-01 00:00:00.000     6
2024-04-14 00:00:00.000     6
2017-03-06 00:00:00.000     6
2006-02-07 00:00:00.000     6
2011-02-12 00:00:00.000     6
2006-02-03 00:00:00.000     6
2010-04-24 00:00:00.000     6
2010-04-30 00:00:00.000     6
2014-09-14 00:00:00.000     6
2009-05-04 00:00:00.000     6
2014-12-28 00:00:00.000     6
2009-04-10 00:00:00.000     6
2002-06-23 00:00:00.000     6
2001-07-05 00:00:00.000     6
2017-04-22 00:00:00.000     6
2013-06-30 00:00:00.000     6
2009-03-12 00:00:00.000     6
2002-05-30 00:00:00.000     6
2005-03-13 00:00:00.000     6
2017-04-24 00:00:00.000     6
2002-06-22 00:00:00.000     6
2003-01-13 00:00:00.000     6
2003-03-04 00:00:00.000     6
2024-07-08 00:00:00.000     6
2017-07-22 00:00:00.000     6
2009-02-13 00:00:00.000     6
2017-04-28 00:00:00.000     6
2005-03-30 00:00:00.000     6
2013-07-17 00:00:00.000     6
2017-04-17 00:00:00.000     6
2017-07-21 00:00:00.000     6
2002-12-01 00:00:00.000     6
2014-12-16 00:00:00.000     6
2001-07-04 00:00:00.000     6
2019-02-14 00:00:00.000     6
2002-06-01 00:00:00.000     6
2002-06-15 00:00:00.000     6
2001-08-20 00:00:00.000     6
2001-12-23 00:00:00.000     6
2001-08-27 00:00:00.000     6
2014-12-19 00:00:00.000     6
2006-01-20 00:00:00.000     6
2019-03-01 00:00:00.000     6
2011-04-06 00:00:00.000     6
2009-05-28 00:00:00.000     6
2016-06-10 00:00:00.000     6
2003-06-06 00:00:00.000     6
2019-03-11 00:00:00.000     6
2019-03-18 00:00:00.000     6
2001-06-17 00:00:00.000     6
2019-03-06 00:00:00.000     6
2002-06-26 00:00:00.000     6
2014-12-30 00:00:00.000     6
2006-05-28 00:00:00.000     5
2007-02-26 00:00:00.000     5
2007-03-08 00:00:00.000     5
2006-06-20 00:00:00.000     5
2007-03-05 00:00:00.000     5
2006-07-23 00:00:00.000     5
2007-02-22 00:00:00.000     5
2006-09-12 00:00:00.000     5
2006-06-11 00:00:00.000     5
2006-07-08 00:00:00.000     5
2007-03-22 00:00:00.000     5
2006-06-18 00:00:00.000     5
2006-06-27 00:00:00.000     5
2006-07-04 00:00:00.000     5
2011-01-20 00:00:00.000     5
2007-03-17 00:00:00.000     5
2013-08-26 00:00:00.000     5
2013-07-19 00:00:00.000     5
2013-07-23 00:00:00.000     5
2013-07-25 00:00:00.000     5
2013-07-31 00:00:00.000     5
2013-08-08 00:00:00.000     5
2013-08-13 00:00:00.000     5
2013-09-05 00:00:00.000     5
2017-05-23 00:00:00.000     5
2013-09-16 00:00:00.000     5
2013-10-11 00:00:00.000     5
2013-11-02 00:00:00.000     5
2014-03-28 00:00:00.000     5
2014-05-30 00:00:00.000     5
2017-07-24 00:00:00.000     5
2013-07-12 00:00:00.000     5
2013-06-27 00:00:00.000     5
2013-04-26 00:00:00.000     5
2013-04-20 00:00:00.000     5
2013-04-07 00:00:00.000     5
2013-04-11 00:00:00.000     5
2013-04-02 00:00:00.000     5
2013-03-24 00:00:00.000     5
2018-03-29 00:00:00.000     5
2018-04-13 00:00:00.000     5
2018-04-19 00:00:00.000     5
2018-04-28 00:00:00.000     5
2018-05-26 00:00:00.000     5
2012-05-05 00:00:00.000     5
2011-07-19 00:00:00.000     5
2011-07-18 00:00:00.000     5
2011-07-10 00:00:00.000     5
2017-05-22 00:00:00.000     5
2017-05-13 00:00:00.000     5
2007-04-10 00:00:00.000     5
2017-03-03 00:00:00.000     5
2015-07-20 00:00:00.000     5
2017-05-02 00:00:00.000     5
2017-04-14 00:00:00.000     5
2017-04-11 00:00:00.000     5
2017-04-07 00:00:00.000     5
2017-03-28 00:00:00.000     5
2017-05-10 00:00:00.000     5
2014-11-03 00:00:00.000     5
2016-05-26 00:00:00.000     5
2017-02-23 00:00:00.000     5
2017-02-13 00:00:00.000     5
2017-01-31 00:00:00.000     5
2017-01-22 00:00:00.000     5
2017-01-16 00:00:00.000     5
2017-04-29 00:00:00.000     5
2015-07-09 00:00:00.000     5
2015-07-06 00:00:00.000     5
2015-07-02 00:00:00.000     5
2015-06-27 00:00:00.000     5
2015-06-20 00:00:00.000     5
2015-06-13 00:00:00.000     5
2015-06-10 00:00:00.000     5
2015-06-05 00:00:00.000     5
2015-05-30 00:00:00.000     5
2015-05-25 00:00:00.000     5
2015-05-22 00:00:00.000     5
2015-05-05 00:00:00.000     5
2015-01-28 00:00:00.000     5
2015-01-24 00:00:00.000     5
2014-12-14 00:00:00.000     5
2014-12-11 00:00:00.000     5
2011-06-16 00:00:00.000     5
2011-06-14 00:00:00.000     5
2011-06-09 00:00:00.000     5
2009-02-16 00:00:00.000     5
2008-06-05 00:00:00.000     5
2008-06-09 00:00:00.000     5
2009-01-09 00:00:00.000     5
2009-01-17 00:00:00.000     5
2009-01-23 00:00:00.000     5
2009-02-06 00:00:00.000     5
2009-02-22 00:00:00.000     5
2011-04-12 00:00:00.000     5
2009-02-24 00:00:00.000     5
2009-03-01 00:00:00.000     5
2009-02-26 00:00:00.000     5
2009-03-02 00:00:00.000     5
2009-02-28 00:00:00.000     5
2009-03-07 00:00:00.000     5
2008-05-25 00:00:00.000     5
2008-05-22 00:00:00.000     5
2008-05-16 00:00:00.000     5
2008-04-27 00:00:00.000     5
2008-04-19 00:00:00.000     5
2008-03-24 00:00:00.000     5
2008-02-26 00:00:00.000     5
2008-02-22 00:00:00.000     5
2008-01-12 00:00:00.000     5
2007-11-10 00:00:00.000     5
2007-06-04 00:00:00.000     5
2007-06-02 00:00:00.000     5
2007-06-09 00:00:00.000     5
2007-06-01 00:00:00.000     5
2007-05-19 00:00:00.000     5
2007-05-04 00:00:00.000     5
2007-04-20 00:00:00.000     5
2019-04-25 00:00:00.000     5
2009-03-18 00:00:00.000     5
2009-03-23 00:00:00.000     5
2010-06-26 00:00:00.000     5
2011-03-18 00:00:00.000     5
2011-03-14 00:00:00.000     5
2011-03-03 00:00:00.000     5
2011-02-20 00:00:00.000     5
2011-02-08 00:00:00.000     5
2011-02-01 00:00:00.000     5
2011-01-17 00:00:00.000     5
2010-10-29 00:00:00.000     5
2019-01-05 00:00:00.000     5
2019-01-02 00:00:00.000     5
2019-01-09 00:00:00.000     5
2019-01-22 00:00:00.000     5
2010-06-30 00:00:00.000     5
2010-06-18 00:00:00.000     5
2010-05-04 00:00:00.000     5
2009-04-12 00:00:00.000     5
2010-04-14 00:00:00.000     5
2010-04-02 00:00:00.000     5
2019-02-26 00:00:00.000     5
2010-02-16 00:00:00.000     5
2010-01-15 00:00:00.000     5
2019-03-08 00:00:00.000     5
2019-03-21 00:00:00.000     5
2019-04-04 00:00:00.000     5
2019-04-03 00:00:00.000     5
2009-06-02 00:00:00.000     5
2019-04-06 00:00:00.000     5
2009-05-07 00:00:00.000     5
2009-04-21 00:00:00.000     5
2009-04-20 00:00:00.000     5
2014-12-15 00:00:00.000     5
2008-05-12 00:00:00.000     5
2003-01-15 00:00:00.000     5
2001-07-12 00:00:00.000     5
2005-01-03 00:00:00.000     5
2003-06-20 00:00:00.000     5
2005-05-08 00:00:00.000     5
2003-02-06 00:00:00.000     5
2003-07-04 00:00:00.000     5
2001-10-22 00:00:00.000     5
2001-01-16 00:00:00.000     5
2001-01-13 00:00:00.000     5
2005-02-28 00:00:00.000     5
2001-11-07 00:00:00.000     5
2005-03-03 00:00:00.000     5
2002-11-10 00:00:00.000     5
2005-05-11 00:00:00.000     5
2003-01-12 00:00:00.000     5
2001-12-02 00:00:00.000     5
2003-01-19 00:00:00.000     5
2001-12-08 00:00:00.000     5
2002-12-27 00:00:00.000     5
2001-12-11 00:00:00.000     5
2005-02-15 00:00:00.000     5
2024-10-02 00:00:00.000     5
2002-05-28 00:00:00.000     5
2002-06-08 00:00:00.000     5
2002-06-18 00:00:00.000     5
2002-06-14 00:00:00.000     5
2002-06-30 00:00:00.000     5
2002-07-01 00:00:00.000     5
2002-07-06 00:00:00.000     5
2002-07-03 00:00:00.000     5
2001-06-23 00:00:00.000     5
2003-06-11 00:00:00.000     5
2002-07-07 00:00:00.000     5
2002-12-24 00:00:00.000     5
2003-03-20 00:00:00.000     5
2001-09-08 00:00:00.000     5
2005-03-26 00:00:00.000     5
2005-05-23 00:00:00.000     5
2003-02-27 00:00:00.000     5
2005-03-20 00:00:00.000     5
2002-12-29 00:00:00.000     5
2003-04-23 00:00:00.000     5
2005-03-14 00:00:00.000     5
2005-03-15 00:00:00.000     5
2003-03-02 00:00:00.000     5
2005-02-07 00:00:00.000     5
2024-07-09 00:00:00.000     5
2024-07-10 00:00:00.000     5
2003-05-13 00:00:00.000     5
2024-04-28 00:00:00.000     5
2003-05-12 00:00:00.000     5
2001-08-18 00:00:00.000     5
2024-07-17 00:00:00.000     5
2024-09-04 00:00:00.000     5
2024-04-15 00:00:00.000     5
2024-01-20 00:00:00.000     5
2003-05-23 00:00:00.000     5
2003-05-25 00:00:00.000     5
2003-02-01 00:00:00.000     5
2005-04-04 00:00:00.000     5
2001-07-28 00:00:00.000     5
2001-10-02 00:00:00.000     5
2005-04-29 00:00:00.000     5
2002-07-02 00:00:00.000     5
2002-12-15 00:00:00.000     5
2006-02-09 00:00:00.000     5
2001-01-01 00:00:00.000     5
2006-01-15 00:00:00.000     5
2001-01-02 00:00:00.000     5
2005-01-13 00:00:00.000     5
2005-05-30 00:00:00.000     5
2024-04-05 00:00:00.000     5
2002-09-14 00:00:00.000     5
2005-05-22 00:00:00.000     5
2024-08-18 00:00:00.000     5
2006-02-20 00:00:00.000     5
2006-01-28 00:00:00.000     5
2005-05-26 00:00:00.000     5
2024-08-17 00:00:00.000     5
2002-07-08 00:00:00.000     5
2002-07-30 00:00:00.000     5
2004-12-14 00:00:00.000     5
2005-02-17 00:00:00.000     5
2024-02-17 00:00:00.000     5
2005-06-16 00:00:00.000     5
2006-02-23 00:00:00.000     5
2002-07-28 00:00:00.000     5
2005-06-27 00:00:00.000     5
2005-06-10 00:00:00.000     5
2010-04-07 00:00:00.000     4
2001-10-05 00:00:00.000     4
2010-11-24 00:00:00.000     4
2024-04-19 00:00:00.000     4
2009-02-03 00:00:00.000     4
2010-09-08 00:00:00.000     4
2017-04-27 00:00:00.000     4
2008-04-04 00:00:00.000     4
2003-02-07 00:00:00.000     4
2003-03-03 00:00:00.000     4
2011-03-10 00:00:00.000     4
2009-02-10 00:00:00.000     4
2005-05-21 00:00:00.000     4
2024-04-17 00:00:00.000     4
2010-04-12 00:00:00.000     4
2009-01-26 00:00:00.000     4
2011-02-15 00:00:00.000     4
2011-02-24 00:00:00.000     4
2011-02-18 00:00:00.000     4
2011-02-17 00:00:00.000     4
2011-02-21 00:00:00.000     4
2005-04-20 00:00:00.000     4
2008-05-11 00:00:00.000     4
2015-06-25 00:00:00.000     4
2011-03-02 00:00:00.000     4
2010-06-11 00:00:00.000     4
2015-06-26 00:00:00.000     4
2015-06-28 00:00:00.000     4
2013-09-24 00:00:00.000     4
2011-02-28 00:00:00.000     4
2009-01-30 00:00:00.000     4
2010-04-04 00:00:00.000     4
2010-10-06 00:00:00.000     4
2015-07-11 00:00:00.000     4
2008-04-05 00:00:00.000     4
2019-02-16 00:00:00.000     4
2017-04-23 00:00:00.000     4
2005-01-29 00:00:00.000     4
2024-02-10 00:00:00.000     4
2010-03-17 00:00:00.000     4
2001-09-22 00:00:00.000     4
2003-03-17 00:00:00.000     4
2020-03-17 00:00:00.000     4
2011-03-31 00:00:00.000     4
2009-02-18 00:00:00.000     4
2001-09-16 00:00:00.000     4
2010-03-27 00:00:00.000     4
2019-01-23 00:00:00.000     4
2001-09-19 00:00:00.000     4
2005-03-27 00:00:00.000     4
2005-07-18 00:00:00.000     4
2007-05-14 00:00:00.000     4
2001-09-10 00:00:00.000     4
2014-11-14 00:00:00.000     4
2007-05-13 00:00:00.000     4
2013-07-07 00:00:00.000     4
2005-03-29 00:00:00.000     4
2024-05-13 00:00:00.000     4
2002-11-16 00:00:00.000     4
2005-06-11 00:00:00.000     4
2005-06-04 00:00:00.000     4
2011-02-14 00:00:00.000     4
2005-04-21 00:00:00.000     4
2005-05-15 00:00:00.000     4
2015-07-19 00:00:00.000     4
2009-02-14 00:00:00.000     4
2007-06-12 00:00:00.000     4
2010-06-17 00:00:00.000     4
2007-06-15 00:00:00.000     4
2009-02-09 00:00:00.000     4
2009-02-11 00:00:00.000     4
2015-07-18 00:00:00.000     4
2003-02-28 00:00:00.000     4
2011-03-17 00:00:00.000     4
2013-07-14 00:00:00.000     4
2002-08-01 00:00:00.000     4
2015-06-14 00:00:00.000     4
2001-09-28 00:00:00.000     4
2015-06-07 00:00:00.000     4
2005-06-21 00:00:00.000     4
2008-03-09 00:00:00.000     4
2001-12-01 00:00:00.000     4
2013-09-13 00:00:00.000     4
2010-12-11 00:00:00.000     4
2003-01-25 00:00:00.000     4
2017-05-05 00:00:00.000     4
2002-07-05 00:00:00.000     4
2008-01-07 00:00:00.000     4
2010-05-12 00:00:00.000     4
2001-11-15 00:00:00.000     4
2013-08-23 00:00:00.000     4
2001-11-18 00:00:00.000     4
2024-02-16 00:00:00.000     4
2010-12-27 00:00:00.000     4
2011-01-03 00:00:00.000     4
2001-11-14 00:00:00.000     4
2005-05-09 00:00:00.000     4
2001-11-05 00:00:00.000     4
2013-09-19 00:00:00.000     4
2010-05-22 00:00:00.000     4
2008-03-05 00:00:00.000     4
2001-12-30 00:00:00.000     4
2013-08-30 00:00:00.000     4
2003-01-21 00:00:00.000     4
2010-05-23 00:00:00.000     4
2013-09-12 00:00:00.000     4
2010-11-21 00:00:00.000     4
2024-02-08 00:00:00.000     4
2010-05-19 00:00:00.000     4
2003-01-26 00:00:00.000     4
2008-02-28 00:00:00.000     4
2002-07-14 00:00:00.000     4
2010-05-20 00:00:00.000     4
2010-06-16 00:00:00.000     4
2008-02-07 00:00:00.000     4
2010-12-07 00:00:00.000     4
2010-05-25 00:00:00.000     4
2018-01-06 00:00:00.000     4
2010-05-31 00:00:00.000     4
2014-12-27 00:00:00.000     4
2008-03-12 00:00:00.000     4
2014-12-13 00:00:00.000     4
2001-10-28 00:00:00.000     4
2024-04-11 00:00:00.000     4
2005-06-24 00:00:00.000     4
2024-04-08 00:00:00.000     4
2007-11-20 00:00:00.000     4
2015-05-21 00:00:00.000     4
2002-08-05 00:00:00.000     4
2001-10-09 00:00:00.000     4
2007-11-12 00:00:00.000     4
2007-11-02 00:00:00.000     4
2011-01-25 00:00:00.000     4
2005-04-30 00:00:00.000     4
2019-02-13 00:00:00.000     4
2015-05-29 00:00:00.000     4
2019-01-01 00:00:00.000     4
2014-04-10 00:00:00.000     4
2018-02-25 00:00:00.000     4
2013-07-30 00:00:00.000     4
2013-09-07 00:00:00.000     4
2014-04-07 00:00:00.000     4
2015-06-09 00:00:00.000     4
2008-03-22 00:00:00.000     4
2001-10-08 00:00:00.000     4
2003-01-23 00:00:00.000     4
2001-10-11 00:00:00.000     4
2001-09-14 00:00:00.000     4
2001-11-01 00:00:00.000     4
2015-01-08 00:00:00.000     4
2008-03-20 00:00:00.000     4
2014-12-07 00:00:00.000     4
2024-04-02 00:00:00.000     4
2005-01-01 00:00:00.000     4
2010-06-03 00:00:00.000     4
2024-10-05 00:00:00.000     4
2002-07-23 00:00:00.000     4
2007-11-14 00:00:00.000     4
2011-01-23 00:00:00.000     4
2001-10-19 00:00:00.000     4
2015-05-17 00:00:00.000     4
2001-10-14 00:00:00.000     4
2007-11-27 00:00:00.000     4
2011-01-18 00:00:00.000     4
2013-10-14 00:00:00.000     4
2014-03-16 00:00:00.000     4
2007-05-11 00:00:00.000     4
2007-05-21 00:00:00.000     4
2007-05-07 00:00:00.000     4
2006-06-26 00:00:00.000     4
2017-05-28 00:00:00.000     4
2009-04-27 00:00:00.000     4
2006-07-20 00:00:00.000     4
2008-06-02 00:00:00.000     4
2006-07-26 00:00:00.000     4
2018-07-02 00:00:00.000     4
2009-05-02 00:00:00.000     4
2018-06-28 00:00:00.000     4
2010-08-22 00:00:00.000     4
2019-03-05 00:00:00.000     4
2006-07-14 00:00:00.000     4
2001-01-06 00:00:00.000     4
2009-05-08 00:00:00.000     4
2005-02-14 00:00:00.000     4
2019-01-10 00:00:00.000     4
2005-02-13 00:00:00.000     4
2019-03-17 00:00:00.000     4
2019-01-20 00:00:00.000     4
2008-05-30 00:00:00.000     4
2006-06-30 00:00:00.000     4
2006-07-01 00:00:00.000     4
2019-03-10 00:00:00.000     4
2017-01-28 00:00:00.000     4
2017-02-06 00:00:00.000     4
2018-03-24 00:00:00.000     4
2008-06-03 00:00:00.000     4
2019-03-03 00:00:00.000     4
2017-02-19 00:00:00.000     4
2024-05-26 00:00:00.000     4
2016-06-14 00:00:00.000     4
2003-06-22 00:00:00.000     4
2010-01-29 00:00:00.000     4
2008-05-26 00:00:00.000     4
2009-04-18 00:00:00.000     4
2010-01-27 00:00:00.000     4
2024-08-26 00:00:00.000     4
2010-01-31 00:00:00.000     4
2003-07-12 00:00:00.000     4
2013-03-18 00:00:00.000     4
2006-08-27 00:00:00.000     4
2001-01-07 00:00:00.000     4
2019-04-12 00:00:00.000     4
2010-01-28 00:00:00.000     4
2009-04-22 00:00:00.000     4
2000-12-28 00:00:00.000     4
2000-12-30 00:00:00.000     4
2010-01-25 00:00:00.000     4
2013-03-27 00:00:00.000     4
2013-03-14 00:00:00.000     4
2006-07-03 00:00:00.000     4
2017-01-27 00:00:00.000     4
2019-02-27 00:00:00.000     4
2006-06-28 00:00:00.000     4
2006-01-19 00:00:00.000     4
2014-08-08 00:00:00.000     4
2006-05-14 00:00:00.000     4
2019-03-30 00:00:00.000     4
2018-05-02 00:00:00.000     4
2010-07-18 00:00:00.000     4
2018-04-26 00:00:00.000     4
2012-05-15 00:00:00.000     4
2006-01-26 00:00:00.000     4
2018-05-16 00:00:00.000     4
2006-01-30 00:00:00.000     4
2018-05-06 00:00:00.000     4
2024-08-19 00:00:00.000     4
2006-02-04 00:00:00.000     4
2018-05-04 00:00:00.000     4
2006-02-08 00:00:00.000     4
2019-01-21 00:00:00.000     4
2006-02-05 00:00:00.000     4
2005-02-18 00:00:00.000     4
2019-03-29 00:00:00.000     4
2006-02-11 00:00:00.000     4
2018-05-08 00:00:00.000     4
2016-12-20 00:00:00.000     4
2012-05-04 00:00:00.000     4
2006-01-09 00:00:00.000     4
2018-04-25 00:00:00.000     4
2016-09-12 00:00:00.000     4
2006-06-24 00:00:00.000     4
2018-06-13 00:00:00.000     4
2018-04-07 00:00:00.000     4
2005-04-19 00:00:00.000     4
2005-03-02 00:00:00.000     4
2018-06-09 00:00:00.000     4
2009-05-15 00:00:00.000     4
2008-06-08 00:00:00.000     4
2019-03-13 00:00:00.000     4
2017-01-20 00:00:00.000     4
2018-04-14 00:00:00.000     4
2009-05-26 00:00:00.000     4
2018-06-06 00:00:00.000     4
2006-06-07 00:00:00.000     4
2006-06-04 00:00:00.000     4
2018-04-17 00:00:00.000     4
2009-05-25 00:00:00.000     4
2006-06-05 00:00:00.000     4
2019-03-19 00:00:00.000     4
2019-03-20 00:00:00.000     4
2018-05-31 00:00:00.000     4
2018-05-30 00:00:00.000     4
2011-08-10 00:00:00.000     4
2009-04-09 00:00:00.000     4
2017-02-20 00:00:00.000     4
2024-01-23 00:00:00.000     4
2024-06-29 00:00:00.000     4
2024-07-01 00:00:00.000     4
2017-04-05 00:00:00.000     4
2007-03-31 00:00:00.000     4
2017-03-29 00:00:00.000     4
2007-03-27 00:00:00.000     4
2005-03-08 00:00:00.000     4
2010-03-09 00:00:00.000     4
2003-05-06 00:00:00.000     4
2002-08-28 00:00:00.000     4
2005-02-08 00:00:00.000     4
2010-03-07 00:00:00.000     4
2017-08-13 00:00:00.000     4
2007-03-16 00:00:00.000     4
2017-03-19 00:00:00.000     4
2010-08-20 00:00:00.000     4
2024-07-16 00:00:00.000     4
2011-06-02 00:00:00.000     4
2014-10-19 00:00:00.000     4
2007-03-06 00:00:00.000     4
2007-03-07 00:00:00.000     4
2003-01-10 00:00:00.000     4
2014-05-15 00:00:00.000     4
2007-04-09 00:00:00.000     4
2002-12-20 00:00:00.000     4
2006-02-19 00:00:00.000     4
2007-04-25 00:00:00.000     4
2007-05-10 00:00:00.000     4
2024-02-12 00:00:00.000     4
2007-05-05 00:00:00.000     4
2005-01-31 00:00:00.000     4
2007-05-09 00:00:00.000     4
2007-05-02 00:00:00.000     4
2007-04-26 00:00:00.000     4
2007-04-30 00:00:00.000     4
2013-06-21 00:00:00.000     4
2008-05-18 00:00:00.000     4
2003-03-28 00:00:00.000     4
2005-03-21 00:00:00.000     4
2019-02-15 00:00:00.000     4
2017-04-13 00:00:00.000     4
2019-02-18 00:00:00.000     4
2007-04-23 00:00:00.000     4
2005-03-19 00:00:00.000     4
2007-04-16 00:00:00.000     4
2009-02-21 00:00:00.000     4
2002-12-19 00:00:00.000     4
2019-02-02 00:00:00.000     4
2004-03-29 00:00:00.000     4
2019-02-24 00:00:00.000     4
2024-07-11 00:00:00.000     4
2017-03-14 00:00:00.000     4
2017-05-21 00:00:00.000     4
2011-07-06 00:00:00.000     4
2017-03-15 00:00:00.000     4
2010-02-10 00:00:00.000     4
2005-03-04 00:00:00.000     4
2016-05-06 00:00:00.000     4
2001-07-20 00:00:00.000     4
2009-04-05 00:00:00.000     4
2010-07-10 00:00:00.000     4
2011-07-20 00:00:00.000     4
2002-12-28 00:00:00.000     4
2017-05-26 00:00:00.000     4
2001-07-14 00:00:00.000     4
2013-04-27 00:00:00.000     4
2011-07-22 00:00:00.000     4
2013-04-19 00:00:00.000     4
2017-02-17 00:00:00.000     4
2001-07-19 00:00:00.000     4
2011-07-30 00:00:00.000     4
2016-05-27 00:00:00.000     4
2001-07-07 00:00:00.000     4
2009-04-08 00:00:00.000     4
2013-04-15 00:00:00.000     4
2017-05-24 00:00:00.000     4
2003-06-02 00:00:00.000     4
2011-07-09 00:00:00.000     4
2017-03-01 00:00:00.000     4
2005-01-05 00:00:00.000     4
2003-05-19 00:00:00.000     4
2017-03-13 00:00:00.000     4
2005-03-10 00:00:00.000     4
2008-05-21 00:00:00.000     4
2009-03-20 00:00:00.000     4
2011-06-18 00:00:00.000     4
2009-03-24 00:00:00.000     4
2011-06-20 00:00:00.000     4
2001-08-08 00:00:00.000     4
2011-06-26 00:00:00.000     4
2005-04-15 00:00:00.000     4
2009-03-30 00:00:00.000     4
2011-06-28 00:00:00.000     4
2017-02-28 00:00:00.000     4
2008-05-24 00:00:00.000     4
2009-04-02 00:00:00.000     4
2009-03-29 00:00:00.000     4
2007-04-22 00:00:00.000     4
2010-06-21 00:00:00.000     3
2019-01-30 00:00:00.000     3
2010-06-27 00:00:00.000     3
2010-06-23 00:00:00.000     3
2010-06-19 00:00:00.000     3
2013-11-20 00:00:00.000     3
2010-07-11 00:00:00.000     3
2019-01-24 00:00:00.000     3
2010-06-20 00:00:00.000     3
2018-01-28 00:00:00.000     3
2005-01-11 00:00:00.000     3
2024-06-20 00:00:00.000     3
2010-06-13 00:00:00.000     3
2019-02-08 00:00:00.000     3
2010-04-05 00:00:00.000     3
2010-03-30 00:00:00.000     3
2005-02-03 00:00:00.000     3
2019-02-23 00:00:00.000     3
2010-02-24 00:00:00.000     3
2017-08-04 00:00:00.000     3
2010-02-19 00:00:00.000     3
2010-02-12 00:00:00.000     3
2010-02-06 00:00:00.000     3
2019-03-04 00:00:00.000     3
2017-07-23 00:00:00.000     3
2010-01-18 00:00:00.000     3
2017-07-19 00:00:00.000     3
2005-02-09 00:00:00.000     3
2019-03-23 00:00:00.000     3
2019-03-09 00:00:00.000     3
2005-02-11 00:00:00.000     3
2019-03-12 00:00:00.000     3
2019-03-15 00:00:00.000     3
2014-06-23 00:00:00.000     3
2019-03-16 00:00:00.000     3
2014-07-08 00:00:00.000     3
2005-02-16 00:00:00.000     3
2019-03-26 00:00:00.000     3
2014-08-06 00:00:00.000     3
2019-03-27 00:00:00.000     3
2014-08-07 00:00:00.000     3
2019-02-12 00:00:00.000     3
2010-03-18 00:00:00.000     3
2014-04-19 00:00:00.000     3
2010-05-05 00:00:00.000     3
2005-01-12 00:00:00.000     3
2019-02-04 00:00:00.000     3
2010-06-08 00:00:00.000     3
2010-06-10 00:00:00.000     3
2017-12-27 00:00:00.000     3
2005-01-18 00:00:00.000     3
2010-05-28 00:00:00.000     3
2010-05-21 00:00:00.000     3
2010-05-17 00:00:00.000     3
2014-02-08 00:00:00.000     3
2010-05-11 00:00:00.000     3
2010-05-01 00:00:00.000     3
2017-11-17 00:00:00.000     3
2010-04-10 00:00:00.000     3
2010-05-06 00:00:00.000     3
2010-05-02 00:00:00.000     3
2010-04-28 00:00:00.000     3
2003-01-06 00:00:00.000     3
2005-01-26 00:00:00.000     3
2014-03-25 00:00:00.000     3
2003-01-04 00:00:00.000     3
2010-04-20 00:00:00.000     3
2010-04-19 00:00:00.000     3
2005-01-24 00:00:00.000     3
2014-03-31 00:00:00.000     3
2010-04-06 00:00:00.000     3
2010-07-22 00:00:00.000     3
2003-02-02 00:00:00.000     3
2004-12-27 00:00:00.000     3
2011-06-19 00:00:00.000     3
2011-06-25 00:00:00.000     3
2011-06-23 00:00:00.000     3
2003-06-01 00:00:00.000     3
2011-07-01 00:00:00.000     3
2011-07-08 00:00:00.000     3
2011-06-30 00:00:00.000     3
2003-06-04 00:00:00.000     3
2013-04-29 00:00:00.000     3
2003-06-10 00:00:00.000     3
2011-07-12 00:00:00.000     3
2024-08-07 00:00:00.000     3
2011-07-16 00:00:00.000     3
2011-07-28 00:00:00.000     3
2011-08-01 00:00:00.000     3
2011-07-29 00:00:00.000     3
2003-06-12 00:00:00.000     3
2011-08-12 00:00:00.000     3
2013-04-09 00:00:00.000     3
2011-08-18 00:00:00.000     3
2011-08-19 00:00:00.000     3
2003-06-28 00:00:00.000     3
2024-07-23 00:00:00.000     3
2024-07-27 00:00:00.000     3
2003-07-02 00:00:00.000     3
2011-06-21 00:00:00.000     3
2003-03-31 00:00:00.000     3
2004-03-30 00:00:00.000     3
2024-06-17 00:00:00.000     3
2024-09-16 00:00:00.000     3
2003-04-14 00:00:00.000     3
2024-06-28 00:00:00.000     3
2024-06-30 00:00:00.000     3
2003-04-21 00:00:00.000     3
2003-05-02 00:00:00.000     3
2003-04-29 00:00:00.000     3
2003-04-28 00:00:00.000     3
2003-05-01 00:00:00.000     3
2003-05-09 00:00:00.000     3
2024-09-08 00:00:00.000     3
2024-09-03 00:00:00.000     3
2003-05-05 00:00:00.000     3
2003-05-14 00:00:00.000     3
2011-06-05 00:00:00.000     3
2011-06-13 00:00:00.000     3
2003-05-17 00:00:00.000     3
2003-05-28 00:00:00.000     3
2018-08-08 00:00:00.000     3
2003-07-06 00:00:00.000     3
2019-01-19 00:00:00.000     3
2018-06-14 00:00:00.000     3
2018-04-11 00:00:00.000     3
2018-06-08 00:00:00.000     3
2018-04-18 00:00:00.000     3
2012-03-08 00:00:00.000     3
2012-03-21 00:00:00.000     3
2018-06-05 00:00:00.000     3
2012-04-14 00:00:00.000     3
2018-06-04 00:00:00.000     3
2018-05-29 00:00:00.000     3
2003-07-21 00:00:00.000     3
2024-08-14 00:00:00.000     3
2018-04-29 00:00:00.000     3
2012-05-06 00:00:00.000     3
2018-04-27 00:00:00.000     3
2012-08-25 00:00:00.000     3
2024-08-20 00:00:00.000     3
2018-05-21 00:00:00.000     3
2018-05-25 00:00:00.000     3
2012-06-29 00:00:00.000     3
2018-05-11 00:00:00.000     3
2018-05-03 00:00:00.000     3
2018-04-06 00:00:00.000     3
2018-04-08 00:00:00.000     3
2018-03-15 00:00:00.000     3
2018-06-16 00:00:00.000     3
2018-07-20 00:00:00.000     3
2011-09-14 00:00:00.000     3
2013-03-26 00:00:00.000     3
2018-03-14 00:00:00.000     3
2003-07-10 00:00:00.000     3
2013-03-17 00:00:00.000     3
2013-03-16 00:00:00.000     3
2018-07-09 00:00:00.000     3
2018-03-23 00:00:00.000     3
2011-10-05 00:00:00.000     3
2018-07-06 00:00:00.000     3
2018-03-26 00:00:00.000     3
2018-07-03 00:00:00.000     3
2013-03-03 00:00:00.000     3
2018-06-27 00:00:00.000     3
2024-08-09 00:00:00.000     3
2013-02-17 00:00:00.000     3
2018-06-15 00:00:00.000     3
2018-04-02 00:00:00.000     3
2018-06-19 00:00:00.000     3
2018-03-31 00:00:00.000     3
2024-09-29 00:00:00.000     3
2024-09-19 00:00:00.000     3
2024-06-05 00:00:00.000     3
2018-02-27 00:00:00.000     3
2003-01-16 00:00:00.000     3
2013-09-25 00:00:00.000     3
2010-10-24 00:00:00.000     3
2010-11-02 00:00:00.000     3
2003-01-11 00:00:00.000     3
2013-09-18 00:00:00.000     3
2010-10-31 00:00:00.000     3
2010-11-10 00:00:00.000     3
2010-11-11 00:00:00.000     3
2013-09-17 00:00:00.000     3
2013-09-14 00:00:00.000     3
2013-09-06 00:00:00.000     3
2013-09-09 00:00:00.000     3
2013-09-03 00:00:00.000     3
2010-11-28 00:00:00.000     3
2010-12-03 00:00:00.000     3
2013-08-29 00:00:00.000     3
2010-12-12 00:00:00.000     3
2010-12-10 00:00:00.000     3
2003-01-22 00:00:00.000     3
2003-01-24 00:00:00.000     3
2013-10-03 00:00:00.000     3
2010-10-20 00:00:00.000     3
2024-06-09 00:00:00.000     3
2013-10-02 00:00:00.000     3
2013-11-12 00:00:00.000     3
2013-11-13 00:00:00.000     3
2004-12-16 00:00:00.000     3
2013-11-04 00:00:00.000     3
2010-08-15 00:00:00.000     3
2019-01-12 00:00:00.000     3
2003-01-08 00:00:00.000     3
2013-11-01 00:00:00.000     3
2013-10-29 00:00:00.000     3
2010-09-06 00:00:00.000     3
2010-09-13 00:00:00.000     3
2024-04-06 00:00:00.000     3
2013-10-27 00:00:00.000     3
2018-12-31 00:00:00.000     3
2018-02-05 00:00:00.000     3
2013-10-18 00:00:00.000     3
2010-09-24 00:00:00.000     3
2010-10-02 00:00:00.000     3
2010-10-05 00:00:00.000     3
2010-10-04 00:00:00.000     3
2010-10-07 00:00:00.000     3
2010-12-23 00:00:00.000     3
2010-12-20 00:00:00.000     3
2013-08-25 00:00:00.000     3
2013-08-19 00:00:00.000     3
2011-02-22 00:00:00.000     3
2003-02-18 00:00:00.000     3
2011-03-07 00:00:00.000     3
2003-02-21 00:00:00.000     3
2011-03-08 00:00:00.000     3
2024-04-22 00:00:00.000     3
2011-03-15 00:00:00.000     3
2003-03-01 00:00:00.000     3
2011-03-13 00:00:00.000     3
2024-04-30 00:00:00.000     3
2024-05-01 00:00:00.000     3
2003-02-22 00:00:00.000     3
2011-03-27 00:00:00.000     3
2013-07-08 00:00:00.000     3
2024-05-14 00:00:00.000     3
2003-03-15 00:00:00.000     3
2003-03-11 00:00:00.000     3
2024-05-24 00:00:00.000     3
2024-05-29 00:00:00.000     3
2003-03-06 00:00:00.000     3
2024-06-02 00:00:00.000     3
2011-02-26 00:00:00.000     3
2004-11-08 00:00:00.000     3
2024-04-13 00:00:00.000     3
2003-01-28 00:00:00.000     3
2011-01-05 00:00:00.000     3
2003-01-30 00:00:00.000     3
2011-01-15 00:00:00.000     3
2011-01-19 00:00:00.000     3
2018-03-02 00:00:00.000     3
2017-06-11 00:00:00.000     3
2013-08-04 00:00:00.000     3
2011-01-24 00:00:00.000     3
2011-01-22 00:00:00.000     3
2013-08-09 00:00:00.000     3
2013-07-26 00:00:00.000     3
2024-04-07 00:00:00.000     3
2011-01-30 00:00:00.000     3
2011-01-27 00:00:00.000     3
2024-04-12 00:00:00.000     3
2003-02-09 00:00:00.000     3
2011-02-06 00:00:00.000     3
2011-02-09 00:00:00.000     3
2003-02-13 00:00:00.000     3
2003-02-05 00:00:00.000     3
2019-04-02 00:00:00.000     3
2009-04-24 00:00:00.000     3
2001-10-25 00:00:00.000     3
2007-11-16 00:00:00.000     3
2024-02-05 00:00:00.000     3
2007-11-17 00:00:00.000     3
2015-05-23 00:00:00.000     3
2007-11-25 00:00:00.000     3
2001-10-16 00:00:00.000     3
2007-11-21 00:00:00.000     3
2001-10-18 00:00:00.000     3
2001-10-29 00:00:00.000     3
2007-11-30 00:00:00.000     3
2007-12-01 00:00:00.000     3
2001-10-21 00:00:00.000     3
2015-05-01 00:00:00.000     3
2001-11-02 00:00:00.000     3
2001-11-09 00:00:00.000     3
2001-11-17 00:00:00.000     3
2008-01-08 00:00:00.000     3
2019-09-21 00:00:00.000     3
2008-01-18 00:00:00.000     3
2001-12-29 00:00:00.000     3
2008-01-23 00:00:00.000     3
2002-06-02 00:00:00.000     3
2015-05-24 00:00:00.000     3
2001-10-10 00:00:00.000     3
2008-01-30 00:00:00.000     3
2007-10-26 00:00:00.000     3
2015-07-12 00:00:00.000     3
2001-09-24 00:00:00.000     3
2001-10-07 00:00:00.000     3
2007-07-23 00:00:00.000     3
2020-02-24 00:00:00.000     3
2015-06-29 00:00:00.000     3
2015-06-24 00:00:00.000     3
2015-06-30 00:00:00.000     3
2020-02-15 00:00:00.000     3
2001-10-01 00:00:00.000     3
2015-06-16 00:00:00.000     3
2007-09-19 00:00:00.000     3
2015-06-15 00:00:00.000     3
2025-01-22 00:00:00.000     3
2015-06-06 00:00:00.000     3
2015-06-11 00:00:00.000     3
2015-06-08 00:00:00.000     3
2015-06-03 00:00:00.000     3
2015-06-01 00:00:00.000     3
2015-06-02 00:00:00.000     3
2007-10-25 00:00:00.000     3
2002-06-05 00:00:00.000     3
2002-06-28 00:00:00.000     3
2007-06-16 00:00:00.000     3
2005-06-05 00:00:00.000     3
2005-05-28 00:00:00.000     3
2005-05-25 00:00:00.000     3
2005-05-13 00:00:00.000     3
2005-05-16 00:00:00.000     3
2002-08-16 00:00:00.000     3
2005-05-05 00:00:00.000     3
2005-05-07 00:00:00.000     3
2002-08-17 00:00:00.000     3
2008-05-07 00:00:00.000     3
2002-08-12 00:00:00.000     3
2005-05-04 00:00:00.000     3
2005-04-25 00:00:00.000     3
2002-08-07 00:00:00.000     3
2005-04-28 00:00:00.000     3
2005-04-18 00:00:00.000     3
2008-05-20 00:00:00.000     3
2002-08-21 00:00:00.000     3
2005-04-16 00:00:00.000     3
2005-04-22 00:00:00.000     3
2008-06-11 00:00:00.000     3
2024-10-26 00:00:00.000     3
2005-05-31 00:00:00.000     3
2002-08-03 00:00:00.000     3
2002-06-27 00:00:00.000     3
2005-06-08 00:00:00.000     3
2008-02-14 00:00:00.000     3
2008-02-05 00:00:00.000     3
2008-02-11 00:00:00.000     3
2008-02-16 00:00:00.000     3
2005-07-06 00:00:00.000     3
2008-02-24 00:00:00.000     3
